{"run":89,"commit":"9ae22f7","metric":0.0,"metrics":{"new_residual_core_modules":5,"new_python_tests":24,"full_python_tests":423,"counter_js_tests":16,"collision_js_tests":1,"mock_transitions":8,"mock_optimizer_step_calls":2,"mock_reset_steps":120,"new_original_game_control_ticks":0,"new_original_game_reset_ticks":0,"original_game_learning_updates":0,"new_summits":0,"new_deaths":0,"learned_climber_benefit":0,"study_contract_gate_passed":1,"proposed_training_seeds":3,"proposed_transitions_per_seed":131072,"proposed_session_seconds":7200,"proposed_usd_cap":0.06,"active_reservations":0,"owned_mock_elapsed_seconds":4.265867710113525,"all_closed_estimated_usd":0.4564241866528988},"status":"discard","timestamp":1791183778075,"segment":0,"confidence":null,"description":"Fresh residualPPO core contracts/trainer/admission/causal reference validation pass423tests and8step2update MOCK-only accounting; bounded per-case storage amendment preserves completed smoke, no original-game training or goal improvement","asi":{"hypothesis":"A fixed explicit-context residualPPO study can safely compare learned control against its exact hand-designed zeroactor baseline with bounded actual work.","rollback_reason":"Primary completion remains0 and no game learner was trained. Core implementation/contract checks only; retain tooling, no policy promotion or inference that baseline holds are learning.","evidence":"artifacts/residual_research_contract_20261005_v1/verification.json","storage_amendment":"artifacts/residual_research_contract_20261005_v1/storage_amendment.json","preparation_errors":"artifacts/residual_research_contract_20261005_v1/preparation_errors.json","fixed3seeds_131072each_PPO1024_128_3_lrpoint0001_KLpoint01_online222RMS":true,"max3072optcalls_257resets_each_ordinaryspawn_frame1_horizon1800_rawreward":true,"fresh_reset15001_noise14100_14105_absent_prior_artifacts_before_declaration":true,"samezeroactor_baseline_finalonly_causalraw_actor_issued_applied_physical_reference_traces":true,"holds_actualclock_geometry_speed_contact_reconstructed_original_goalgates_unchanged":true,"directGym_one120reset_case_no_autoreset_scope_change":true,"source_prior_context_preflight_ledger_deadline_liveparent_durableclaim_grants_no_resume":true,"sequential_validate_durablebackup_and_ownedautopause_callbacks_tested_not_workerwired":true,"mock8steps2optimizer120reset_are_NOTgamephysics_orclimber_learning":true,"preparation_KLexpectation_failure_preserved_only_mockearlystop_disabled_fullstudyunchanged":true,"postsmoke_boundedcase_hashindex_storage_only_learner_ASTexact_no_retry_deadlineextension":true,"previoussix_learning_contracts_goalprojection_exact_goal0":true,"allold_game_env_reward_adapter_scaffold_source_unchanged":true,"proposed2hour_point06cap_NOTactive_reservation_or_paidlaunch":true,"no_remote_write_deployment_GPU_newprovider_publicrelease_substantive_localtraining":true,"ledger_bytes_unchanged_seven_closed":true,"independent_paused_epoch":1791183778.0751169,"space_source_revision":"8044439043a1725dc5911577c85096cd04ddc4ae","actual_session":"onstate-20261004-v1","actual_mode":"onstate_study","actual_context":"ed3a53c349d08380401bc2a27d466ea58c378210","closed_historical_deadline_unchanged":1791144140.4793909,"next_action_hint":"Implement dedicated private residualHFworker/dispatcher/pinnedfreshcontext_prior_source/runtimeCPUUpgrade_neversleep_onereplica_resources/durableclaim_case_checkpointbackup/watchdog_autopause. Currentcallbackexecutiontested, HFwiringunimplemented. Requiredpreflight unit_collision_resources_benchmark_zeroactororiginalfidelity_adapterpipeline_mockoptimizer; boundedsecretstripped_ownedchildren, context_mode_failure_deadline_backup_pause tests first, no substantivelocaltraining/contactcounteraudit/directtrainer/oldsessionresume. Onlythen reverifyprice_actualSpacevars_source, freshimmutablebundle_context_session and explicit<=7200s_point06ledgerreservationunder10; intentionally deployONLYpreflight. Durablepassedfreshpreflight+independentPAUSED before intentionalfulltraining. Keepfixedstudy_cases_caps_gates_andfullgoal."}}
{"run":90,"commit":"51b3837","metric":0.0,"metrics":{"goal_active_python_tests":454,"inactive_residual_tests_excluded":12,"original_fidelity_total_ticks":3240,"goal_model_game_training_transitions":0,"mock_sac_cycles":1,"mock_optimizer_calls":3,"paid_reservations_created":0,"loops_restarted":0,"original_summits":0,"all_closed_estimated_usd":0.4564241866528988},"status":"discard","description":"Approved independent goal-SAC/HER/legal-prefix system implemented and validated; reference-fast prefix+feedback passes, no game training/learner benefit; cheaper-agent pilot handoff ready","timestamp":1791189849218,"segment":0,"confidence":null,"asi":{"hypothesis":"Goal conditioning, same-suffix hindsight and actual legal return curriculum address exploration/recovery gaps better than the superseded fixed-opening residual approach","rollback_reason":"Implementation validation only; primary summit completion unchanged and no goal learner trained. Preserve tested system, never call scaffold or engineering checks learned progress.","designer_session":"2e405d38-60cd-4412-b784-732ab4e4d1c2","evidence":"artifacts/goal_build_20261005_v1/build_report.json","runner_prompt":"docs/GOAL_RUNNER_PROMPT.md","partial_residual_work_preserved_inactive":true,"user_cancelled_old94_invocation_loop":true,"next_action_hint":"Cheaper agent executes one fresh goal-SAC pilot under <=.30USD and10paid-hour reservation within10USD cumulative. Freshprivate source/context/session/deadline/runtime/source preflight plus independentPAUSED before goal_study. Seeds21/22/23 sequential, stop first failed physical gate; no indefinite loop/resume/budget renewal.","fresh_goal_cases_reset18001_noise17100_17106":true,"fixed620_schema_no_RMS_or_queryflags":true,"issued_actions_and_warmup_eligibility_contract":true,"HER_all_current_next_frame_goal_coords_same_suffix":true,"legal_prefixes_not_state_placement_scored_play_never_uses_prefix":true,"prefix_tolerances_unchanged":true,"CPU_testenv_original_environment_untouched":true,"full_test_discovery_one_inactive_residual_failure_reported":true,"space_last_verified_PAUSED_onstate_complete":true,"cost_ledger_unchanged":true}}
{"run":91,"commit":"6e5c3f9","metric":0.0,"metrics":{"goal_active_python_tests":461,"new_regression_tests":6,"inactive_residual_tests_excluded":12,"counter_js_tests":16,"collision_js_tests":1,"original_game_ticks":0,"goal_model_game_training_transitions":0,"paid_reservations_created":0,"loops_started":0,"original_summits":0},"status":"discard","description":"Post-build correctness review: fix cap finalization, nominal prefix hash consistency, cascading recovery, concurrent backup timing; update bounded runner handoff","timestamp":1791192202859,"segment":0,"confidence":null,"asi":{"hypothesis":"Correct implementation and bounded execution are prerequisites, not evidence of learned climbing competence.","rollback_reason":"No experiment or learned improvement. Retain validated corrections; original summit metric remains zero.","reviewed_base_commit":"6e5c3f9","changes_uncommitted":true,"evidence":"docs/GOAL_REVIEW.md","runner_prompt":"docs/GOAL_RUNNER_PROMPT.md","physical_gates_tolerances_and_caps_unchanged":true,"partial_training_cannot_promote_next_seed":true,"hf_calls":0,"space_state_independently_rechecked":false,"cost_ledger_unchanged":true,"next_action_hint":"Use reviewed working tree, not base commit alone. Fresh-source preflight and independently verified PAUSED before one bounded pilot. No automatic budget renewal or indefinite loop."}}
{"run":92,"commit":"6e5c3f9","metric":0.0,"metrics":{"goal_active_python_tests":462,"inactive_residual_tests_excluded":12,"goal_pilot_seeds_started":1,"goal_pilot_seeds_completed":0,"seed21_learner_transitions":39936,"seed21_sac_cycles":17920,"seed21_physics_total":88313,"physical_evaluations_run":0,"first_ledge_gate_measured":0,"y180_hold_measured":0,"deaths_measured":0,"summits_measured":0,"original_summits":0,"paid_reservations_created":1,"paid_reservations_closed":1,"pilot_attempt1_elapsed_usd":0.023171,"all_closed_estimated_usd":0.479595,"loops_started":1,"loops_cancelled":1},"status":"discard","description":"Goal-SAC/HER pilot attempt1: fresh preflight passed on fixed source; seed21 trained 39936 learner transitions then crashed at first checkpoint on np.bool_ supervisor serialization; auto-paused, no physical evaluation, reservation closed $0.0232; narrow fix + regression test ready but not redeployed","timestamp":1791195792033,"segment":0,"confidence":null,"asi":{"hypothesis":"Goal-conditioned SAC/HER with legal-prefix curriculum can be executed safely under a bounded fresh reservation before any scientific conclusion.","rollback_reason":"Implementation bug in checkpoint serialization stopped seed21 before any physical evaluation. No learned physical outcome exists; primary summit metric unchanged.","session":"goal-20261005-v1","source_space_revision":"01eace30e5561321efb1f14bdcb4a342af87bd9c","preflight_context_revision":"a8c6d0c271bf11c9ecefb244c7e13626555806b1","approved_context_revision":"8a1fdfa76ab524dfc240ef8a124b6dbd54b5e3bb","preflight_first_attempt":"failed unit_tests on platform-dependent inactive residual test; evidence preserved at goal-20261005-v1/operator/preflight_retry_1/; fixed by explicit FACTORY_DESKTOP_CDP_PORT in the test","preflight_second_attempt":"all six checks true; 461 tests OK remotely; prefix fidelity 600+60 both backends; 8544 preflight physics ticks","failure":"TypeError: Object of type bool is not JSON serializable in checkpoint() writing supervisor.json; waypoints() emitted np.bool_ for non-central anchors","fix":"explicit bool() casts in research/goal_archive.waypoints() + regression test test_noncentral_waypoint_anchors_serialize_for_supervisor_checkpoint","fix_validated_locally_only":true,"fix_deployed":false,"resume_or_deadline_extension":false,"temporary_monitoring_loop_cancelled":true,"space_independently_verified_paused":true,"evidence":"artifacts/goal_deploy_20261005_v1/failure_review/close.json","next_action_hint":"Retry only under fresh explicit authorization: new session/context/deadline/reservation from the fixed source; fresh preflight; seed21 from scratch. Never resume, extend or auto-launch."}}
{"run":93,"commit":"fc329e8","metric":0.0,"metrics":{"goal_active_python_tests":466,"inactive_residual_tests_excluded":12,"goal_pilot_seeds_started":1,"goal_pilot_seeds_completed":0,"seed21_learner_transitions":160000,"seed21_sac_cycles":77952,"seed21_physics_total":315959,"seed21_checkpoints_durable":4,"evaluation_cases_uploaded":9,"evaluation_cases_expected":10,"physical_evaluations_completed":0,"first_ledge_gate_measured":0,"y180_hold_measured":0,"deaths_measured":0,"summits_measured":0,"original_summits":0,"paid_reservations_created":1,"paid_reservations_closed":1,"pilot_attempt2_elapsed_usd":0.06034,"all_closed_estimated_usd":0.53993,"loops_started":1,"loops_cancelled":1},"status":"discard","description":"Goal-SAC/HER pilot attempt2: fresh preflight passed; seed21 completed the FULL training contract (160000 learner/77952 cycles/315959 physics, 4 durable checkpoints) then evaluation was killed by the provider 128 commits/hour limit caused by 30s backup cadence; backup retry/cadence fix + 4 regression tests ready; not redeployed","timestamp":1791204903101,"segment":0,"confidence":null,"asi":{"hypothesis":"With checkpoint serialization fixed, a full seed can train under the bounded reservation and produce a scored physical evaluation.","rollback_reason":"No physical gate result: the evaluation was stopped by an infrastructure rate limit after training completed. Primary summit metric unchanged.","session":"goal-20261005-v2","source_space_revision":"f413aa63159fe341879586afd1a605080d6d4d6f","preflight_context_revision":"e87f0cf76f1024d7c16ddb582be6dde54c6a99ae","approved_context_revision":"5e812175d24d9c56f6691584d98a1daca0533aeb","serialization_fix_proven_live":"checkpoint_40000/80000/120000/160000 all durable","failure":"provider repository-commit rate limit 128/hour exceeded by 30s backup cadence (122 and 86 commits in failing hours); one failed flush treated as fatal","fix":"deploy/goal_worker.py TransientBackupError, one backup per new checkpoint, 300s periodic cadence, exponential backoff retry, durable_backup at decision points","fix_validated_locally_only":true,"fix_deployed":false,"resume_or_deadline_extension":false,"temporary_monitoring_loop_cancelled":true,"space_independently_verified_paused":true,"evidence":"artifacts/goal_deploy_20261005_v2/failure_review/close.json","next_action_hint":"Attempt3 under fresh session/reservation from the backup-fixed source; new preflight; seed21 from scratch. Never resume, extend or auto-launch."}}
{"run":94,"commit":"b39aa89","metric":0.0,"metrics":{"goal_active_python_tests":466,"inactive_residual_tests_excluded":12,"goal_pilot_seeds_started":1,"goal_pilot_seed_evaluations_completed":1,"seed21_learner_transitions":160000,"seed21_sac_cycles":77952,"seed21_physics_total":357109,"evaluation_cases":10,"evaluation_ticks":36000,"first_ledge_successes":0,"nominal_height180_hold90":0,"deaths":0,"summits":0,"original_summits":0,"physical_gate_passed":0,"pilot_gate_passed":0,"paid_reservations_created":1,"paid_reservations_closed":1,"pilot_attempt3_elapsed_usd":0.10548,"all_closed_estimated_usd":0.64541,"loops_started":1,"loops_cancelled":1},"status":"discard","description":"Goal-SAC/HER pilot attempt3: seed21 completed full training (160000 learner/77952 cycles/357109 physics) and the complete learned-only 10-case reference evaluation; physical gates failed (0/10 first-ledge, no Y180 hold, 0 deaths/summits); protocol stopped seeds22/23; PAUSED verified; reservation closed $0.10548","timestamp":1791217893277,"segment":0,"confidence":null,"asi":{"hypothesis":"Goal-conditioned SAC/HER with a legal-prefix curriculum can learn reliable first-ledge competence from ordinary spawn under the bounded pilot.","rollback_reason":"Completed contract-valid evaluation failed the physical gates: 0/10 first-ledge holds and no nominal Y180 hold. Primary summit metric unchanged; no seed22/23 admission.","session":"goal-20261005-v3","source_space_revision":"978f95ab9c392770ebac303b1bfcbee0156b880f","preflight_context_revision":"35cbc089e2f5bf4ff40299bb8e9309e38380959d","approved_context_revision":"5ec69d95902f941a52b6d2c4900a8b93f4be7982","training_complete":true,"stop_reason":"learner_limit","retained_gains":[-2,44.57004674330618,53.780675319705324,1.6059384129459993,-3,73.3323898978335,46.528682591331034,47.69262950000545,79.5546767821743,16.50059862929674],"outcome":"Policy moves and sometimes climbs to Y~100 but never reaches/holds the first ledge box (305-335,100-112); nominal ends at spawn height (-2).","rate_limit_recurred":false,"provider_backup_cadence_commits_per_hour":"~12 (300s floor held)","fix_validated_live":"300s sync cadence + one backup per checkpoint prevented the attempt2 rate-limit failure","temporary_monitoring_loop_cancelled":true,"space_independently_verified_paused":true,"evidence":"artifacts/goal_deploy_20261005_v3/complete_review/close.json","next_action_hint":"No further batch authorized. A next step requires a separate bounded authorization and a design-level decision (the pilot gate was unmet), not more diagnostics or an automatic rerun."}}
{"run":95,"commit":"a3bcdc2","metric":0.0,"metrics":{"goal_active_python_tests":466,"inactive_residual_tests_excluded":12,"scale_probe_seeds_started":1,"scale_probe_evaluations_completed":1,"seed21_learner_transitions":480000,"seed21_sac_cycles":237952,"seed21_physics_total":993290,"evaluation_cases":10,"first_ledge_successes":0,"nominal_height180_hold90":0,"deaths":0,"summits":0,"original_summits":0,"physical_gate_passed":0,"pilot_gate_passed":0,"paid_reservations_created":1,"paid_reservations_closed":1,"scale_probe_elapsed_usd":0.18862,"all_closed_estimated_usd":0.83403,"loops_started":1,"loops_cancelled":1},"status":"discard","description":"Scale probe v4: 480k-learner single-seed run completed the full training contract and the complete learned-only 10-case evaluation; physical gates failed the same way (0/10 first-ledge, no Y180 hold, 0 deaths/summits); 3x data did not resolve the fixed-point collapse; reservation closed $0.18862","timestamp":1791249835754,"segment":0,"confidence":null,"asi":{"hypothesis":"Three times the learner budget (480k) resolves the fixed-point collapse seen at 160k and reaches the first-ledge gate.","rollback_reason":"Falsified for this budget range: same failure mode, actually more consistent (8/10 cases ended at exactly +27 = waypoint-2 height). No gate result; primary summit metric unchanged.","session":"goal-20261006-v4","source_space_revision":"24c9dbe99e0d1552f445a7e5ef4b7ca110ab3","retained_gains":[8.909142152173,27,-3,27,16.522299813775355,48.28871729328749,27,27,-2,27],"diagnosis":"Best route never improved from the scaffold (score104, parentNone): the learner never produced a stable hold above Y104. The blocker is the (279,48)->(322,104) ledge-wall swing; pure SAC exploration at std~0.09 did not find it in either budget.","rate_limit_recurred":false,"temporary_monitoring_loop_cancelled":true,"space_independently_verified_paused":true,"evidence":"artifacts/goal_deploy_20261006_v4/complete_review/close.json","next_action_hint":"Per predeclared framework: curriculum/exploration change targeting the ledge swing (denser route goals, stagnation resampling, or demo-seeded exploration). One change per probe; same caps and gates."}}
{"run":96,"commit":"561ae76","metric":0.0,"metrics":{"goal_active_python_tests":470,"inactive_residual_tests_excluded":12,"demo_seed_probe_seeds_started":1,"evaluations_completed":1,"seed21_learner_transitions":480000,"seed21_sac_cycles":237952,"demo_seed_learner_transitions":51632,"seed21_physics_total":1016407,"evaluation_cases":10,"first_ledge_successes":0,"nominal_height180_hold90":0,"deaths":0,"summits":0,"original_summits":0,"physical_gate_passed":0,"pilot_gate_passed":0,"paid_reservations_created":1,"paid_reservations_closed":1,"probe_elapsed_usd":0.27012,"all_closed_estimated_usd":1.10415,"loops_started":1,"loops_cancelled":1},"status":"discard","description":"Demo-seeded exploration probe v5: 480k learner with 51632 demo-seeded ticks; full training + complete learned-only evaluation; still 0/10 first-ledge and no Y180 hold, but ALL cases retained positive height (2.0-43.5, nominal 43.5 best yet) instead of collapsing; archive best still scaffold (parent=None)","timestamp":1791282722536,"segment":0,"confidence":null,"asi":{"hypothesis":"State-matched demo-action bursts during training exploration let the policy sample the coordinated ledge-wall swing that pure Gaussian exploration (sigma~0.09) cannot, and reach the first-ledge gate.","rollback_reason":"Partially supported: retention improved everywhere and nominal gained +43.5 (best nominal across all attempts) but the ledge hold still never occurred; no gate result. Primary summit metric unchanged.","session":"goal-20261006-v5","source_space_revision":"f0e85e73cc7a756609b99f48698d18be717c5f85","retained_gains":[43.52821524170224,23.508377681494494,26.502268236933894,26.507016566114416,2,26.505766913451787,23.569214015436522,24.518687471575575,26.51985778452577,23.522037136733395],"diagnosis":"The wall->ledge swing segment spans demo indices318-441 (~123 ticks) but demo bursts are capped at60 ticks, so the swing is fragmented: ~60 ticks of demo, then ~300 expected ticks before the next burst. The policy rarely observes a complete swing transition. Training trace maxY168.2/maxX856.5 with demo help, but learned-only evaluation tops out at Y64.5 nominal.","rate_limit_recurred":false,"temporary_monitoring_loop_cancelled":true,"space_independently_verified_paused":true,"evidence":"artifacts/goal_deploy_20261006_v5/complete_review/close.json","next_action_hint":"v6 single change: burst_ticks 60->180 so one burst covers the full 123-tick swing plus margin. All else unchanged."}}
