{"type": "config", "name": "Original-game Getting Over It completion", "metricName": "worst_seed_reference_completion_rate", "metricUnit": "fraction", "bestDirection": "higher"}
{"run": 1, "commit": "b3bf197", "metric": 0.0, "metrics": {}, "status": "keep", "description": "Untrained physical-completion baseline; pilot still incomplete", "timestamp": 1791061338384, "segment": 0, "confidence": null, "asi": {"hypothesis": "Untrained ordinary-start policies do not complete the original reference game", "evidence": "artifacts/remote_pilot_review_20261003T204729761166Z/runs/ppo_absolute_seed_0/evaluation.json:before", "source_snapshot": "b3bf197090f1fb5219e5cce70a0dbfcca6576ce1", "complete_training_seed_cohorts": 0, "partial_campaign": true, "next_action_hint": "Finish the nine-run pilot before selecting the next control/exploration hypothesis"}}
{"run": 2, "commit": "b3bf197", "metric": 0.0, "metrics": {"worst_seed_first_ledge_rate": 0, "seed_2_first_ledge_rate": 0.1111111111111111, "full_climb_cases_completed": 0, "evaluation_deaths": 0}, "status": "discard", "description": "Completed PPO cohort fails robust first-ledge promotion; one legal perturbed-case hold", "timestamp": 1791062637997, "segment": 0, "confidence": null, "asi": {"hypothesis": "PPO absolute four-tick control learns a robust first-ledge hold under the frozen pilot objective", "rollback_reason": "Failed predeclared worst-seed hold gate: 0/9, 0/9, 1/9; no reference full completions", "next_action_hint": "Finish SAC cohorts; retain the isolated action_noise_2 legal learned ledge hold as evidence, not promotion", "evidence": "artifacts\\remote_ppo_cohort_20261003T212305324947Z", "complete_training_seed_cohorts": 1, "variant": "ppo_absolute", "seed_2_success_case": "action_noise_2", "seed_2_final_pose": [328.74908191142396, 104], "source_snapshot": "b3bf197090f1fb5219e5cce70a0dbfcca6576ce1"}}
{"run": 3, "commit": "b3bf197", "metric": 0.0, "metrics": {}, "status": "crash", "description": "Provider idle sleep interrupted SAC; three PPO results preserved, no SAC competence inference", "timestamp": 1791063880214, "segment": 0, "confidence": null, "asi": {"hypothesis": "Unattended nine-run pilot can complete within its fixed paid CPU budget", "rollback_reason": "HF one-hour idle sleep stopped SAC at a partial checkpoint; no replay-buffer integrity exists for silent resume", "next_action_hint": "Fresh source-pinned v2 preflight with provider never-sleep, corrected live backups, exact optimizer accounting and unchanged absolute deadline", "evidence": "artifacts/provider_sleep_incident_20261003T213845836829Z", "old_session": "poc-20261004-v1", "replacement_session": "poc-20261004-v2", "deadline_epoch": 1791116468.8050392, "compute_failure_not_algorithm_failure": true}}
{"run": 4, "commit": "34c3585", "metric": 0.0, "metrics": {"worst_seed_first_ledge_rate": 0, "seed_2_first_ledge_rate": 0.1111111111111111, "reference_full_completions": 0, "recorded_edge_replay_max_position_error": 0}, "status": "discard", "description": "Replacement PPO cohort fails robustness gate; recorded-action edge support is real but portable inference is brittle", "timestamp": 1791068604542, "segment": 0, "confidence": null, "asi": {"hypothesis": "Fresh source-pinned PPO cohort learns robust first-ledge retention", "rollback_reason": "Frozen v1 hold gate remains 0/9,0/9,1/9 with no reference game completion; portable local inference of an edge case fails", "next_action_hint": "Finish SAC matrix; predeclare secondary support and isolate tiny-action/inference sensitivity before expanding samples", "evidence": "artifacts/v2_ppo_cohort_20261003T225813655321Z", "secondary_replay_evidence": "artifacts/recorded_edge_replay_20261003T230135948311Z", "local_inference_failure": "artifacts/learned_edge_audit_20261003T225954450734Z", "source_snapshot": "34c35854133294f97fef741479641f571371b8a3", "session": "poc-20261004-v2", "same_seed_recovery_rerun_not_independent_new_replication": true}}
{"run": 5, "commit": "34c3585", "metric": 0.0, "metrics": {"worst_seed_first_ledge_rate": 0, "reference_full_completions": 0, "median_retained_gain_each_seed": 0, "optimizer_step_calls_per_seed": 264912}, "status": "discard", "description": "Completed absolute-action SAC cohort fails retention gate and remains physically inactive", "timestamp": 1791075562913, "segment": 0, "confidence": null, "asi": {"hypothesis": "SAC absolute four-tick control acquires robust first-ledge retention under the frozen pilot settings", "rollback_reason": "All three complete training seeds have 0/9 holds, no full completions and median retained gain 0; nominal hammer never contacts terrain", "next_action_hint": "Finish SAC velocity parameterization; diagnose stalled policy/exploration/entropy or controlled timing/skill acquisition rather than scaling this configuration", "evidence": "artifacts/v2_absolute_cohorts_20261004T005803065949Z", "source_snapshot": "34c35854133294f97fef741479641f571371b8a3", "session": "poc-20261004-v2", "variant": "sac_absolute", "all_replay_buffers_present": true, "training_seed_count": 3, "not_a_global_SAC_or_solvability_claim": true}}
{"run": 6, "commit": "34c3585", "metric": 0.0, "metrics": {"worst_seed_first_ledge_rate": 0, "reference_full_completions": 0, "optimizer_step_calls_per_seed": 264912, "complete_pilot_runs": 9, "complete_pilot_final_cases": 81}, "status": "discard", "description": "Completed velocity-action SAC cohort fails retention gate; full pilot validated and automatically paused", "timestamp": 1791081974447, "segment": 0, "confidence": null, "asi": {"hypothesis": "Velocity-action SAC learns robust first-platform retention at the frozen four-tick sample budget", "rollback_reason": "All velocity seeds have 0/9 holds and no full completions; retained endpoint gains do not consistently improve on their own untrained baselines", "next_action_hint": "Complete the predeclared timing-aware trainer, physical exposure accounting, reactive fidelity and fresh bounded session; no sample/hardware scaling or pilot promotion", "evidence": "artifacts/v2_complete_review_20261004T024603257492Z", "dataset_revision": "7c29b01d5cae53606f252511337a70b07a09699c", "source_snapshot": "34c35854133294f97fef741479641f571371b8a3", "session": "poc-20261004-v2", "variant": "sac_velocity", "training_seed_count": 3, "untrained_median_retained_each_seed": [26.53935482129591, 22.711346635868836, 25.395055139548816], "trained_median_retained_each_seed": [6.0, 31.91085241758298, 3.5054883674533173], "all_final_binary_companions_present": true, "binary_review_not_cross_host_reload": true, "pilot_followup_eligible_variants": [], "space_verified_paused": true}}
{"run": 7, "commit": "422e95a", "metric": 0.0, "metrics": {"python_tests_passed": 128, "actual_controlled_ticks_each_smoke": 256, "reset_ticks_each_smoke": 120, "policy_optimizer_calls_each_smoke": 4}, "status": "keep", "description": "Pipeline-only timing trainer validation; preserve accounting and settings, not a competence improvement", "timestamp": 1791083214298, "segment": 0, "confidence": null, "asi": {"hypothesis": "The prepared one/four-tick PPO arms can execute matched physical-time pipeline budgets with passive actual-work accounting and compatible saved policy/normalizer", "validation_only": true, "not_competence_or_full_study": true, "primary_metric_carried_forward_from_completed_pilot": true, "not_metric_comparable_to_learning_runs": true, "evidence": "artifacts/timing_trainer_smoke_20261004T0302556740868Z/verification.json", "source_snapshot_note": "Local working tree based on 422e95a; exact source hashes recorded in both smoke manifests", "repeat_1_transitions": 256, "repeat_4_transitions": 64, "saved_observation_dim": 217, "policy_normalizer_gamma_match": true, "physical_time_gae_match": true, "bitwise_PPO_and_SAC_accounting_weight_equality": true, "remote_study_execution_deliberately_blocked": true, "next_action_hint": "Integrate calibrated secondary support and pass contact-rich timing-specific closed-loop fidelity before a distinct bounded runner/session/preflight; do not deploy or scale the failed pilot"}}
{"run": 8, "commit": "5951612", "metric": 0.0, "metrics": {"python_tests_passed": 137, "contact_rich_timing_cases": 6, "maximum_measured_reference_fast_error": 0.0, "actual_controlled_ticks_each_smoke": 256, "policy_optimizer_calls_each_smoke": 4}, "status": "keep", "description": "Validation-only secondary metric integration and contact-rich timing fidelity; no learning effectiveness claim", "timestamp": 1791084336923, "segment": 0, "confidence": null, "asi": {"hypothesis": "Adding the calibrated secondary diagnostic leaves learning state unchanged and the future timing evaluator matches independent reactive-network reference/fast rollouts", "validation_only": true, "not_competence_or_full_study": true, "not_metric_comparable_to_learning_runs": true, "primary_metric_carried_forward_from_completed_pilot": true, "source_snapshot_note": "Local working tree based on 5951612; exact source hashes saved in fidelity report and smoke manifests", "evidence": "artifacts/timing_fidelity_20261004T032235733238Z/report.json", "metric_weight_equality_evidence": "artifacts/secondary_metrics_smoke_20261004T0324127860597Z/verification.json", "bitwise_policy_and_normalization_preserved": true, "legacy_pilot_gate_unchanged": true, "production_evaluator_trace_matches_independent_rollout": true, "contact_cases_ordinary_start_no_placement": true, "untrained_reactive_network_fixture": true, "no_upper_route_or_cross_host_fidelity_claim": true, "remote_study_execution_deliberately_blocked": true, "next_action_hint": "Implement a distinct source-pinned timing runner/aggregator and new bounded-session admission before any private remote preflight/launch; keep the completed pilot PAUSED and its artifact prefix immutable"}}
{"run": 9, "commit": "12b20cc", "metric": 0.0, "metrics": {"python_tests_passed": 146, "declared_future_runs": 6, "launched_future_runs": 0}, "status": "keep", "description": "Validation-only frozen timing contract and strict artifact checker; no job launch or competence claim", "timestamp": 1791085553765, "segment": 0, "confidence": null, "asi": {"hypothesis": "A separate declared timing protocol can validate source/settings/actual work and legal reference perturbations without weakening the pilot gates or promoting smoke evidence", "validation_only": true, "not_competence_or_full_study": true, "not_metric_comparable_to_learning_runs": true, "primary_metric_carried_forward_from_completed_pilot": true, "source_snapshot_note": "Local working tree based on 12b20cc; exact source hashes saved in the prepared campaign", "evidence": "artifacts/timing_campaign_20261004T034517908263Z/checker_verification.json", "prepared_contract": "artifacts/timing_campaign_20261004T034517908263Z/timing_campaign.json", "real_smoke_case_checks_pass": true, "smoke_full_study_acceptance_refused": true, "missing_runs_remain_incomplete": true, "final_goal_and_scale_never_authorized": true, "module_has_no_execute_operation": true, "remote_study_execution_deliberately_blocked": true, "next_action_hint": "Implement and test remote-only sequential execution plus worker/new-session source/budget/preflight admission before reserving/deploying; never restart or extend completed v2"}}
{"run": 10, "commit": "b1ff389", "metric": 0.0, "metrics": {"python_tests_passed": 157, "execution_safeguard_tests": 11, "finalization_reserve_seconds": 60, "launched_future_runs": 0}, "status": "keep", "description": "Validation-only remote executor/admission foundation; worker/trainer wiring remains disabled", "timestamp": 1791086647335, "segment": 0, "confidence": null, "asi": {"hypothesis": "A remote-only sequential timing executor can enforce fresh source/preflight/reservation/deadline/cost context and refuse silent resume before any dispatch", "validation_only": true, "not_competence_or_full_study": true, "not_metric_comparable_to_learning_runs": true, "primary_metric_carried_forward_from_completed_pilot": true, "evidence": "artifacts/timing_execution_checks_20261004T040407335016Z/verification.json", "source_snapshot_note": "Local working tree based on b1ff389; no executor connected to the live worker", "initial_validation_failure": "Three Windows fixture errors from global os.name mocking and missing POSIX attributes; corrected with scoped host predicate and signal mocks", "actual_completed_and_unreserved_sessions_refused": true, "sequential_failure_and_interruption_refused": true, "credentials_stripped_from_children": true, "worker_and_trainer_admission_not_wired": true, "live_space_unchanged_paused": true, "next_action_hint": "Integrate/test fresh worker timing modes, durable source/ledger/preflight transport and trainer admission before any capped private preflight; preserve completed v2 deadline/artifacts"}}
{"run": 11, "commit": "22e841f", "metric": 0.0, "metrics": {"python_tests_passed": 168, "actual_controlled_ticks_each_smoke": 256, "policy_optimizer_calls_each_smoke": 4, "remote_future_jobs": 0}, "status": "keep", "description": "Validation-only worker timing modes and parent-bound trainer admission; no deployment or reservation", "timestamp": 1791088069569, "segment": 0, "confidence": null, "asi": {"hypothesis": "The worker can transport pinned secret-free context and require durable fresh preflight/dispatch plus parent-bound trainer grants without changing physical learning state", "validation_only": true, "not_competence_or_full_study": true, "not_metric_comparable_to_learning_runs": true, "primary_metric_carried_forward_from_completed_pilot": true, "evidence": "artifacts/worker_admission_smoke_20261004T0425133084373Z/verification.json", "source_snapshot_note": "Local working tree based on 22e841f; exact source hashes retained in both smoke manifests and allowlisted bundle", "mocked_worker_preflight_and_dispatch_pass": true, "pinned_context_and_stale_interrupted_session_refusals_pass": true, "terminal_sessions_preserved_without_relaunch": true, "timing_monitor_excludes_imported_prior_pilot": true, "undurable_execution_claim_refused": true, "parent_pid_arguments_output_and_claim_bound": true, "saved_run_admission_sessions_checked": true, "bitwise_smoke_policy_preserved": true, "live_space_unchanged_paused": true, "next_action_hint": "Verify price, reserve a distinct capped timing session and privately publish source/context while preserving PAUSED; run timing_preflight, inspect durable checks and PAUSED before intentional study mode"}}
{"run": 12, "commit": "362327f", "metric": 0.0, "metrics": {"snapshot_python_tests_passed": 168, "maximum_new_compute_reservation_usd": 0.48, "total_elapsed_plus_reserved_usd": 0.6725470195174217, "full_timing_study_launched": 0}, "status": "keep", "description": "Operational validation: fresh private timing preflight started with pinned source/context and fixed budget; study not launched", "timestamp": 1791089063606, "segment": 0, "confidence": null, "asi": {"hypothesis": "A fresh source-pinned CPU Upgrade timing preflight can establish unattended fidelity/resources before admitting the declared timing comparison", "validation_only": true, "not_competence_or_full_study": true, "not_metric_comparable_to_learning_runs": true, "primary_metric_carried_forward_from_completed_pilot": true, "session": "timing-20261004-v1", "source_space_revision": "362327f3281811b924089251aa67438fe64dc31e", "context_dataset_revision": "1df89ec0fe48a579c234fed9e4a2e26085279811", "initial_status_dataset_revision": "bcdd369f039cb3cdfaf0fa654e378d209e423f9c", "start_epoch": 1791088706.4052017, "deadline_epoch": 1791146306.4052017, "source_game_assets_match_exact_bundle": true, "owned_runtime_never_sleep_one_replica": true, "preflight_checks_not_yet_passed": true, "completed_v2_evidence_and_deadline_unchanged": true, "evidence": "artifacts/timing_deployment_20261004T044058033509Z/initial_status_verification.json", "next_action_hint": "Do not change the running deployment. Review all eight durable timing preflight checks and PAUSED before an explicit context/mode update; no incomplete/failed preflight or interrupted resume"}}
{"run": 13, "commit": "362327f", "metric": 0.0, "metrics": {"remote_preflight_checks_passed": 8, "raw_fidelity_cases": 17, "reactive_fidelity_cases": 6, "maximum_measured_fidelity_error": 0, "declared_timing_runs": 6, "reference_full_completions_observed": 0}, "status": "keep", "description": "Operational validation: timing preflight passed and admitted six-run study started under unchanged source/budget/deadline; no effectiveness result", "timestamp": 1791090090085, "segment": 0, "confidence": null, "asi": {"hypothesis": "Finer reactive control timing improves platform retention under the predeclared matched nominal physical exposure and optimizer-call budget", "validation_and_launch_only": true, "no_effectiveness_result_yet": true, "not_metric_comparable_to_completed_learning_runs": true, "primary_metric_carried_forward_from_completed_pilot": true, "session": "timing-20261004-v1", "source_space_revision": "362327f3281811b924089251aa67438fe64dc31e", "preflight_dataset_revision": "471eadaf676a498b52cabb5962312e3da94e378b", "study_context_revision": "80884fcb942397b783c9562b2cf3b987879a21a8", "deadline_epoch": 1791146306.4052017, "independent_paused_verification_epoch": 1791089935.6895523, "effective_cpus": 8, "effective_ram_bytes": 32000000000, "changed_only_context_and_mode": true, "no_hardware_source_deadline_change_or_resume": true, "evidence": "artifacts/timing_preflight_review_20261004T045845231549Z/review.json", "start_evidence": "artifacts/timing_preflight_review_20261004T045845231549Z/study_start.json", "next_action_hint": "Preserve active source/settings; inspect pinned durable claim/manifests/progress and validate complete timing results, never infer competence from reward/peaks or silently resume interruption"}}
{"run": 14, "commit": "362327f", "metric": 0.0, "metrics": {"audited_transition": 174800, "actual_controlled_ticks": 174800, "reset_settling_ticks": 2040, "durable_checkpoint_pairs": 4, "completed_timing_runs": 0}, "status": "keep", "description": "Operational audit: first one-tick run has valid admission/settings/tick accounting and durable checkpoints; no effectiveness result", "timestamp": 1791091130564, "segment": 0, "confidence": null, "asi": {"hypothesis": "The admitted one-tick arm executes its frozen settings with accurate controlled/reset work and stable backup evidence", "audit_only": true, "not_competence_or_full_study": true, "not_metric_comparable_to_completed_learning_runs": true, "primary_metric_carried_forward_from_completed_pilot": true, "session": "timing-20261004-v1", "active_run": "ppo_absolute_repeat_1_seed_3", "dataset_revision": "0520df2b4c6ab9e04f83e9fb71769900c23c61e3", "evidence": "artifacts/timing_active_audit_20261004T051847531397Z/audit.json", "manifest_admission_source_reward_gae_match": true, "complete_prefix_cadence_and_reset_accounting_pass": true, "checkpoint_binary_reload_not_performed": true, "no_complete_reference_result_yet": true, "live_source_settings_budget_unchanged": true, "next_action_hint": "Wait for a complete manifest/training/evaluation result in a later scheduled snapshot; keep the matrix running unchanged and report physical outcomes, not telemetry peaks"}}
{"run": 15, "commit": "362327f", "metric": 0.0, "metrics": {"completed_timing_runs": 1, "repeat_1_seed_3_central_holds": 0, "repeat_1_seed_3_secondary_holds": 1, "reference_cases": 9, "full_completions": 0, "evaluation_deaths": 0, "median_retained_gain": 0, "actual_controlled_ticks": 393216, "reset_settling_ticks": 4440, "actual_policy_optimizer_calls": 3840}, "status": "keep", "description": "Partial timing-study evidence: one-tick seed 3 has one declared secondary hold but no robust/nominal/full-climb success", "timestamp": 1791092410070, "segment": 0, "confidence": null, "asi": {"hypothesis": "Finer reactive timing improves platform support under the frozen matched physical exposure/optimizer-call protocol", "partial_campaign": true, "complete_seed_cohorts": 0, "not_a_timing_arm_or_robustness_conclusion": true, "primary_metric_carried_forward_until_complete_cohorts": true, "session": "timing-20261004-v1", "variant": "ppo_absolute_repeat_1", "training_seed": 3, "dataset_revision": "112cb595ce2f2f42895b1e01d0185577c964f7b8", "evidence": "artifacts/timing_first_result_verified_20261004T054007933164Z/review.json", "selected_secondary_case": "action_noise_5", "selected_final_pose": [302.11500626387476, 104], "selected_retained_gain": 83, "selected_first_hold_seconds": 5.833333333333333, "checkpoint_portability_not_verified": true, "operator_size_limit_refusal_corrected": "Immutable 81,189,517-byte one-tick JSON exceeded initial 32 MiB operator cap; bounded 128 MiB metadata-checked audit passed without changing worker/source", "next_action_hint": "Finish paired repeat-4 and all declared seeds, keep gates/settings unchanged and actual exposure/compute explicit; no promotion or scaling from this isolated hold"}}
