{"run":41,"commit":"95df8e1","metric":0.0,"metrics":{"recorded_controlled_ticks":84,"reset_ticks":120,"partial_case_rollouts":1,"training_updates":0,"required_remote_physical_prefix_maximum_error":0.0,"undeclared_reward_potential_difference":1.734723475976807e-18,"off_policy_prefix_maximum_action_difference":8.940696716308594e-8,"retained_gain_at_abort":4.513048980217164,"focused_tests_passed":23,"explicit_comparison_regression_tests_passed":4,"all_closed_estimated_usd":0.4074241866528988},"status":"crash","description":"Recorded-action replay prematurely stops on undeclared extra cross-host reward field; required physical prefix remains exact, fast/full replay not run","timestamp":1791123836091,"segment":0,"confidence":null,"asi":{"hypothesis":"Replaying original recorded controls can isolate physical portability from saved-policy feedback differences","rollback_reason":"Operator compared all remote info instead of the frozen physical subset; tick84 reward_potential_after differs by1.734723475976807e-18. Preserve failure, do not infer physics mismatch or bypass feedback gates.","diagnostic_only":true,"primary_metric_carried_forward":true,"no_skill_or_goal_promotion":true,"evidence":"artifacts/imitation_recorded_action_20261004T141840833438Z/verification.json","executed_plan_sha256":"37404c5fd21468da7a8e952f5ab28b0f4c04a862651ae74a9661c4d4406a73dc","executed_script_sha256":"0f8d3412fc6c70ec9529b7c0c189de36a96d60adf7bd2ad00ab429656be74fe0","required_physical_fields_exact_through84ticks":true,"recorded_applied_controls_exact":true,"fast_rollout_not_started":true,"full_held_trajectory_not_reproduced":true,"prefix_pose":[-29.305503223814473,25.513048980217164],"both_hold_flags_false_no_summit_or_death_at_abort":true,"predictions_never_feed_physics":true,"remote_full_observations_absent_no_equal_input_or_torch_cause_claim":true,"no_gate_tolerance_or_midrun_retry":true,"new_explicit_scope_regression_fixtures_pass":true,"source_stage":"PAUSED","source_space_revision":"95a8e311664789bcf1be5c609dce148e1f300f93","actual_session":"imitation-20261004-v1","actual_mode":"imitation_study","deadline_unchanged":1791162523.3790162,"independent_paused_epoch":1791123836.0914898,"all_reservations_closed_no_remote_writes_or_new_paid_work":true,"timestamp_is_independent_pause_verification_epoch":true,"fresh_corrected_plan":"artifacts/imitation_recorded_action_20261004T141840833438Z/corrected_replay_plan.json","fresh_corrected_plan_sha256":"94ac031405b02e7ab7e8c6961a87a0d9ba8eb33d3d5a1d34c5f92da95703d9a1","fresh_corrected_plan_launched":false,"next_action_hint":"Fresh unique v2 replay uses explicit original physical remote fields and diagnostics for extra reward scalars; exact same-host raw/normalized inputs, rewards/info and telemetry remain gates. Max3600control+480reset ticks/300seconds/zero updates or paid reservation. Keep84+120failed exposure separate, never resume partial instance or count replay as saved-controller skill. Original noise-prefix causal feedback gate stays blocked."}}

{"run":42,"commit":"8239df3","metric":0.0,"metrics":{"recorded_controlled_ticks":3600,"reset_ticks":480,"recorded_case_rollouts":2,"training_updates":0,"required_remote_physical_maximum_error":0.0,"reference_fast_recorded_field_maximum_error":0.0,"selected_recorded_retained_gain":81.66391274492042,"selected_hold_first_tick":1585,"selected_hold_window_body_query_hits":90,"selected_hold_window_max_speed_per_tick":0.8280920925505211,"off_policy_prediction_maximum_difference":2.980232238769531e-7,"extra_remote_reward_numeric_maximum_difference":1.1102230246251565e-16,"matched_input_fixture_bytes":553101,"focused_tests_passed":23,"comparison_regression_tests_passed":4,"all_closed_estimated_usd":0.4074241866528988},"status":"keep","description":"Corrected recorded-control replay exactly reproduces selected ledge hold and reference/fast fields; fixed-state off-policy inference remains slightly different, no saved-controller skill promotion","timestamp":1791125021412,"segment":0,"confidence":null,"asi":{"hypothesis":"Recorded-control physics can reproduce the selected remote held trajectory while isolating small off-policy prediction differences from closed-loop feedback divergence","diagnostic_only":true,"primary_metric_carried_forward":true,"no_independent_learned_success_or_goal_promotion":true,"evidence":"artifacts/imitation_recorded_action_v2_20261004T143756537682Z/verification.json","plan_sha256":"94ac031405b02e7ab7e8c6961a87a0d9ba8eb33d3d5a1d34c5f92da95703d9a1","script_sha256":"0cd96aa37073e57db8d39147ebbca30293e756fd0414a0959e7e921b0940c451","tested_comparison_sha256":"66720d03a61807fb3e92439dae1c3162e9a97c48f45ee87f87b3541bf2dac580","required_remote_physical_fields_exact_all1800_ticks":true,"same_host_raw_normalized_predictions_controls_rewards_info_pre_post_telemetry_exact":true,"recorded_applied_actions_alone_drive_physics":true,"final_pose":[334.4829332500256,102.66391274492042],"central_secondary_recorded_held_flags_true":true,"same_selected_trajectory_not_two_independent_successes":true,"independent_frozen_90tick_hold_windows_reconstructed":true,"selected_hold_seconds":52.833333333333336,"no_summit_or_death":true,"off_policy_prediction_difference_not_equal_historical_input_cause":true,"historical_remote_full_observations_absent":true,"original_saved_feedback_causal_gate_still_blocked":true,"raw_to_saved_frozen_rms_normalization_exact":true,"model_timestep_parameters_and_rms_unchanged":true,"matched_input_npz_sha256":"455b95f026e78e64b01ea37326f420e76bb45bf39f5eda193118ee24d3cc19ab","normalized_float32_input_sha256":"d398647de2f561181993b387f7b80df66a31c37fad67feffdc4f20c6a82d329a","old_failed84control120reset_script_untouched":true,"source_stage":"PAUSED","source_space_revision":"95a8e311664789bcf1be5c609dce148e1f300f93","actual_session":"imitation-20261004-v1","actual_mode":"imitation_study","deadline_unchanged":1791162523.3790162,"independent_paused_epoch":1791125021.4120429,"all_reservations_closed_no_remote_writes_or_paid_work":true,"timestamp_is_independent_pause_verification_epoch":true,"next_frozen_plan":"artifacts/imitation_recorded_action_v2_20261004T143756537682Z/matched_host_plan.json","next_plan_launched_or_reserved":false,"next_action_hint":"Implement/test one fresh private inference-only matched-input Linux CPU comparison,1800samples/two singleton passes/3600inference presentations/120worker seconds/zero game or training work. Future admission needs verified pricing,new source/context/session,<=20minute deadline and <=$0.01 total startup/preflight reservation within$10 plus backup/auto-pause. No current HF writes or reservation. After numerical isolation prioritize robust reactive recovery, not blind scaling, kernel tuning or promotion of recorded replay."}}

{"run":43,"commit":"84ef404","metric":0.0,"metrics":{"python_tests_passed":246,"local_inferred_sample_presentations":3600,"local_normalization_archived_singleton_repeat_maximum_error":0.0,"local_control_ticks":0,"local_reset_ticks":0,"training_updates":0,"allowlisted_bundle_files":429,"all_closed_estimated_usd":0.4074241866528988},"status":"keep","description":"Inference-only matched-host tool/private worker implemented and pipeline-validated; no remote launch, paid reservation or learning effectiveness claim","timestamp":1791126722676,"segment":0,"confidence":null,"asi":{"hypothesis":"A bounded fixed-input private Linux comparison can isolate numeric portability without browser/learning dispatch or weakening frozen physical/goal gates","validation_only":true,"primary_metric_carried_forward":true,"no_competence_or_remote_host_result":true,"evidence":"artifacts/matched_host_pipeline_20261004T150755974935Z/verification.json","tested_bundle":"artifacts/hf_bundle_20261004T151054432121Z","executed_local_tool_sha256":"363831956d310f30d73d7e426bdf1d9f51567330bb6f023770dc8b786355d6bf","final_tool_sha256":"d1e93f6f87b769ae96280e14a168518f7f602a13d0bdb31fe84f27b3f197d819","postrun_source_grant_safety_additions_fixture_tested_only":true,"initial_validation_failure":"Mocked dispatch fixture expected args[2:4] instead of args[1:3]; corrected fixture, no production worker failure or real training","mode":"inference_probe","fresh_session_prefix":"inference-","maximum_reserved_wall_seconds":1200,"maximum_reserved_compute_usd":0.01,"maximum_child_seconds":120,"npz_zip_size_header_shape_dtype_checks_before_allocation":true,"exact_parent_creation_source_tool_provenance_paths_grant_claim_binding":true,"no_resume_or_terminal_relaunch":true,"credential_free_child_bounded_http_20second_backup_and_pause_guards_tested":true,"local_raw_normalization_archived_predictions_and_singleton_repeat_exact":true,"local_flushed_complete_inference_rows":3600,"local_model_timestep_rms_files_unchanged":true,"no_browser_environment_optimizer_or_trainer_dispatch":true,"monitor_inference_distinct_from_physical_success":true,"actual_private_space_stage":"PAUSED","source_space_revision_unchanged":"95a8e311664789bcf1be5c609dce148e1f300f93","actual_session":"imitation-20261004-v1","actual_mode":"imitation_study","deadline_unchanged":1791162523.3790162,"independent_paused_epoch":1791126722.6764882,"all_reservations_closed_no_hf_writes_or_deployment_change":true,"timestamp_is_independent_pause_verification_epoch":true,"next_action_hint":"Verify current CPU Upgrade price and PAUSED targets, reserve unique <=20minute/<=0.01USD inference-only session including startup within$10, privately publish tested fresh source and pinned numeric fixture/operator context, then restart only new admitted inference mode. Preserve closed imitation and inspect dependency/source/input/work/results plus independent auto-pause. No training or gate relaxation; after this isolation prioritize robust reactive recovery, not kernel thrashing."}}

{"run":44,"commit":"78b2429","metric":0.0,"metrics":{"remote_inference_presentations":3600,"game_control_ticks":0,"reset_ticks":0,"training_updates":0,"same_input_cross_host_maximum_action_difference":2.980232238769531e-7,"same_input_cross_host_differing_samples":1658,"fixture_samples":1800,"linux_historical_prediction_maximum_difference":0.0,"singleton_repeat_maximum_difference_both_hosts":0.0,"raw_normalization_maximum_difference_both_hosts":0.0,"closed_inference_estimated_usd":0.001,"all_closed_estimated_usd":0.4084241866528988,"admission_and_goal_tests_passed":17},"status":"keep","description":"Fresh matched-host inference completes and auto-pauses; identical-input Windows/Linux arithmetic differs while Linux reproduces historical predictions, no learning/feedback promotion","timestamp":1791127558034,"segment":0,"confidence":null,"asi":{"hypothesis":"A fixed-input matched-host comparison separates CPU inference/normalization numerics from closed-loop state divergence","diagnostic_only":true,"primary_metric_carried_forward":true,"no_heldout_skill_or_goal_promotion":true,"session":"inference-20261004-v1","source_space_revision":"ce53b512e2ed0a2eb0a41da63a88f59e65c18634","context_revision":"25d7cbd21967f956fafc5dd1e2b34b66352dfb7a","input_revision":"3208843a8632eaafebb3136f0628ae562b7395fa","complete_artifact_revision":"498527aa104591beda94b2cf3bac69c1fbf2d9f7","evidence":"artifacts/inference_deployment_20261004T152045604879Z/complete_review.json","source_published_and_configured_while_verified_paused_then_one_intentional_restart":true,"fresh_never_sleep_cpu_upgrade_one_replica_context_budget_claim_grant_valid":true,"start_epoch":1791127352.9995596,"unchanged_deadline_epoch":1791128552.9995596,"maximum_reserved_usd":0.01,"all3600_complete_inference_rows_verified":true,"byte_identical_normalized_inputs_and_parameter_tensors_both_hosts":true,"normalized_input_sha256":"d398647de2f561181993b387f7b80df66a31c37fad67feffdc4f20c6a82d329a","parameters_sha256":"bfaa256665fbcb52fe8b01603db98f62245abc0f5cdef2dc3734a27337005c7f","linux_python_torch":"3.11.17/2.6.0+cpu","windows_python_torch":"3.11.9/2.6.0+cu124 CPU","both_numpy_sb3_avx2_threads":"2.4.3/2.7.1/AVX2/1","linux_matches_all1800_recorded_predictions_on_reconstructed_inputs":true,"first_linux_action_x":0.4903484582901001,"first_windows_action_x":0.4903483986854553,"host_stack_difference_demonstrated_not_torch_build_alone":true,"normalization_and_singleton_repetition_exact":true,"parameters_timestep_rms_and_files_preserved":true,"no_browser_environment_training_or_kernel_tuning":true,"historical_full_observations_absent_not_proven_equal":true,"saved_feedback_baseline_and_original_goal_requirements_still_unpassed":true,"first_independent_paused_epoch":1791127420.855593,"rechecked_paused_epoch":1791127558.0345054,"all_reservations_closed":true,"elapsed_interval_rounded_to_2provider_minutes":true,"estimates_not_provider_bills_or_credit_balance":true,"timestamp_is_independent_pause_recheck_epoch":true,"next_action_hint":"Implement/test fresh private physics-only execution of the already frozen nominal/fullnoise8105/early/late probe on matching Linux stack. Exact saved-feedback nominal/fullnoise baselines must pass before interventions; max8rollouts/14400control+1920reset ticks/600seconds/0updates, fresh source/context/reservation/deadline and auto-pause. Never restart this completed inference session, tune kernels, claim new robust skill or blindly scale failed BC/PPO."}}

{"run":45,"commit":"28558d7","metric":0.0,"metrics":{"python_tests_passed":256,"allowlisted_bundle_files":434,"new_controlled_ticks":0,"new_reset_ticks":0,"training_updates":0,"all_closed_estimated_usd":0.4084241866528988},"status":"keep","description":"Validated fresh Linux physics-only transport for original frozen control probe; explicit execution-envelope amendment, no new rollout or reservation","timestamp":1791128966574,"segment":0,"confidence":null,"asi":{"hypothesis":"The matching Linux inference stack enables exact saved-feedback baseline reproduction before controlled early/late-noise diagnostics","implementation_validation_only":true,"primary_metric_carried_forward":true,"no_new_policy_evaluation_or_causal_result":true,"evidence":"artifacts/linux_noise_transport_20261004T153843356715Z/verification.json","tested_bundle":"artifacts/hf_bundle_20261004T154829964910Z","scientific_plan_sha256_unchanged":"aeb940ac3fb32209de78795cb83ebbabc69166c28ff85c47ba10651e92fe3d7c","core_probe_source_sha256":"041838919d9dd3da482a605c850c1c53820f32338b9552730ca6a2689a7906db","linux_wrapper_sha256":"870d54308c5ea23d4cb83a8f7913d9264f6181187be9fbf145eed06d9688507d","transport_declaration_sha256":"d990134c53725d637f6d6681358e0b21591121414e9d34bdd64d5bf659991f80","original_local_zero_paid_no_session_change_envelope_explicitly_amended_not_rewritten":true,"scientific_conditions_model_rms_noise_clock_metrics_and_exact_gates_unchanged":true,"failed_or_missing_feedback_baselines_block_interventions":true,"per_case_and_total_physical_budgets_checked":true,"fresh_owned_linux_headless_only_desktop_rejected_before_browser":true,"credentials_and_browser_attachment_environment_stripped":true,"source_parent_creation_tool_paths_grant_claim_no_resume_deadline_backups_pause_guards_tested":true,"mode":"noise_control_probe","fresh_prefix":"noise-probe-","maximum_future_session_seconds":1200,"maximum_future_reserved_usd":0.01,"maximum_child_seconds":600,"maximum_case_rollouts":8,"maximum_controlled_reset_ticks":[14400,1920],"actual_private_space_stage":"PAUSED","actual_current_source":"ce53b512e2ed0a2eb0a41da63a88f59e65c18634","actual_current_session":"inference-20261004-v1","actual_current_mode":"inference_probe","actual_current_deadline_unchanged":1791128552.9995596,"last_independent_paused_epoch":1791128916.506885,"all_reservations_closed_no_hf_writes_or_new_paid_work":true,"next_action_hint":"Verify current CPU Upgrade pricing and PAUSED ownership, reserve unique <=20min/<=0.01USD physics-only session, publish tested fresh source plus exact original scientific plan/model/RMS/pinned remote baseline JSON and explicit transport amendment/context while PAUSED, then intentionally launch only noise_control_probe. Require actual saved-feedback nominal/full-noise reproduction before interventions; preserve failures and auto-pause. No in-place resume, Windows kernel tuning, blind training scale or goal promotion."}}

{"run":46,"commit":"a0a975e","metric":0.0,"metrics":{"control_admission_and_goal_tests_passed":18,"maximum_reserved_compute_usd":0.01,"closed_plus_reserved_estimated_usd":0.4184241866528988,"validated_new_completed_cases":0},"status":"keep","description":"Fresh four-condition Linux control experiment admitted/launched under fixed budget; first durable claim RUNNING, no physical outcome yet","timestamp":1791129705354,"segment":0,"confidence":null,"asi":{"hypothesis":"The selected noisy hold may depend on early alignment versus continuing corrective control, tested by frozen nominal/full/early/late streams after exact baseline reproduction","launch_and_admission_only":true,"primary_metric_carried_forward":true,"no_new_physical_outcome_or_causal_effect_claim":true,"session":"noise-probe-20261004-v1","mode":"noise_control_probe","source_space_revision":"7be7d58de881f1b9e4c69c87958e1818d4693d8b","context_revision":"ef63e649fdd60ef045a01b98519c5b064e2fa420","input_revision":"c29033b9937ef9d3e074d3c2d2f28d2adaefd303","startup_artifact_revision":"258c7a3f8ba7e7e5a5b557e9a75395cd88488aaf","evidence":"artifacts/noise_probe_deployment_20261004T155845805666Z/startup_verification.json","scientific_plan_model_rms_noise_clock_detectors_and_exact_feedback_gates_unchanged":true,"explicit_linux_transport_amendment_admitted":true,"private_source_context_data_published_while_verified_paused":true,"intentional_restart_of_new_session_only":true,"actual_stage":"RUNNING","actual_phase":"noise_probe_claimed","durable_no_resume_claim_no_error":true,"no_result_or_physics_work_inferred_from_claim":true,"start_epoch":1791129628.5921772,"immutable_deadline_epoch":1791130828.5921772,"maximum_child_seconds":600,"maximum_case_rollouts":8,"maximum_controlled_reset_ticks":[14400,1920],"training_updates":0,"never_sleep_cpu_upgrade_one_replica_verified":true,"official_price_reverified_date":"2026-10-04","no_current_active_image_variables_queue_or_deadline_changes_after_launch":true,"no_closed_batch_resume_or_budget_renewal":true,"next_action_hint":"One later bounded pinned review of exact saved-feedback baseline/backend fidelity, real controlled/reset work and physical held/retained/death/summit outcomes for nominal/fullnoise/early/late. Keep running source/context/deadline fixed. At completion/failure/deadline verify durable artifacts and PAUSED, close this reservation; never silently resume or infer robust skill/causal correction from startup claim or selected post-hoc cases."}}

{"run":47,"commit":"e35a3cf","metric":0.0,"metrics":{"validated_probe_rollouts":8,"controlled_ticks":14400,"reset_ticks":1920,"training_updates":0,"nominal_retained_gain":0.5291058416972945,"full_noise_retained_gain":81.66391274492042,"early_only_retained_gain":10.536100118567138,"late_only_retained_gain":7.500451371369099,"full_noise_hold_tick":1585,"full_noise_hold_window_body_query_hits":90,"full_noise_hold_window_max_speed_per_tick":0.8280920925505211,"probe_summits":0,"probe_deaths":0,"closed_probe_estimated_usd":0.0095,"all_closed_estimated_usd":0.4179241866528988,"control_admission_goal_tests_passed":18},"status":"keep","description":"Exact Linux feedback baselines and backend fidelity pass; full perturbation holds while either isolated early/late segment fails, exploratory selected-stream result only","timestamp":1791131063689,"segment":0,"confidence":null,"asi":{"hypothesis":"Frozen early/late perturbation contrasts distinguish a simple initial-alignment fix from continuing trajectory variation needed for the selected noisy hold","diagnostic_only":true,"primary_metric_carried_forward":true,"no_robust_skill_or_goal_promotion":true,"session":"noise-probe-20261004-v1","source_space_revision":"7be7d58de881f1b9e4c69c87958e1818d4693d8b","context_revision":"ef63e649fdd60ef045a01b98519c5b064e2fa420","terminal_artifact_revision":"12c5b0fa35ad89a4001a0ee886b142a7e8b2373e","evidence":"artifacts/noise_probe_review_20261004T161832060135Z/complete_review.json","saved_feedback_nominal_and_fullnoise_remote_actions_body_outcomes_exact":true,"reference_fast_actions_observations_rewards_info_pre_post_telemetry_exact_allconditions":true,"global_masked_noise_stream_all_applied_actions_recomputed":true,"matched_60tick_prefixes_exact":true,"frozen_held_events_independently_reconstructed":true,"held_flags_nominal_full_early_late":[false,true,false,false],"same_selected_trajectory_backends_not_independent_learned_successes":true,"full_noise_final_pose":[334.4829332500256,102.66391274492042],"early_only_final_pose":[268.77933655098207,31.536100118567138],"late_only_final_pose":[226.18859697899373,28.5004513713691],"neither_isolated_segment_sufficient_for_selected_hold":true,"not_unique_helpful_action_population_robustness_or_corrective_oracle":true,"baseline_portability_gate_resolved_on_matching_linux_stack_not_general_portability":true,"immutable_deadline_epoch":1791130828.5921772,"first_independent_paused_epoch":1791130711.5065403,"actual_stage":"PAUSED","all_reservations_closed_no_next_batch":true,"conservative_elapsed_rounded19provider_minutes":true,"cost_estimates_not_bills_or_remaining_credits":true,"timestamp_is_offline_physical_review_epoch":true,"next_action_hint":"Audit successful full-noise exact pre-action learner-state/applied-control coverage against existing demonstration data, then design fresh gated on-state self-imitation/robust recovery learning. Only actual logged legal controls at their matching states may be labels; no time-indexed expert at unrelated states or random-noise-as-oracle claim. Keep Linux reference, held-out and summit gates; no more kernel/transport loops, cutoff searches or blindly extending unchanged PPO."}}

