{"run": 97, "commit": "c9bd85d", "metric": 0.0, "metrics": {"goal_active_python_tests": 470, "inactive_residual_tests_excluded": 12, "demo_seed_v2_probe_seeds_started": 1, "evaluations_completed": 1, "seed21_learner_transitions": 480000, "seed21_sac_cycles": 237952, "demo_seed_learner_transitions": 85475, "seed21_physics_total": 985339, "evaluation_cases": 10, "first_ledge_successes": 0, "nominal_height180_hold90": 0, "deaths": 0, "summits": 0, "original_summits": 0, "physical_gate_passed": 0, "pilot_gate_passed": 0, "paid_reservations_created": 1, "paid_reservations_closed": 1, "probe_elapsed_usd": 0.18711, "all_closed_estimated_usd": 1.29125, "loops_started": 1, "loops_cancelled": 1}, "status": "discard", "description": "Demo-seeded v2 probe (burst cap 60->180): full 480k training with 85475 demo-seeded learner ticks and the complete learned-only 10-case evaluation; still 0/10 first-ledge and no Y180 hold, and route progress regressed versus v5 (only 3/10 cases passed X120, none reached the wall at X~279; nominal retention +2 vs +43.5)", "timestamp": 1791305750122, "segment": 0, "confidence": null, "asi": {"hypothesis": "A demo burst long enough to cover the entire ~123-tick wall->ledge swing (180 ticks) lets the learner observe complete swing transitions and reach the first-ledge gate.", "rollback_reason": "Falsified for this seed and budget: no case reached the wall or the ledge, and horizontal route progress was worse than v5's 60-tick bursts. No gate result; primary summit metric unchanged.", "session": "goal-20261006-v6", "source_space_revision": "f973d07a7f21855162bf222ab4fccd9f372dca43", "retained_gains": [2, -2, 6, 1.5044677734606928, 2, 6, -5, 7, 2, 2], "best_eval_reach": {"case": "noise_4", "max_y": 77.0, "max_x": 219.4}, "v5_reference_reach": {"case": "noise_5", "max_y": 71.8, "max_x": 280.3, "cases_reaching_wall_x276_280": 9}, "diagnosis": "Longer bursts raised demo-seeded learner ticks from 51632 to 85475 while diluting the policy's own exploration, and each burst replays demo actions whose states stop matching the policy's actual state partway through. Learned-only rollouts mostly stayed near spawn (7/10 ended at X35-73) and none reached the wall, whereas v5's fragmented 60-tick bursts still produced 9/10 wall arrivals. The swing never occurred as a learned transition.", "rate_limit_recurred": false, "temporary_monitoring_loop_cancelled": true, "space_independently_verified_paused": true, "evidence": "artifacts/goal_deploy_20261006_v6/complete_review/close.json", "next_action_hint": "Back off toward the v5 burst regime and change one different variable: candidates are denser goals near the wall, stagnation resampling, entropy floor, or swing-entry-triggered demo practice (bursts start only at swing-entry states, shorter cap)."}}
