{"run": 27, "commit": "9601df1", "metric": 0.0, "metrics": {"passed_preflight_checks": 9, "remote_python_tests_passed": 219, "local_goal_and_execution_guard_tests_passed": 14, "raw_fidelity_cases": 17, "reactive_fidelity_cases": 6, "maximum_measured_fidelity_error": 0.0, "full_study_runs_declared": 9, "full_study_runs_completed_in_startup_snapshot": 0, "unchanged_maximum_reservation_usd": 0.48, "closed_plus_reserved_estimate_usd": 0.7726961856524149}, "status": "keep", "description": "Operational validation: exact passed imitation preflight reviewed while PAUSED; intentionally started fixed-budget nine-run study and verified durable no-resume dispatch", "timestamp": 1791106097473, "segment": 0, "confidence": null, "asi": {"hypothesis": "Legal demonstration initialization followed by PPO improves reactive first-ledge retention versus a matched frozen-normalization scratch baseline", "validation_and_launch_only": true, "no_learning_effectiveness_result_yet": true, "not_metric_comparable_to_learning_runs": true, "primary_metric_carried_forward": true, "session": "imitation-20261004-v1", "source_space_revision": "95a8e311664789bcf1be5c609dce148e1f300f93", "preflight_dataset_revision": "67712baf8f4f0464a4b03e133ed97439b32462ef", "operator_context_revision": "ae958180b348432f236c6c1e72f832a723164199", "initial_study_dataset_revision": "8b3acc244d88f174e7fddb5ec84eebb94ae896fa", "evidence": "artifacts/imitation_preflight_review_20261004T092140390244Z/initial_study_verification.json", "preflight_review": "artifacts/imitation_preflight_review_20261004T092140390244Z/review.json", "independent_preflight_paused_epoch": 1791105736.9293103, "study_restart_requested_epoch": 1791105924.3108993, "start_epoch": 1791104923.3790162, "deadline_epoch": 1791162523.3790162, "exact_corpus_rms_and_matched_clone_weights_and_stage_traces": true, "source_context_game_data_runtime_budget_match": true, "durable_no_resume_claim_verified": true, "initial_phase": "imitation_dispatch", "initial_actual_stage": "RUNNING", "no_optimizer_work_inferred_from_initial_claim": true, "only_mode_context_changed_while_independently_paused": true, "no_source_hardware_data_deadline_budget_change": true, "initial_operator_validation_failure": "Exact paused replica dictionary equality rejected legitimate current:1 field while RUNNING; corrected using existing unattended-runtime guard and same pinned startup revision, no worker failure or deployment change", "saved_controller_full_portability_not_claimed": true, "next_action_hint": "On the next bounded invocation read actual exposure/results for the active imitation study; validate nine declared runs using the imitation checker. Keep active source/variables/hardware/queue unchanged; preserve failures and auto-pause, never silently resume or extend this fixed deadline."}}
{"run": 28, "commit": "02f35e7", "metric": 0.0, "metrics": {"audited_controlled_ticks": 116400, "audited_reset_settling_ticks": 1320, "audited_total_counted_ticks": 117720, "complete_sampled_trace_rows": 291, "checkpoint_pairs_metadata_verified": 2, "validated_completed_imitation_runs": 0, "local_checker_and_goal_tests_passed": 17, "closed_plus_reserved_estimate_usd": 0.7726961856524149}, "status": "keep", "description": "Operational validation: actual seed-6 scratch PPO training and immutable legal/physical accounting audited; final reference results still incomplete", "timestamp": 1791106840140, "segment": 0, "confidence": null, "asi": {"hypothesis": "Legal demonstration initialization followed by PPO improves reactive first-ledge retention versus a matched frozen-normalization scratch baseline", "progress_audit_only": true, "not_independent_evaluation_or_metric_improvement": true, "primary_metric_carried_forward": true, "session": "imitation-20261004-v1", "run": "ppo_from_scratch_seed_6", "dataset_revision": "baa7233e4b149fdddd3ec982bb7fa659f4edd8d9", "source_space_revision": "95a8e311664789bcf1be5c609dce148e1f300f93", "evidence": "artifacts/imitation_progress_review_20261004T093741216495Z/audit.json", "source_dataset_settings_reward_claim_grant_deadline_match": true, "never_sleep_cpu_upgrade_one_replica_unchanged": true, "sampled_training_central_held_flag_rows": 56, "sampled_training_secondary_held_flag_rows": 83, "training_flags_not_independent_successes_or_episode_counts": true, "last_training_pose": [788.5556667421962, -9.123839898448205], "last_training_retained_gain": -30.123839898448203, "last_training_both_holds_false": true, "sampled_summit_and_death_flags_zero_not_total_terminal_counts": true, "sparse_sample_interval_ticks": 400, "raw_gaussian_action_draws_clipped_by_bound_sb3_and_env": true, "checkpoint_metadata_only_no_binary_reload_or_optimizer_calls_inferred": true, "imitation_checker_missing_runs": 9, "goal_metrics_candidate_and_final_false": true, "no_hf_writes_local_training_or_batch_changes": true, "no_budget_renewal_or_deadline_extension": true, "next_action_hint": "On the next bounded invocation review durable final reference scratch/BC-only/BC+PPO result contracts and actual exposure for seeds6/7/8. Do not promote or scale from training flags, reward or peaks; keep active Space source/variables/hardware/queue fixed and preserve interruption/failure evidence."}}
{"run": 29, "commit": "95a8e31", "metric": 0.0, "metrics": {"validated_completed_imitation_runs": 1, "scratch_seed6_central_holds": 0, "scratch_seed6_secondary_holds": 0, "scratch_seed6_final_full_completions": 0, "scratch_seed6_final_deaths": 0, "scratch_seed6_median_retained_gain": -0.19732410640824583, "scratch_seed6_controlled_ticks": 393216, "scratch_seed6_reset_ticks": 4080, "scratch_seed6_actual_policy_optimizer_calls": 3840, "scratch_seed6_learning_wall_seconds": 1412.5433617019953, "local_checker_and_goal_tests_passed": 17, "closed_plus_reserved_estimate_usd": 0.7726961856524149}, "status": "keep", "description": "Partial imitation evidence: full seed-6 scratch PPO fails all final reference ledge/summit cases despite earlier training holds; BC-only is active, no promotion", "timestamp": 1791108032380, "segment": 0, "confidence": null, "asi": {"hypothesis": "Legal demonstration initialization followed by PPO improves reactive first-ledge retention versus a matched frozen-normalization scratch baseline", "partial_campaign": true, "complete_three_seed_cohorts": 0, "no_cloning_effect_conclusion_or_scaling": true, "primary_metric_carried_forward_until_complete_cohorts": true, "session": "imitation-20261004-v1", "run": "ppo_from_scratch_seed_6", "dataset_revision": "abe4b0aa973c702b1637648be1f1afbb703d0db8", "evidence": "artifacts/imitation_snapshot_review_20261004T095748247801Z/review.json", "actual_active_phase": "behavior_cloning_only_seed_6", "actual_source_variables_data_runtime_and_deadline_unchanged": true, "exact_full_settings_work_and_all_legal_reference_traces_validated": true, "untrained_median_retained_gain": 0, "nominal_final_pose": [-2.4797933245621206, 20.784425403584276], "nominal_retained_gain": -0.21557459641572407, "nominal_last_four_seconds_body_query_hits": 120, "nominal_last_four_seconds_hammer_query_hits": 0, "varying_actions_not_constant_policy_diagnosis": true, "failed_first_skill_gate": "Seed6 central0/9 and nominal false; early stochastic on-policy held flags do not establish deterministic reference competence", "bc_work": 0, "resets": 34, "full_result_binary_companions_metadata_only_not_reloaded_or_portable": true, "bounded_pinned_evaluation_bytes": 80303866, "evaluation_byte_limit": 134217728, "goal_metrics_from_explicit_imitation_field_projection_candidate_and_final_false": true, "remote_partial_summary_outcomes_agree_missing_file_list_can_predate_next_manifest": true, "all_remote_operations_read_only_no_budget_renewal": true, "next_action_hint": "Finish unchanged predeclared BC-only/BC+PPO and seeds7/8 controls; compare full cohort outcomes before selecting a separate reactive recovery/saturation/normalization diagnostic. Do not skip controls, modify the active batch, promote training flags or blindly scale this failed baseline."}}
{"run": 30, "commit": "95a8e31", "metric": 0.0, "metrics": {"validated_completed_imitation_runs": 2, "bc_seed6_central_holds": 0, "bc_seed6_secondary_holds": 0, "bc_seed6_final_full_completions": 0, "bc_seed6_final_deaths": 0, "bc_seed6_median_retained_gain": 9, "bc_seed6_optimizer_calls": 2000, "bc_seed6_sample_presentations": 512000, "bc_seed6_training_rl_ticks": 0, "bc_seed6_mse_before": 0.2562333941459656, "bc_seed6_mse_after": 0.0001084495015675202, "hybrid_seed6_audited_control_ticks": 137200, "hybrid_seed6_audited_reset_ticks": 1680, "local_checker_and_goal_tests_passed": 17, "closed_plus_reserved_estimate_usd": 0.7726961856524149}, "status": "keep", "description": "Partial imitation evidence: seed-6 clone-only fits corpus closely but fails final ledge reproduction; hybrid PPO remains active, no promotion", "timestamp": 1791109307252, "segment": 0, "confidence": null, "asi": {"hypothesis": "Legal demonstration initialization followed by PPO improves reactive first-ledge retention versus a matched frozen-normalization scratch baseline", "partial_campaign": true, "complete_three_seed_cohorts": 0, "primary_metric_carried_forward_until_complete_cohorts": true, "no_robust_cloning_effect_or_scaling_conclusion": true, "session": "imitation-20261004-v1", "run": "behavior_cloning_only_seed_6", "dataset_revision": "d3ed8abd536e99a85a0820f1eb5f749089d7ac12", "evidence": "artifacts/imitation_clone_review_20261004T101754929686Z/review.json", "actual_active_phase": "behavior_cloning_then_ppo_seed_6", "source_context_game_data_runtime_deadline_grants_claim_valid": true, "all_reference_stage_and_work_contracts_validated": true, "matched_seed_untrained_reference_traces_exact": true, "bc_final_equals_post_clone_not_a_third_evaluation": true, "actual_distinct_bc_reference_ticks": 32400, "actual_distinct_bc_reference_reset_ticks": 4320, "bc_wall_seconds": 6.6861553479975555, "nominal_final_pose": [227.90078010959903, 30], "nominal_retained_gain": 9, "nominal_last_four_seconds_body_query_hits": 120, "nominal_last_four_seconds_hammer_query_hits": 0, "failed_first_skill_gate": "Seed6 clone central0/9 and nominal false despite low in-corpus MSE; no closed-loop ledge skill demonstrated", "bc_final_and_own_post_clone_lfs_equal": true, "bc_hybrid_initial_normalizer_lfs_equal": true, "bc_hybrid_clone_zip_hashes_differ_not_proof_of_different_weights": true, "hybrid_post_clone_trace_comparability_still_pending": true, "no_binary_download_reload_or_portability_claim": true, "bounded_evaluation_bytes": 123902707, "evaluation_byte_limit": 134217728, "goal_helper_projected_two_rows_candidate_and_final_false": true, "all_remote_operations_read_only_budget_and_active_settings_unchanged": true, "next_action_hint": "Finish unchanged hybrid and seeds7/8 comparison, explicitly verify matched hybrid post-clone traces. If complete cloned/hybrid cohorts fail, select a separately bounded first-divergence/reactive-recovery or normalization-sensitivity diagnostic, not more blind BC/PPO compute or active-batch changes."}}

{"run": 31, "commit": "95a8e31", "metric": 0.0, "metrics": {"validated_completed_imitation_runs": 3, "seed6_final_reference_cases": 27, "seed6_final_central_holds": 0, "seed6_final_secondary_holds": 0, "seed6_final_full_completions": 0, "seed6_final_deaths": 0, "hybrid_seed6_median_retained_gain": 24, "hybrid_seed6_controlled_ticks": 393216, "hybrid_seed6_reset_ticks": 4320, "hybrid_seed6_policy_optimizer_calls": 3840, "hybrid_seed6_bc_calls": 2000, "seed6_training_control_ticks_all_arms": 786432, "seed6_training_reset_ticks_all_arms": 8400, "seed6_distinct_reference_control_ticks": 113400, "seed6_distinct_reference_reset_ticks": 15120, "local_checker_and_goal_tests_passed": 17, "closed_plus_reserved_estimate_usd": 0.7726961856524149}, "status": "keep", "description": "Partial imitation evidence: seed-6 scratch/BC/BC+PPO comparison all fails final first-skill gates; initial and post-clone traces match exactly, seed7 remains active", "timestamp": 1791110467315, "segment": 0, "confidence": null, "asi": {"hypothesis": "Legal demonstration initialization followed by PPO improves reactive first-ledge retention versus a matched frozen-normalization scratch baseline", "partial_campaign": true, "complete_three_seed_cohorts": 0, "primary_metric_carried_forward_until_complete_cohorts": true, "no_robust_skill_or_scaling_conclusion": true, "session": "imitation-20261004-v1", "dataset_revision": "11678b29c6b960586a1455c82a1e1218b9d21ba4", "evidence": "artifacts/imitation_seed6_review_20261004T103801371190Z/review.json", "actual_active_phase": "ppo_from_scratch_seed_7", "source_context_data_game_runtime_deadline_grant_claim_valid": true, "all_three_untrained_reference_traces_exact": true, "bc_hybrid_post_clone_reference_traces_exact": true, "prior_whole_zip_hash_difference_not_behavior_mismatch": true, "final_median_retained_gain_scratch_bc_hybrid": [-0.19732410640824583, 9, 24], "hybrid_nominal_final_pose": [585.4595583299495, 40], "hybrid_nominal_retained_gain": 19, "hybrid_nominal_last_four_seconds_body_query_hits": 120, "hybrid_nominal_last_four_seconds_hammer_query_hits": 0, "hybrid_learning_wall_seconds": 1444.4039168580057, "hybrid_bc_wall_seconds": 6.707791488996008, "hybrid_resets": 36, "failed_first_skill_gate_all_seed6_arms": true, "height_gain_not_held_skill_or_climbing": true, "seed6_ppo_optimizer_calls_all_arms": 7680, "seed6_bc_calls_all_arms": 4000, "seed6_bc_sample_presentations_all_arms": 1024000, "seed6_distinct_reference_case_rollouts": 63, "bc_final_alias_not_double_counted_as_reference_exposure": true, "eight_saved_companions_immutable_metadata_only": true, "goal_helper_projected_three_rows_candidate_and_final_false": true, "all_remote_operations_read_only_no_local_training_or_active_budget_changes": true, "next_action_hint": "Finish unchanged seeds7/8, validate complete cohorts and PAUSED, then choose bounded first-divergence/reactive corrective-control research rather than scaling or relaxing failed gates. Preserve saved-policy portability, held-out and upper-route requirements."}}

{"run": 32, "commit": "cf4ddeb", "metric": 0.0, "metrics": {"validated_completed_imitation_runs": 3, "seed7_audited_control_ticks": 302000, "seed7_audited_reset_ticks": 3720, "seed7_complete_sparse_rows": 755, "seed7_checkpoint_pairs_metadata": 7, "offline_expert_clone_ticks_compared": 600, "first_relative_pointer_difference_pixels": 2.0063133239746094, "first_body_distance_over_1px_tick": 27, "first_body_distance_over_10px_tick": 49, "tick600_body_distance_pixels": 111.55362905128834, "new_physics_ticks_or_training_updates": 0, "closed_plus_reserved_estimate_usd": 0.7726961856524149}, "status": "keep", "description": "Offline diagnostic locates early departure of failed seed-6 clone from legal expert; seed7 prefix healthy, no new final or causal/skill claim", "timestamp": 1791111818492, "segment": 0, "confidence": null, "asi": {"hypothesis": "Early target mismatch and off-demonstration feedback, rather than insufficient global fitting alone, may explain clone closed-loop failure and motivate alignment/recovery tests", "diagnostic_only": true, "not_learning_or_new_evaluation_or_metric_improvement": true, "primary_metric_carried_forward": true, "session": "imitation-20261004-v1", "active_dataset_revision": "8393e54e26fda29106f20add394f17ba76609ce7", "source_clone_dataset_revision": "d3ed8abd536e99a85a0820f1eb5f749089d7ac12", "evidence": "artifacts/imitation_seed7_review_20261004T105752209730Z/offline_diagnostic.json", "current_phase": "ppo_from_scratch_seed_7", "prefix_source_data_grant_claim_runtime_deadline_valid": true, "training_sample_last_retained_gain": 24, "training_sample_both_holds_false": true, "pre_action_to_post_action_alignment_checked": true, "float32_decoded_position_bound_pixels": 0.000021801702511905924, "expert_tick600_pose": [322.58588646662605, 104], "clone_tick600_pose": [237.37900790325864, 32], "different_reset_seeds_and_missing_initial_full_reference_observation": true, "time_aligned_action_difference_not_equal_state_supervised_error": true, "no_causal_intervention_or_corrective_oracle_claim": true, "same_three_final_lfs_identities_goal_candidate_and_final_false": true, "no_model_download_reload_environment_rollout_local_training_or_hf_writes": true, "budget_source_and_running_settings_unchanged": true, "next_action_hint": "Review actual seed7/8 final results next. After study closure predeclare a bounded same-reset legal expert-prefix/clone-continuation intervention to test early alignment/recovery, then design valid corrective coverage if supported; do not blindly extend training or use a time-indexed teacher as an off-state oracle."}}

{"run": 33, "commit": "95a8e31", "metric": 0.0, "metrics": {"validated_completed_imitation_runs": 5, "seed7_scratch_central_holds": 0, "seed7_clone_central_holds": 1, "seed7_clone_secondary_holds": 1, "seed7_scratch_median_retained_gain": 10.924516129063626, "seed7_clone_median_retained_gain": 7.511520678820958, "completed_final_full_climbs": 0, "completed_final_deaths": 0, "held_window_body_query_hits": 90, "held_window_max_speed_per_tick": 0.8280920925505211, "local_checker_and_goal_tests_passed": 17, "closed_plus_reserved_estimate_usd": 0.7726961856524149}, "status": "keep", "description": "Partial imitation evidence: seed7 clone holds one frozen noisy ledge case, independently reconstructed; nominal and robust gates fail, scratch0/9 and hybrid still active", "timestamp": 1791112901888, "segment": 0, "confidence": null, "asi": {"hypothesis": "Demonstration initialization can acquire occasional real ledge contact but needs reactive correction/robustness rather than more blind scaling", "partial_campaign": true, "complete_three_seed_cohorts": 0, "primary_metric_carried_forward_until_complete_cohorts": true, "no_robust_method_or_goal_promotion": true, "session": "imitation-20261004-v1", "dataset_revision": "44d2c66f7287e8cc31cdfcfa92af8103eb662db9", "evidence": "artifacts/imitation_seed7_results_20261004T111807286622Z/review.json", "actual_active_phase": "behavior_cloning_then_ppo_seed_7", "source_context_game_data_runtime_deadline_claim_grant_valid": true, "seed7_initial_scratch_clone_reference_traces_exact": true, "hybrid_post_clone_comparability_pending": true, "held_case": "action_noise_5", "held_noise_seed": 8105, "held_final_pose": [334.4829332500256, 102.66391274492042], "held_retained_gain": 81.66391274492042, "held_first_success_seconds": 52.833333333333336, "held_90tick_window_frozen_detectors_recomputed_equal": true, "contact_query_hits_not_support_forces": true, "clone_nominal_pose": [62.22417255469895, 21.529105841697294], "clone_nominal_retained_gain": 0.5291058416972945, "clone_nominal_hold_false": true, "scratch_control_ticks": 393216, "scratch_reset_ticks": 4560, "scratch_resets": 38, "scratch_policy_calls": 3840, "scratch_learning_seconds": 1499.0344877710013, "clone_bc_calls": 2000, "clone_sample_presentations": 512000, "clone_rl_work": 0, "clone_bc_mse_after": 0.00010624343121889979, "clone_final_alias_post_clone_not_double_counted": true, "all_completed_final_cases": 45, "one_overall_central_secondary_held_case_not_pooled_method_rate": true, "saved_companions_metadata_only_no_reload_or_portability_claim": true, "projected_goal_helper_candidate_and_final_false": true, "all_hf_actions_reads_no_local_rollouts_training_or_budget_changes": true, "next_action_hint": "Finish unchanged seed7 hybrid and seed8, require paired post-clone traces and complete cohort/PAUSED evidence. Do not promote one noisy held case or relax frozen first-skill/full-game gates; use causal alignment/recovery diagnostics only as a separately bounded next step."}}

