{"run":81,"commit":"a7f984a","metric":0.0,"metrics":{"offline_contact_audit_traces":4,"offline_contact_audit_rows":1910,"new_controlled_ticks":0,"new_reset_ticks":0,"learning_updates":0,"point_hammer_query_posts":21,"point_body_query_posts":30,"lowtravel_hammer_query_posts":21,"first_postquery_pointstep":7,"first_queryfree_transition_pointstep":28,"selected_pair_end_pointstep":8,"selected_pair_goal_error":10.667937271960305,"naive_logged_request_max_residual":9.81646117689949,"first_logged_travel_net_delta_residual":0.5018650547704127,"max_absolute_logged_travel_net_delta_residual":1.0,"new_contactpressure_design_only_admitted":1,"actual_bodyauthority_or_recovery_admitted":0,"old_point_contact_gate_passed":0,"teacher_data_admission":0,"new_summits":0,"new_deaths":0,"full_python_tests_passed":351,"js_collision_tests_passed":1,"offline_audit_review_elapsed_seconds":49.64573287963867,"all_closed_estimated_usd":0.4564241866528988},"status":"discard","description":"Offline contact/servo audit verifies queryOR and first7-8lowtravelpair farfromgoal; one legal different contactpressure design only, no actual bodyauthority or pointgate relaxation","timestamp":1791173010251,"segment":0,"confidence":null,"asi":{"hypothesis":"Recorded transient contact history and original blocked-body direction justify a different causalcontactpressure design, not extending failed geometric pointcompletion","rollback_reason":"Offline evidence adds no physical climb/hold/bodyauthority improvement. QueryOR is not endpointcontact or solverbranch and firstpair still10.667937off; pressure notapplied. Retain diagnosis/design only, originalpointgatefailed/no teachers or learning.","evidence":"artifacts/contact_transition_audit_20261005_v1/verification.json","inspection_error":"artifacts/contact_transition_audit_20261005_v1/inspection_error.json","runtime_queryOR_across_attempted_substeps_not_endpoint_overlap_force_normal_solverbranch":true,"first_lowtravel_query_pair":[7,8],"selected_pair_actual_post":{"controlled_tick":333,"point_step":8,"pre_body":[268.8449971064618,32.0],"post_body":[268.8449971064618,32.0],"pre_hammer":[283.66241763657877,64.96500878469308],"post_hammer":[282.8383054952143,64.18773478131158],"pre_hammer_query":true,"post_hammer_query":true,"pre_body_query":true,"post_body_query":true,"net_hammer_displacement_norm":1.1328352474552794,"logged_travel_vs_net_displacement_residual":-0.8262113841081651,"pre_hammer_travel":0.9749761293408655,"post_hammer_travel":1.9590466315634445,"pre_body_impulse":[-5.270184171094656e-26,-0.4295074911950423],"post_body_impulse":[-4.74316575398519e-27,-0.4323768727987606],"body_delta":[0.0,0.0],"hammer_delta":[-0.8241121413644805,-0.7772740033815069],"goal_error":10.667937271960305,"raw_goal_error":10.66793573393822,"own_command_pixels":[17.066991806030273,12.097633361816406],"actual_pointer_pixels":[15.477,11.624],"past_own_cursor_estimate":[6.001607894897461,5.697591781616211],"equilibrium_pointer_residual":[-7.591599884506795,-6.171227082293322],"naive_pregeometry_motor_request":[0.26383178795319967,-0.5364035138772323],"logged_pre_extent_last_request":[0.2638317879532096,-0.9364035138772331],"naive_vs_logged_request_residual":0.4000000000000008,"camera_pre":[266,59],"camera_post":[266,58],"previous_raw_proxy_query_and_travel_lt3":true},"selected_pair_not_endpoint_stationary_both_steps_have_actual_tipmotion":true,"naive_pregeometry_request_not_gravity_slew_extent_collision_inverse_solver":true,"original_logged_travel_not_assumed_equal_networld_displacement":true,"failed_travel_identity_assertion_preserved_separatehashbound_residual_correction_same180deadline":true,"all30_loggedtravel_netdelta_residuals_independent_reconstruction":true,"all4_rawquery_sourcehistory_and_all2_backend_pairs_exact":true,"original_graph_gravity_blockedminuspoint5_motorpoint4_bodyaxisrollback_verified":true,"one_pressure_action_not_applied":[0.12389766424894333,0.038328301161527634],"conditional_model_body_request_delta_not_netmotion":[1.7599381109339352,2.672567650347189],"nominal367pose_different_body_camera_contact_descriptive_not_same_statecausal":true,"closed_point1pixel30_andallprior_recovery_fresh8of9_gates_immutable":true,"no_pressure_gameplay_placement_labels_training_paidreservation_remote_write_deployment_publicrelease_or_localtraining":true,"tools_goal_metrics_projection_exact_to_pinnedstudy_completion0_candidatefinalfalse":true,"351tests_expected_flushfaultinjection_messages_not_runtimefailures":true,"ledger_bytes_unchanged_seven_closed":true,"independent_paused_epoch":1791173010.2515793,"space_source_revision":"8044439043a1725dc5911577c85096cd04ddc4ae","actual_session":"onstate-20261004-v1","actual_mode":"onstate_study","actual_context":"ed3a53c349d08380401bc2a27d466ea58c378210","closed_historical_deadline_unchanged":1791144140.4793909,"next_action_hint":"IMPLEMENT/TEST DIFFERENT causalcontact phase raw217/OWNhistory/onepoint/max30. Unchangedcursorservo, two consecutiveactualpostquerytrue ANDrawlasttravel<3/gapreset; sourcegoal325/base300/source299frozen, freegoalend/timeout/illegal/terminal fails/no rearm/extra ticks. Tests/offlineparity thenfreshfreeze nominal600ref-fast baseline andfailed325+contactphase, matched one keep-point vsONEpressure action afterSAME acquisition/noise. Pressureexistingnorm16negative(source300body-currentrawbody)/.2 pluspoint_equilibrium, sameunitpastOWNcursorcompensation/legalaxesreachguardsboth. Max6rollouts2624control720reset/180work210ownedsecs; no proxy meansno pressure. Requirecommonprefix_contactpre_armnoise_backendrawparity/alive, actualcandidatedx>.1 dy>.1 ANDcandidate-minus-baseline endpoint>.1bothaxes forlaterdesignonly. No approachretarget_nudge_gain_threshold_cap_tolerance_noise_scan_sourcejump_macro_labels_learning; closedpoint1pixel30failureimmutable. One-stepbodyauthority not hold/recovery/teacher, lateractualretainedrecovery/wholefresh/data_clockmemory."}}
{"run":82,"commit":"8e2656a","metric":0.0,"metrics":{"contact_pressure_probe_rollouts":6,"controlled_ticks":2536,"reset_ticks":720,"learning_updates":0,"contact_proxy_steps":8,"contrast_ticks_per_arm":1,"pressure_distance_pixels":9.283006308049803,"pressure_requested_reach":26.001,"candidate_actual_body_dx":0.0,"candidate_actual_body_dy":0,"baseline_actual_body_dx":0.0,"baseline_actual_body_dy":0,"candidate_minus_baseline_body_dx":0.0,"candidate_minus_baseline_body_dy":0,"authority_gate_passed":0,"candidate_retained_gain":11,"candidate_central_holds":0,"candidate_secondary_holds":0,"candidate_final_hammer_query":0,"baseline_final_hammer_query":0,"candidate_final_logged_hammer_travel":3.745188573203179,"baseline_final_logged_hammer_travel":1.4215138592610321,"summits":0,"deaths":0,"new_tests_passed":14,"full_python_tests_passed":365,"js_collision_tests_passed":1,"owned_elapsed_seconds":62.11722278594971,"all_closed_estimated_usd":0.4564241866528988},"status":"discard","description":"Separate causalcontact/analytic observedanchor pressure passes implementation/fidelity; equal333history one-step actualbodyresponse BOTHzero, tipactuation differs/queryfree, authorityfalse","timestamp":1791174301353,"segment":0,"confidence":null,"asi":{"hypothesis":"Two causalqueryposts allow an observedanchor pressurecontrast to demonstrate actualrightup pot motion beyond a same-anchor baseline","rollback_reason":"Actualbodydelta and candidate-baseline areexactzero, bothpotY32/gain11/noholds; strict>.1bothaxesgatefalse. Contactproxy notplantedbodyauthority. Keep testeddiagnostic implementation/evidence only, no pressurephase/recovery/teacher/learning or gatechange.","source":"research/contact_pressure.py","tests":"tests/test_contact_pressure.py","evidence":"artifacts/contact_pressure_probe_20261005_v1/verification.json","one_new_source_module_all_old_sourcebytes_and_pointcursor_sourcegoal_contracts_unchanged":true,"offline_both325prefix_8approach_controls_underlyingtarget_summaries_exact":true,"contact_twoactualpostqueries_lowtravel_gapreset_failurepriority_no_rearm_extra_ticks":true,"captured_actual_raw_anchor":[282.8383059948683,64.18773689866066],"same_actual333commonprefix_contactpre_anchor_owncursor_and_counterfactualnoise_exact":true,"sourcegoal_executed325_basecalls300_source299frozen_no_resume_orplacement":true,"analytic_first_inner26point001_outer102intersection_norm16MAX_not_gain_target_scan":true,"pressure_delta":[-5.1054741347881265,-7.752956853633448],"pressure_action":[0.08185801655054092,0.038346972316503525],"baseline_action":[0.12174452841281891,0.09891694784164429],"candidate_final_pose":[268.8449971064618,32],"baseline_final_pose":[268.8449971064618,32],"candidate_final_hammer":[281.4768899248803,61.69875425776263],"baseline_final_hammer":[282.8382232582136,63.76622092442932],"actual_tip_actuation_differs_not_verified_blocked_body_transfer_or_fullcausalbranch_explanation":true,"all6_rawmilestone_control_caseclock_actionobserve_contact_ownmemory_sourceclock_histories_verified":true,"all3_backend_pairs_exact_nominal600_andfailed325plus8physics_exact":true,"query_proxy_acquisition_not_geometric_completion_or_bodyauthority_promotion":true,"allold_point1pixel30_sourcewrapper751pulse_fresh8of9_gates_immutable":true,"14new365fulltests_flush_messages_expected_faultinjection_not_runtimefailure":true,"source_newmodule_controller_admission_preflight_plan_scripts_parent_budget_deadline_secretstrippedchild_durabletrace_cleanup_bound":true,"no_labels_teacher_corpus_training_paidreservation_remote_write_deployment_publicrelease_or_substantive_localtraining":true,"ledger_bytes_unchanged_seven_closed":true,"independent_paused_epoch":1791174301.353306,"space_source_revision":"8044439043a1725dc5911577c85096cd04ddc4ae","actual_session":"onstate-20261004-v1","actual_mode":"onstate_study","actual_context":"ed3a53c349d08380401bc2a27d466ea58c378210","closed_historical_deadline_unchanged":1791144140.4793909,"next_action_hint":"Freeze180secondOFFLINE branch_direction audit of6savedtraces2536rows,0newplayresetupdates, source_project_trace_review_scripts_plan_budget bound. Equalhistoryone-step tip_body_impulse_request_query endpoints andpressurevector vsoriginalhammerwall_axisprobe_rollback_moveplayernext_freehammer order. Querypair notbranch_endpointplant_force; departure descriptive notfullcausalproof. Decide needforREADONLY originalprocedurecallcounter DESIGN, nevercontrollerinput_or_teacherlabel. No contactduration_pressuregain_target_nudge_cap_scan_probe_wrapperretry_gatechange_newplant_labels_paidlearning. Ifjustified, separatelyfrozen instrumented-vs-uninstrumented originalphysicalfidelity smoke beforebranchinterpretation. Actualauthority remains blocked, old>.1axisgateimmutable."}}
{"run":83,"commit":"85001af","metric":0.0,"metrics":{"offline_branch_audit_traces":6,"offline_branch_audit_rows":2536,"new_controlled_ticks":0,"new_reset_ticks":0,"learning_updates":0,"common_controlled_prefix_ticks":333,"baseline_net_hammer_displacement":0.42151386490444165,"candidate_net_hammer_displacement":2.8369836802057513,"baseline_body_dx":0.0,"baseline_body_dy":0.0,"candidate_body_dx":0.0,"candidate_body_dy":0.0,"candidate_naive_logged_request_residual":0.40000000000000124,"baseline_naive_logged_request_residual":0.40000000000000074,"compiled_backends":2,"unique_whitelisted_original_procedure_calls":4,"primitive_only_counter_design_rejected":1,"compiled_counter_design_only_admitted":1,"actual_branch_observed":0,"authority_gate_passed":0,"teacher_data_admission":0,"new_summits":0,"new_deaths":0,"full_python_tests_passed":365,"js_collision_tests_passed":1,"offline_audit_review_elapsed_seconds":3.438915252685547,"all_closed_estimated_usd":0.4564241866528988},"status":"discard","description":"Offline branch/direction audit confirms branchunobserved/authorityfalse; compiledruntime bypasses primitive callcounter, admits readonly compiled-thread counter DESIGN plus fidelity gate only","timestamp":1791175352345,"segment":0,"confidence":null,"asi":{"hypothesis":"Originalcompiled procedureentry telemetry can distinguish blocked/free paths that queryOR and endpoint states cannot identify in the zero-body-response contrast","rollback_reason":"No newphysical orclimb improvement, actualbranch stillunobserved/bodyauthorityfalse. Counternotimplemented orphysicallyvalidated; retaineddiagnostic design only, no controller/teacher/learning admission or failedgatechange.","evidence":"artifacts/branch_direction_audit_20261005_v1/verification.json","compiler_evidence":"artifacts/branch_direction_audit_20261005_v1/bundle_snippets.json","all6savedtraces_all3backendpairs_common333_pre_anchor_ownhistory_exact":true,"equalhistory_tipactuation_different_bodyzero_not_fullcausalbranch_explanation":true,"source_wall_direction_depends_current_impulse_distance_intermediategeometry_restores_tip_before_branch":true,"selected_unique_original_Player_calls":{"blocked_body":{"block_id":"b{","opcode":"procedures_call","proccode":"move player next %s %s"},"free_hammer":{"block_id":"b|","opcode":"procedures_call","proccode":"move hammer first %s %s %s %s"},"wall_probe":{"block_id":"Z","opcode":"procedures_call","proccode":"hammer wall? %s %s"},"hammer_substep":{"block_id":"c","opcode":"procedures_call","proccode":"hammer tick %s %s %s %s %s %s"}},"both_backends_compiledtrue_direct_threadprocedures_variantcalls_bypass_interpreter_primitive":true,"tryCompile_creates_perthread_table_andpushrestartduring_advance_reset_lifecycle_guard_required":true,"runtime_initial_awaitreset120_perbridge_requires_bootstrap_separate_from_episode_resetfields":true,"prior_diagnostic_resetfields_episode_only_scope_no_oldgate_rewrite_or_closedplanrenewal":true,"compiled_counter_blueprint":{"default_execution":"compiledtrue in BOTH reference and fast","interpreter_primitive_only_counter_rejected":true,"reason":"Packaged compiler emits direct calls through thread.procedures variant table; wrapping runtime._primitives.procedures_call alone misses compiled calls.","candidate_compiled_hook":"After original Thread.tryCompile returns, decorate ONLY originalPlayer thread.procedures whitelisted variants, plus existing compiled Player threads. Preserve original function/generator invocation, this,args, returns, yields and thrown errors; callcounts only, no control mutation.","whitelist":["move player next %s %s","move hammer first %s %s %s %s","hammer wall? %s %s","hammer tick %s %s %s %s %s %s"],"lifecycle_guard":"Prototype hook must catch Player threads spawned DURING each advance/reset; decorating only pre-step existingthreads is insufficient.","counts_semantics":"Actual procedure entry counts, not forces/successfulbodydisplacement. For yielding generators increment at actual generator execution, not generator creation.","no_game_asset_compiler_enablement_or_raw217_change":true,"bounded_counter_only_no_fullargument_trace":true,"privileged_diagnostic_never_controllerinput_or_teacherlabel":true,"before_use":"Synthetic normal/generator delegation/restoration/lifecycle/reset/whitelist tests, then separatelyfrozen original compiled instrumented-uninstrumented fidelity for nominal600 and both failed334arms/referencefast. No newcontrol/push test.","implementation_and_physicalfidelity_not_done":true},"no_instrumentation_newgameplay_reset_policy_simulation_argumenttrace_newplant_tuning_or_pressure_retry":true,"privileged_callcounts_never_raw217_controllerinput_force_claim_teacherlabel":true,"allold_point1pixel30_authoritypoint1_axes_sourcewrapper751pulse_fresh8of9_gates_immutable":true,"tools_goal_metrics_projection_exact_to_pinnedstudy_completion0_candidatefinalfalse":true,"365fulltests_flush_messages_expected_faultinjection_not_runtimefailure":true,"source_project_package_traces_review_scripts_plan_budget_original180deadline_bound":true,"no_paidreservation_remote_write_deployment_publicrelease_or_substantive_localtraining":true,"ledger_bytes_unchanged_seven_closed":true,"independent_paused_epoch":1791175352.345762,"space_source_revision":"8044439043a1725dc5911577c85096cd04ddc4ae","actual_session":"onstate-20261004-v1","actual_mode":"onstate_study","actual_context":"ed3a53c349d08380401bc2a27d466ea58c378210","closed_historical_deadline_unchanged":1791144140.4793909,"next_action_hint":"IMPLEMENTstandalone opt-in readonlycompiledprocedurecallcounter JS, actualPlayer threadprocedures decorate afteroriginaltryCompile andexistingthreads, actualvalidatedvariantmapping/pushrestartduringadvance_reset guards. Synthetic normal_generator this_args_return_throw_yields_return_throw_executiontiming_coverage_whitelist_doubleinstall_uninstall_reset_saturation_unsupportedcompiler tests. No gameasset_physics_compilerenablement_raw217_reward_control_input_label change, counts/overflow only. Aftertests freshfreeze12rollout instrumented-uninstrumented nominal600 andsamefailed334keep-anchor_pressure ref-fast fidelity, max5072control1440EPISODEreset_PLUS240bridgebootstrap_EQUALS1680TOTALreset/180work210ownedsecs. Initial240beforecounterinstall_notinstrumentedcoverage; explicitfreshaccounting correction_notclosedplanrenewal. ALLnewoldphysics_actions_rewards_raw_memory_source exact plusmeaningfulnominalcompiledblockedfreecoverage/counterclock_reset before counterVALIDATION. Branchinterpretation afterwards/separate, no oldbranchclaim/newpressure/tuning/teacher/learning; unsupported_orchangedphysics=>nouse/no retrycaprenewal_gatechange. Restoreonlyownhooks/tables, failadmissionnotoriginalphysics."}}
{"run":84,"commit":"84331de","metric":0.0,"metrics":{"procedure_counter_fidelity_rollouts":12,"controlled_ticks":5072,"episode_reset_ticks":1440,"bridge_bootstrap_ticks":240,"total_reset_ticks":1680,"learning_updates":0,"counter_fidelity_gate_passed":1,"counter_validation_only_admitted":1,"nominal_blocked_body_entries":136,"nominal_free_hammer_entries":464,"nominal_wall_probe_entries":334,"nominal_hammer_substep_entries":2150,"authority_gate_passed":0,"teacher_data_admission":0,"summits":0,"deaths":0,"counter_synthetic_js_tests_passed":16,"full_python_tests_passed":365,"collision_js_tests_passed":1,"owned_elapsed_seconds":110.75763535499573,"all_closed_estimated_usd":0.4564241866528988},"status":"discard","description":"Opt-in compiledcall counters pass16synthetics and12rollout exactoriginal legacyphysics/raw fidelity/coverage/reset/ownhookrestore; diagnostics-only, climb/authority unchanged","timestamp":1791176918518,"segment":0,"confidence":null,"asi":{"hypothesis":"Read-only originalcompiled Player procedureentry counters provide branchdiagnostics without changing archived physical/control/observation trajectories","rollback_reason":"Countervalidation improves diagnostic visibility only, no physicalclimb/authority improvement. Keep testedopt-ininstrumentation; primarymetric0/statusdiscard, no counteroracle/teacher/learning or failedgatechange.","source":"research/procedure_counter.js","tests":"tests/procedure_counter.test.js","evidence":"artifacts/procedure_counter_fidelity_20261005_v1/verification.json","only_new_counter_module_all_legacy_source_game_compiler_controller_raw217_unchanged":true,"exact_WZ_variant_prefix_andkeysubstring1_encoding_verified_originalbundle":true,"aftertryCompile_existingthreads_andspawnrestart_lifecycle_interception_validated":true,"normal_generator_this_args_return_throw_yield_executiontiming_delegation_tests_pass":true,"bounded4096_perlabel_tick8192tracking_overflow_unsupported_metadata_no_physics_exception_suppression":true,"owned_one_state_diagnostic_envelope_stripped_before_env_raw217_controllerprocessing_no_extraRPCphysics":true,"all12_fulllegacy_physics_actions_rewards_infos_raw_contact_pressure_memory_exactoldarchive":true,"all6_backendpairs_modephysics_andall3_counterpairs_exact":true,"counterclock120plus_controlledtick_equalsstate_tick_episode_reset_andrestoration_verified":true,"nominal_meaningfulblockedfreecompiledcoverage_bothbackends":true,"counterentry_not_force_normal_bodytransfer_or_causalbranch_attribution_yet":true,"reference_instrumented_counter_sums":{"nominal":{"blocked_body":136,"free_hammer":464,"wall_probe":334,"hammer_substep":2150},"keep_anchor":{"blocked_body":73,"free_hammer":261,"wall_probe":151,"hammer_substep":1478},"pressure":{"blocked_body":73,"free_hammer":261,"wall_probe":151,"hammer_substep":1480}},"physical_outcomes_unchanged_nominalgain83_bothholds_failedgain11_noholds":true,"resetaccounting1440episode240bootstrap1680total_explicit_initial240uninstrumented":true,"old_episodeonly_resetfields_andallpoint_authority_recoverygates_immutable":true,"no_newcontrols_pressure_tuning_labels_teacher_training_paidreservation_remote_write_deployment_publicrelease":true,"tools_goal_metrics_projection_exact_to_pinnedstudy_completion0_candidatefinalfalse":true,"365fulltests_expected_faultinjection_flushmessages_not_runtimefailure":true,"source_module_plan_contract_admission_scripts_parent_budget_deadline_secretstrippedchild_durabletraces_cleanup_bound":true,"ledger_bytes_unchanged_seven_closed":true,"independent_paused_epoch":1791176918.5183554,"space_source_revision":"8044439043a1725dc5911577c85096cd04ddc4ae","actual_session":"onstate-20261004-v1","actual_mode":"onstate_study","actual_context":"ed3a53c349d08380401bc2a27d466ea58c378210","closed_historical_deadline_unchanged":1791144140.4793909,"next_action_hint":"Freeze180secondOFFLINE validated per-tickbranch attribution of6INSTRUMENTED savedtraces2536rows/0newplayresetupdates; bindsource_project_traces_completedfidelityreview_scripts_plan_budget. Fixednominalcontrolled367, failedcontactquery7-8 at332-333 andsharedcontrast334 plusdeclared8contactwindow. Actualuniqueprocedureentrycounts vstip_body_query_impulse_request_sourcephase; separatebranchcalls frombodymotion_force_normals/completeinverse dynamics andlaterunequalstatecontrasts. No newcontrollercriterion_plant_target_pressureduration_gain_cap_scan_probe_wrapperretry_oldgatechange_labels_learning. Counterdiagnostic NEVERpolicyinput_teacherlabel. Futurecontrol needsexplicitfreshlocalauthority contract, no privilegedbranchoracle feedback."}}
