{"run":85,"commit":"c8b5412","metric":0.0,"metrics":{"offline_attribution_traces":6,"offline_attribution_rows":2536,"new_controlled_ticks":0,"new_reset_ticks":0,"learning_updates":0,"failed_contact8_blocked_body_entries":0,"failed_contact8_free_hammer_entries":8,"failed_contact8_query_hit_posts_on_free_path":2,"nominal367_blocked_body_entries":1,"nominal367_body_dx":2.8674003356320554,"nominal367_body_dy":4.180985773129294,"nominal600_query_hit_posts_on_free_path":10,"baseline334_free_hammer_substeps":2,"pressure334_free_hammer_substeps":4,"authority_gate_passed":0,"teacher_data_admission":0,"new_summits":0,"new_deaths":0,"full_python_tests_passed":365,"counter_synthetic_js_tests_passed":16,"collision_js_tests_passed":1,"offline_audit_review_elapsed_seconds":3.330535411834717,"all_closed_estimated_usd":0.4564241866528988},"status":"discard","description":"Validated per-tick counters attribute failedcontact8 andcontrast334 tofreehammer, querypair notblockedtransfer; nominal367 blocked/rightuplift fromunequalhighpose, diagnostics only","timestamp":1791177695735,"segment":0,"confidence":null,"asi":{"hypothesis":"Validateduniqueprocedurecounts distinguish actualfree/blocked paths where rawqueryOR falsely suggested acquiredtransfer capability","rollback_reason":"Offlinepath evidence gives no newphysical gain/authority/robustlearner. Failed querypair/pressure executefreepath andbodyzero, nominaltransfer startsunequalhighpose. Retain diagnosticattribution only, no criterion/plant/gate/teacher/learning promotion.","evidence":"artifacts/branch_attribution_audit_20261005_v1/verification.json","all6instrumented2536rows_all3backendpairs_andshared333histories_exact":true,"everytick_one_exclusive_unique_original_blocked_or_free_entry":true,"failed_query_hit332333_andboth334contrasts_freepath_notblocked_body_transfer":true,"nominal367_snapshot":{"controlled_tick":367,"stage":"prefix","calls":{"blocked_body":1,"free_hammer":0,"hammer_substep":0,"wall_probe":1},"executed_unique_branch":"blocked_body","pre_body":[280.3608798284093,99.26669872487354],"post_body":[283.22828016404134,103.44768449800283],"body_delta":[2.8674003356320554,4.180985773129294],"pre_hammer":[291.9135969909686,69.79522708229332],"post_hammer":[291.9135969909686,69.79522708229332],"hammer_delta":[0.0,0.0],"pre_hammer_query":true,"post_hammer_query":true,"pre_logged_hammer_travel":0,"post_logged_hammer_travel":0,"pre_impulse":[0,2.5078801016454406],"post_impulse":[1.5770701845976307,2.2995421752211116],"logged_motor_request":[-9.831086865023721,-5.946211342967917],"base_source_phase":366,"action":[-0.1017550528049469,-0.5026302337646484],"applied_action":[-0.1017550528049469,-0.5026302337646484],"point_goal_error":null,"point_or_contact_completion_not_inferred_from_branch":true},"nominal600_branch_query_table":{"blocked_body_query0":0,"blocked_body_query1":136,"free_hammer_query0":454,"free_hammer_query1":10},"freepath_stillterrain_bodycollision_handling_not_proof_nocontact_force":true,"callentries_not_forces_normals_guaranteedbodytransfer_or_completeinverse_dynamics":true,"samehistory_counterfactual_controls_vs_nominalfailed_unequalstate_description_distinguished":true,"privilegedvalidatedcounts_NEVERcontrollerinput_livebranchoracle_teacherlabels":true,"allpoint1pixel30_authoritypoint1axes_sourcewrapper751pulse_fresh8of9_failures_immutable":true,"no_newplant_criterion_target_pressureduration_gain_cap_scan_proberetry_orlabels_training":true,"365Python16counterJS_collisionJS_expectedflushfaultinjection_messages_not_runtimefailures":true,"tools_goal_metrics_projection_exact_to_pinnedstudy_completion0_candidatefinalfalse":true,"source_project_traces_fidelityreview_scripts_plan_budget_original180deadline_bound":true,"no_paidreservation_remote_write_deployment_publicrelease_substantivelocaltraining":true,"ledger_bytes_unchanged_seven_closed":true,"independent_paused_epoch":1791177695.735806,"space_source_revision":"8044439043a1725dc5911577c85096cd04ddc4ae","actual_session":"onstate-20261004-v1","actual_mode":"onstate_study","actual_context":"ed3a53c349d08380401bc2a27d466ea58c378210","closed_historical_deadline_unchanged":1791144140.4793909,"next_action_hint":"Freeze180secondOFFLINE lower-support_jointpose geometryaudit same6validated instrumentedtraces2536rows/0newphysics, source_project_trace_review_script_plan_budget. Fixednominalcontrolled300..366 before367upperpose andfailed333. ONEpredeclared selector FIRSTnominalblocked_body inwindow withactualbodydy>.1 ANDposthammerY<postbodyY, none=>nofallback. Inspectactualprepost_body_tip_request_query_collider_approxterrain_nextstroke_relativeanchor/reach fromfailedlowpose before atmostONEmechanicalgeometricplant hypothesis. Nominalbranch evidenceofflineprior, no livecounterpolicyoracle_teacherlabels; sourceposeunequal/alpha notrenderer/entrynotforce. No point_gain_phase_tolerance_cap scans_newcontrols_proberetry_oldgatechange_learning. Newpoint/support law needsfreshordinaryprefix renderer contactANDmatchedactualbodyauthority, thenretainedrecovery_wholefreshdata_clockmemory. No retuningoldtwoquerycontroller orpromotingentry/query ashold."}}
{"run":86,"commit":"c306625","metric":0.0,"metrics":{"offline_lower_support_traces":6,"offline_lower_support_rows":2536,"new_controlled_ticks":0,"new_reset_ticks":0,"learning_updates":0,"selected_source_controlled_tick":362,"selected_source_body_dx":1.6895552344858515,"selected_source_body_dy":6.923428141059446,"selected_source_tip_displacement":0.0,"point_reach_from_failedpose":44.279108966120646,"point_height_above_failedbody":37.79522708229332,"source_prebody_error_from_failedpose":38.07351447557213,"point_legal_from_failedpose":1,"point_below_failedbody":0,"approximate_footprint_hits":0,"lower_support_design_gate_passed":0,"authority_gate_passed":0,"teacher_data_admission":0,"new_summits":0,"new_deaths":0,"total_alpha_queries":1974,"offline_audit_review_elapsed_seconds":5.028815507888794,"all_closed_estimated_usd":0.4564241866528988},"status":"discard","description":"One-selector earlier blockedlift returns SAMEupperpoint/legalbut37.8abovefailedbody; copiedlower-support hypothesis rejected, no fallback/tuning; pivot to explicit zero-residual scaffold design","timestamp":1791178827282,"segment":0,"confidence":null,"asi":{"hypothesis":"An earlier recorded lower blocked-body event might justify a transferable support point from the failed low pose","rollback_reason":"Firstevent362 uses SAMEpreviouslyfailedupperanchor, sourcebodyY69.8 whilefailed32, pointabovefailedbody/mismatch38pixels. Legalreach alone insufficient; lower-support designgatefalse. Rejectselectedcopy-point route, no fallback/scan or MLprogress claim.","evidence":"artifacts/lower_support_audit_20261005_v1/verification.json","one_source_selector_window300_366_firstblocked_updy_andtipbelowsourcepost_no_fallback":true,"selected_source_event":{"controlled_tick":362,"counts":{"blocked_body":1,"free_hammer":0,"hammer_substep":0,"wall_probe":1},"pre_body":[264.0926165210979,69.77575126047736],"post_body":[265.78217175558376,76.69917940153681],"pre_hammer":[291.9135969909686,69.79522708229332],"post_hammer":[291.9135969909686,69.79522708229332],"body_delta":[1.6895552344858515,6.923428141059446],"tip_displacement":0.0,"pre_query":true,"post_query":true,"pre_logged_travel":0,"post_logged_travel":0,"logged_request":[-6.793192187948271,-9.056190328726386],"pre_impulse":[-0.27715686312955223,3.080838799759732],"post_impulse":[0.6517805632849613,3.341664741683414],"action":[0.08467310667037964,-0.33297812938690186],"source_phase":361},"immediate_next_recorded_stroke":{"controlled_tick":363,"counts":{"blocked_body":1,"free_hammer":0,"hammer_substep":0,"wall_probe":1},"pre_body":[265.78217175558376,76.69917940153681],"post_body":[269.4694021396611,83.55892410342796],"pre_hammer":[291.9135969909686,69.79522708229332],"post_hammer":[291.9135969909686,69.79522708229332],"body_delta":[3.6872303840773384,6.859744701891145],"tip_displacement":0.0,"pre_query":true,"post_query":true,"pre_logged_travel":0,"post_logged_travel":0,"logged_request":[-8.026170094153931,-8.024019072302606],"pre_impulse":[0.6517805632849613,3.341664741683414],"post_impulse":[1.7114515972122941,3.3746847718380852],"action":[0.04738747328519821,-0.36690855026245117],"source_phase":362},"one_hypothesis":{"point":[291.9135969909686,69.79522708229332],"failed_body333":[268.8449971064618,32.0],"relative_point":[23.068599884506796,37.79522708229332],"target_reach":44.279108966120646,"equilibrium_pointer":[23.068599884506796,17.795227082293323],"normalized_action_not_applied":[0.18022343516349792,0.13902521133422852],"legal_from_failed_pose":true,"below_failed_body":false,"recorded_stationary_tip_le1":true,"source_body_reference_error_from_failed_pose":38.07351447557213,"source_anchor_query":true,"approximate_9x9_footprint_hits":0,"approximate_columns":[{"world_x":268.8449971064618,"highest_opaque_y_in_declared_band":-23},{"world_x":264.0926165210979,"highest_opaque_y_in_declared_band":-23},{"world_x":291.9135969909686,"highest_opaque_y_in_declared_band":65},{"world_x":287.9135969909686,"highest_opaque_y_in_declared_band":63},{"world_x":295.9135969909686,"highest_opaque_y_in_declared_band":65},{"world_x":291.9135969909686,"highest_opaque_y_in_declared_band":65}],"one_lower_support_test_design_only_admitted":false,"renderer_contact_or_bodyauthority_at_failedpose_tested":false},"same_upperpoint_as_closed_failedpoint_not_new_lowerplant":true,"nominalfailed_unequalpose_not_matchedforce_or_transferability_proof":true,"all3_backendpairs_pose_reach_scalarvector_alpha_originalcollider_geometry_verified":true,"alpha_notrendererauthority_branchentry_notforce_counterneverpolicyinput_teacherlabel":true,"no_newphysics_reset_optimizer_point_gain_phase_cap_tolerance_nudge_scan_orproberetry":true,"alloldpoint_authority_proxy_sourcewrapper_fresh8of9_gates_immutable":true,"no_reliable_learnedclimber_or_originalsummit_not_treating_diagnostics_as_climbing":true,"residual_learning_nextdirection_newdesign_not_training_launched_or_paidreserved":true,"handcoded_zeroactor_baselineholds_NEVERlearnerprogress_require_improvement_over_same_baseline":true,"no_counterlabels_or_supervisedteacherdata_admission_bypass":true,"no_paidreservation_remote_write_deployment_publicrelease_substantivelocaltraining":true,"ledger_bytes_unchanged_seven_closed":true,"independent_paused_epoch":1791178827.2823188,"space_source_revision":"8044439043a1725dc5911577c85096cd04ddc4ae","actual_session":"onstate-20261004-v1","actual_mode":"onstate_study","actual_context":"ed3a53c349d08380401bc2a27d466ea58c378210","closed_historical_deadline_unchanged":1791144140.4793909,"next_action_hint":"IMPLEMENT/unit/offline/physicalsmoke NEWzero-residual scaffold aroundUNCHANGED StrokeController contact_timed_feedback/frame1/horizon1800. Actor222=raw217+causalclampedphase1+baseproposal2+pastOWNissuedfinalcommand2, no branchoracle/seed_future_noise. Residual2axes[-1,1], finalfloat32clip(base+2residual,-1,1), zeroexactbaseline, overridepossible; ownhistory/actionobserve/prepost/reset/copy/terminalbudget guards. New222RMS old217notreused, base/residual/finalissued/actualapplied separated/ignoredclip notlabel. Offline600nominal+savedfailedbase parity thenfreshfreeze4rollouts baselinevszero nominal600ref-fast/max2400control/480episode240bootstrap720TOTALreset/180work210ownedsecs; alllegacyphysics_actions_raw217_rewards_baseclock exact, actor222causal. NOoptimizer/paidtrainingnow. Onlyaftergate NEWremote residualPPO contract/source/freshsession/reservation/preflight/deadline/3seeds/fixed9case matchedzero baseline, meanhead0/logstdlog(.01), saved222RMS+prior_scaffold_clockmemory. Limitschosenfutureplan, no blindBC/PPOscale/closedbatchresume/counterlabels. Learnedphysicalbenefit mustbeat SAMEhanddesigned baseline, notcountitsinitialholds asMLsuccess; fullsummit/heldoutgoalunchanged."}}
{"run":87,"commit":"5796206","metric":0.0,"metrics":{"scaffold_fidelity_rollouts":4,"controlled_ticks":2400,"episode_reset_ticks":480,"bridge_bootstrap_ticks":240,"total_reset_ticks":720,"offline_parity_rows":2702,"actor_dimension":222,"residual_scale":2,"scaffold_fidelity_gate_passed":1,"learned_improvement":0,"learning_updates":0,"baseline_reference_central_holds":1,"zeroactor_reference_central_holds":1,"baseline_reference_secondary_holds":1,"zeroactor_reference_secondary_holds":1,"baseline_retained_gain":83,"zeroactor_retained_gain":83,"summits":0,"deaths":0,"new_python_tests":16,"full_python_tests":381,"counter_js_tests":16,"collision_js_tests":1,"owned_elapsed_seconds":31.903157949447632,"all_closed_estimated_usd":0.4564241866528988},"status":"discard","description":"Explicit222 residual scaffold passes lifecycle/RMS contracts and byte-exact offline plus four-rollout original physical fidelity; zeroactor repeats hand-designed gain83holds, no learned improvement or summit","timestamp":1791180498712,"segment":0,"confidence":null,"asi":{"hypothesis":"An explicit causal222 residual scaffold can preserve the unchanged legal controller at zero correction and permit full-range future learned corrections.","rollback_reason":"Primary goal unchanged; this validates infrastructure, not an optimized or trained climber. Retain tested scaffold and evidence only; hand-designed zeroactor holds do not count as learner progress.","source":"research/residual_controller.py","tests":"tests/test_residual_controller.py","evidence":"artifacts/residual_scaffold_fidelity_20261005_v1/verification.json","only_new_scaffold_module_all_old_source_game_env_reward_controllers_unchanged":true,"explicit_actor222_raw217_sourcephase_baseproposal_ownissuedhistory_no_privileged_oracle":true,"strict_prepare_cached_action_actualobserve_prepost_reset_copy_terminal_horizon_guards":true,"matching222RMS_checkpoint_contract_rejects_old217_normalizer":true,"base_legalresidual_unclipped_finalissued_actualapplied_separate_not_teacherlabels":true,"offline_nominal600_failed751_eachbackend_2702_zeroactionbytes_basemetadata_exact":true,"all4_archived_physics_actions_rewards_info_raw217_base_andall2_backendpairs_exact":true,"baseline_zeroactor_physics_identical_causal222_source_own_context_reconstructed":true,"handdesigned_baseline_andzeroactor_same_final_pose":[322.58588646662605,104],"savedfailed_gain11_noholds_not_new_recovery":true,"zero_optimizer_modeltraining_teacherlabels_andphysicalgoal_promotion":true,"all_six_pinned_learning_contracts_and_tools_goal_metrics_projection_exact_goal0":true,"no_paidreservation_remote_write_deployment_publicrelease_or_substantive_localtraining":true,"immutable180work_210owned_source_plan_scripts_parent_grant_secretstripped_cleanup_bound":true,"ledger_bytes_unchanged_seven_closed":true,"independent_paused_epoch":1791180498.7127495,"space_source_revision":"8044439043a1725dc5911577c85096cd04ddc4ae","actual_session":"onstate-20261004-v1","actual_mode":"onstate_study","actual_context":"ed3a53c349d08380401bc2a27d466ea58c378210","closed_historical_deadline_unchanged":1791144140.4793909,"next_action_hint":"IMPLEMENT/test separate Gym222 residual adapter around unchanged raw217 absolute frame1 horizon1800 env/scaffold, residualBox2/rawclimb-v2reward, actualreset/sourceown history/cachednext preparation, correct222 terminal/time-limit observations and futurePPO bootstrapping without extra hypothetical basecalls. Test zeroactor meanhead/logstdlog(.01)/scale2/fresh222RMS/schema/savedprior_scaffold_provenance with bounded no-optimizer initialization/mock/savedtrace checks, no substantive localtraining/contactproxyrefinement. Onlythen NEWprivate3seed/fixed9case matchedzeroactor remotePPO plan/source/session/reservation/preflight/deadline with futurefrozen workcostlimits. No paidlaunch/oldbatchresume/teacherdata bypass/counterlabels/goalrelaxation. Learnedphysicalbenefit mustbeat SAMEhanddesigned baseline; goal0unchanged."}}
{"run":88,"commit":"87ef9fc","metric":0.0,"metrics":{"saved_mock_transitions":2702,"initialized_actor_seeds":3,"actor_predictions":8106,"reload_predictions":192,"distribution_rows":192,"mock_time_limit_endpoints":4,"actor_dimension":222,"adapter_initialization_pipeline_gate_passed":1,"optimizer_step_calls":0,"new_gameplay_ticks":0,"new_reset_ticks":0,"learning_updates":0,"new_summits":0,"new_deaths":0,"learned_improvement":0,"new_python_tests":18,"full_python_tests":399,"counter_js_tests":16,"collision_js_tests":1,"owned_elapsed_seconds":11.604574203491211,"all_closed_estimated_usd":0.4564241866528988},"status":"discard","description":"Gym222 residual adapter/read-only terminal context and zero-mean PPO actor pass399tests/2702savedmockrows/3initialized actor-RMS reloads, zerooptimizer/newphysics; learning remains untested","timestamp":1791181805277,"segment":0,"confidence":null,"asi":{"hypothesis":"A Gym222 residual adapter with causal read-only next/terminal context and zero-mean initialization supports actual PPO normalization/replay without source-clock drift or changing archived legal controls/rewards.","rollback_reason":"Primary completion unchanged; this is pipeline correctness, not a learned climber or new physical result. Retain tested adapter/policy only. Initialized seeds are not training-seed success replication; archive boundary truncations are explicitly mock, not original-game endings.","sources":["research/residual_env.py","research/residual_policy.py"],"tests":"tests/test_residual_env.py","evidence":"artifacts/residual_adapter_pipeline_20261005_v1/verification.json","only_two_new_modules_all_old_game_env_reward_scaffold_controller_source_unchanged":true,"pure_next_terminal_context_no_source_action_prepare_or_extra_physics_call":true,"actual_prepare_matches_cached222byte_context_one_applied_command_tick":true,"actor222_and_separate_source_own_issued_applied_history_no_seed_counter_future_noise_oracle":true,"all2702_saved_controls_rewards_infos_contexts_andall2_backend_pairs_exact":true,"all4_terminal_archive_boundaries_explicitly_mock_not_game_outcomes":true,"fresh222RMS_statistics_fit2702contexts_once_frozen_not_policy_optimizer_training":true,"three_untrained_actor_models_RMS_saved_reload_exact_no_parameter_drift":true,"zero_mean_head_logstdlogpoint01_scale2_stdpoint02_beforeclipping":true,"saved_nonzero_head_fixture_reloads_after_init_without_resetting_weights":true,"terminal222_vector_autoreset_and_time_limit_value_dimension_finite_tested":true,"matching_source_prior_schema_normalizer_guards_reject_old217":true,"historical_gain83baseline_holds_andfailed_gain11noholds_not_new_recovery":true,"all_six_pinned_learning_contracts_tools_goal_metrics_exact_goal0":true,"immutable180work210owned_source_scripts_plan_parent_deadline_secretstripped_cleanup_bound":true,"no_teacherlabels_learning_paidreservation_remote_write_deployment_publicrelease":true,"ledger_bytes_unchanged_seven_closed":true,"independent_paused_epoch":1791181805.277465,"space_source_revision":"8044439043a1725dc5911577c85096cd04ddc4ae","actual_session":"onstate-20261004-v1","actual_mode":"onstate_study","actual_context":"ed3a53c349d08380401bc2a27d466ea58c378210","closed_historical_deadline_unchanged":1791144140.4793909,"next_action_hint":"Implement separatelynamed fresh residualPPO study/trainer/evaluation/admission contract around validatedGym222, >=3trainingseeds/freshfixed9referencecases/matchedzeroactorbaseline/ordinaryspawn/frame1/horizon1800/rawclimb-v2/actual222RMS/savedsource_prior_scaffold_legaltrace. Freeze sample_update_elapsed_cost_checkpoint_physicalgates beforefullrun. Add physical/reset/optimizer counters throughwrapper, secretstripped directparent Linuxgrant/deadline/durablebackup/autopause; narrow unit/mock checks no substantive localtraining/contactcounteraudit. Onlyfreshprivate CPUUpgradepreflight with currentpricing_source_space_session_context/newledger reservation under10/fixednewdeadline; durablepassedpreflight+independentPAUSED beforeintentionaltrain. No activepaidbatchtoday/old217reuse/closedSACsessionresume/teacherdata bypass/counterlabels/goalrelaxation. Learnedphysicalbenefit mustbeat SAMEhanddesignedzeroactor baseline; fullsummit/heldout/upperroute/replay goal0."}}
