{"run": 34, "commit": "575b855", "metric": 0.0, "metrics": {"validated_completed_imitation_runs": 5, "hybrid_seed7_audited_control_ticks": 258000, "hybrid_seed7_audited_reset_ticks": 3000, "hybrid_seed7_complete_sampled_rows": 645, "hybrid_checkpoint_pairs_metadata": 6, "offline_paired_ticks_per_case": 1800, "first_post_action_body_distance_pixels": 0.06175228712174885, "first_prediction_difference_tick": 2, "first_hammer_query_difference_tick": 26, "first_body_query_difference_tick": 27, "first_body_distance_over_1px_tick": 28, "new_rollouts_or_training_updates": 0, "closed_plus_reserved_estimate_usd": 0.7726961856524149}, "status": "keep", "description": "Offline same-reset clone nominal/noisy pair shows early feedback/contact separation, not a specific causal noise block; hybrid prefix progresses unchanged", "timestamp": 1791114045785, "segment": 0, "confidence": null, "asi": {"hypothesis": "Successful perturbations may alter early alignment and continuing recovery, requiring controlled prefix/suffix tests rather than a time-indexed corrective oracle", "diagnostic_only": true, "not_new_policy_evaluation_learning_or_metric_improvement": true, "primary_metric_carried_forward": true, "session": "imitation-20261004-v1", "active_dataset_revision": "490e7e803d6ecad7ada8c6b5c8fb320a6015b861", "source_clone_dataset_revision": "44d2c66f7287e8cc31cdfcfa92af8103eb662db9", "evidence": "artifacts/imitation_pair_review_20261004T113802850890Z/pair_diagnostic.json", "phase": "behavior_cloning_then_ppo_seed_7", "prefix_source_data_grant_claim_runtime_deadline_valid": true, "latest_training_retained_gain": 189.47804304739262, "latest_training_both_holds_false": true, "same_reset_seed": 1001, "no_warmups_and_exact_first_raw_prediction": true, "all_applied_noise_recomputed_from_frozen_physical_clock": true, "first_applied_relative_pointer_delta_pixels": [-3.8330726623535156, -0.95745849609375], "nominal_final_retained_gain": 0.5291058416972945, "noisy_final_retained_gain": 81.66391274492042, "noise_continues_all1800ticks_no_prefix_causal_claim": true, "equal_first_prediction_not_proof_all_initial_features_equal": true, "later_prediction_differences_at_different_states_not_parameter_drift": true, "post_hoc_pair_not_independent_replications_or_success_rate": true, "same_five_final_lfs_identities_projected_goal_candidate_and_final_false": true, "no_binary_download_reload_extra_rollout_training_or_remote_writes": true, "fixed_source_budget_deadline_and_running_settings_unchanged": true, "next_action_hint": "Review seed7 hybrid final and unchanged seed8 next. After closure predeclare legal prefix/suffix and noise-removal interventions to separate alignment from continuing recovery; do not promote on-policy altitude, treat one noise stream as robustness, or silently add compute."}}

{"run": 35, "commit": "95a8e31", "metric": 0.0, "metrics": {"validated_completed_imitation_runs": 6, "completed_final_reference_cases": 54, "completed_final_central_holds": 1, "completed_final_secondary_holds": 1, "completed_final_full_climbs": 0, "completed_final_deaths": 0, "seed7_hybrid_median_retained_gain": 6, "seed7_hybrid_control_ticks": 393216, "seed7_hybrid_reset_ticks": 4320, "seed7_hybrid_policy_calls": 3840, "two_seed_training_control_ticks": 1572864, "two_seed_training_reset_ticks": 17280, "local_checker_and_goal_tests_passed": 17, "closed_plus_reserved_estimate_usd": 0.7726961856524149}, "status": "keep", "description": "Partial imitation evidence: complete seeds6/7 match initial/post-clone traces but no robust gate; seed7's one clone hold is absent after PPO, seed8 remains active", "timestamp": 1791115251119, "segment": 0, "confidence": null, "asi": {"hypothesis": "Demonstration initialization plus PPO requires controlled recovery and primitive-skill preservation, not presumed monotonic improvement", "partial_campaign": true, "complete_three_seed_cohorts": 0, "primary_metric_carried_forward_until_complete_cohorts": true, "no_robust_method_promotion_or_causal_forgetting_claim": true, "session": "imitation-20261004-v1", "dataset_revision": "7edf76f63f4a67a236145b9cf5e0e8b183688972", "evidence": "artifacts/imitation_two_seed_review_20261004T115807788438Z/review.json", "actual_active_phase": "ppo_from_scratch_seed_8", "source_context_game_data_runtime_deadline_claim_grant_valid": true, "initial_and_bc_hybrid_post_clone_traces_exact_for_both_complete_seeds": true, "seed7_final_medians_scratch_bc_hybrid": [10.924516129063626, 7.511520678820958, 6], "seed7_hybrid_nominal_pose": [134.8168495501905, 23], "seed7_hybrid_nominal_retained_gain": 2, "seed7_noise5_pre_ppo_hold_true_post_ppo_false": true, "seed7_noise5_retained_before_after": [81.66391274492042, 3.527898506757886], "seed7_noise5_post_ppo_pose": [211.46531035279364, 24.527898506757886], "paired_loss_not_diagnosed_cause_or_universal_ppo_harm": true, "seed7_hybrid_resets": 36, "seed7_hybrid_learning_seconds": 1634.0389245050028, "seed7_hybrid_bc_calls": 2000, "two_seed_ppo_calls": 15360, "two_seed_bc_calls": 8000, "two_seed_bc_presentations": 2048000, "two_seed_distinct_reference_rollouts": 126, "two_seed_reference_control_reset_ticks": [226800, 30240], "bc_duplicate_final_json_not_double_counted": true, "sixteen_saved_companions_immutable_metadata_only_not_loaded_or_portable": true, "projected_goal_helper_candidate_and_final_false": true, "all_hf_operations_reads_no_local_training_queue_source_or_budget_changes": true, "next_action_hint": "Finish unchanged seed8 and validate all nine contracts plus independent PAUSED before closing reservation. Then select bounded causal alignment/recovery and primitive-preservation diagnostics; do not scale this failed gate, rewrite partial history, or silently renew compute."}}

{"run": 36, "commit": "6eee57d", "metric": 0.0, "metrics": {"validated_completed_imitation_runs": 6, "scratch_seed8_audited_control_ticks": 393200, "scratch_seed8_audited_reset_ticks": 4560, "scratch_seed8_complete_sparse_rows": 983, "scratch_seed8_checkpoint_pairs_metadata": 9, "declared_probe_conditions": 4, "declared_probe_maximum_rollouts": 8, "declared_probe_maximum_control_reset_ticks": 16320, "launched_probe_rollouts_or_training_updates": 0, "new_paid_reservations": 0, "closed_plus_reserved_estimate_usd": 0.7726961856524149}, "status": "keep", "description": "Diagnostic preparation: pinned final-scratch prefix healthy; froze small post-closure noise-prefix/suffix probe with baseline/portability gate, not executed", "timestamp": 1791116490352, "segment": 0, "confidence": null, "asi": {"hypothesis": "Early alignment versus continuing perturbation/recovery can be distinguished by controlled masked-noise trajectories before designing corrective imitation data", "declaration_only": true, "not_learning_evaluation_or_hypothesis_confirmation": true, "primary_metric_carried_forward": true, "session": "imitation-20261004-v1", "active_dataset_revision": "5df6c20390ca641d8d10a2c62471e7f4142b922e", "evidence": "artifacts/imitation_last_seed_review_20261004T121802090256Z/declaration_verification.json", "probe_plan": "artifacts/imitation_last_seed_review_20261004T121802090256Z/causal_probe_plan.json", "phase": "ppo_from_scratch_seed_8", "prefix_source_data_grant_claim_runtime_deadline_valid": true, "sampled393200_not_complete393216_result": true, "latest_training_retained_gain": 26, "latest_training_both_holds_false": true, "same_six_final_lfs_identities_goal_candidate_and_final_false": true, "probe_reset_seed": 1001, "probe_controller": "behavior_cloning_only_seed_7", "probe_noise_seed": 8105, "probe_cutoff_tick": 60, "probe_case_ticks": 1800, "probe_backends": ["reference", "fast"], "probe_stream_mask_fixture_checks_passed": true, "probe_masked_blocks_still_advance_global_stream": true, "probe_maximum_control_ticks": 14400, "probe_maximum_reset_ticks": 1920, "probe_wall_cap_seconds": 600, "probe_post_hoc_selection_not_held_out": true, "probe_requires_current_comparison_terminal_paused_ledger_closed": true, "probe_requires_saved_baseline_reproduction_and_exact_backend_parity_first": true, "no_binary_download_local_training_rollouts_remote_writes_or_active_settings_changes": true, "no_budget_renewal_or_deadline_extension": true, "next_action_hint": "Finish and validate unchanged final seed and PAUSED/ledger closure. Then implement/execute the frozen bounded causal probe, stopping at baseline portability failure; no extra paid batch or treating phase-indexed expert suffixes as off-state labels."}}

{"run": 37, "commit": "95a8e31", "metric": 0.0, "metrics": {"validated_completed_imitation_runs": 8, "scratch_seed8_central_holds": 2, "scratch_seed8_secondary_holds": 6, "clone_seed8_central_holds": 2, "clone_seed8_secondary_holds": 4, "scratch_seed8_median_retained_gain": 81.82344678487053, "clone_seed8_median_retained_gain": 11.505030367150084, "completed_final_reference_cases": 72, "completed_final_full_climbs": 0, "completed_final_deaths": 0, "recomputed_seed8_metric_windows": 14, "local_checker_and_goal_tests_passed": 17, "closed_plus_reserved_estimate_usd": 0.7726961856524149}, "status": "keep", "description": "Partial imitation evidence: complete scratch/BC cohorts fail worst-seed gates despite real seed8 holds; transient support independently checked, last hybrid active", "timestamp": 1791117692549, "segment": 0, "confidence": null, "asi": {"hypothesis": "Occasional first-ledge contact and favorable retained height do not establish robust skill; recovery and initialization dependence must be tested", "partial_campaign": true, "complete_three_seed_cohorts": 2, "primary_metric_worst_seed_full_completion_rate": 0.0, "no_promotion_or_frozen_detector_change": true, "session": "imitation-20261004-v1", "dataset_revision": "8ab8568c299c2563302ee5ddb51c6339e7a280ef", "evidence": "artifacts/imitation_seed8_results_20261004T123812526317Z/review.json", "actual_active_phase": "behavior_cloning_then_ppo_seed_8", "source_context_game_data_runtime_deadline_claim_grant_valid": true, "scratch_seed_central_counts": [0, 0, 2], "clone_seed_central_counts": [0, 1, 2], "scratch_seed_secondary_counts": [0, 0, 6], "clone_seed_secondary_counts": [0, 1, 4], "both_complete_cohort_worst_seed_hold_and_completion_rates_zero": true, "scratch_nominal_pose": [344.63618880664416, 102.9068100358423], "scratch_nominal_secondary_true_central_false": true, "clone_nominal_pose": [268.50987615539674, 31.506020281343503], "clone_nominal_holds_false": true, "clone_central_held_cases": ["hammer_left", "hammer_right"], "all18_seed8_final_detectors_recomputed_equal": true, "four_central_plus_ten_secondary_windows_not_fourteen_independent_cases": true, "clone_noise3_and_noise4_secondary_hold_events_latched_but_final_region_left": true, "scratch_control_reset_ticks": [393216, 4560], "scratch_resets": 38, "scratch_policy_calls": 3840, "scratch_learning_seconds": 1406.8936082309956, "clone_bc_calls": 2000, "clone_presentations": 512000, "clone_rl_work": 0, "clone_bc_mse_after": 0.00008516183152096346, "clone_bc_wall_seconds": 6.810140538000269, "seed8_initial_reference_traces_exact_hybrid_post_clone_pending": true, "all_completed_held_counts_central_secondary_inventory_only": [5, 11], "twenty_one_saved_companions_immutable_metadata_only_no_reload_portability": true, "projected_goal_helper_candidate_and_final_false": true, "all_hf_operations_reads_no_local_rollouts_training_active_or_budget_changes": true, "next_action_hint": "Finish unchanged last hybrid, validate all nine full contracts/matched stages/companions and independently PAUSED before ledger closure. Execute only the separately frozen bounded causal probe afterward; no scaling from seed8 alone or relaxation of nominal/worst-seed/full-game gates."}}

{"run": 38, "commit": "95a8e31", "metric": 0.0, "metrics": {"validated_completed_imitation_runs": 9, "complete_three_seed_cohorts": 3, "final_reference_cases": 81, "final_central_held_events": 5, "final_secondary_held_events": 11, "final_full_climbs": 0, "final_deaths": 0, "training_control_ticks": 2359296, "training_reset_ticks": 26880, "ppo_optimizer_calls": 23040, "bc_optimizer_calls": 12000, "bc_sample_presentations": 3072000, "distinct_reference_control_ticks": 340200, "distinct_reference_reset_ticks": 45360, "closed_imitation_estimated_usd": 0.11472800100048383, "all_closed_estimated_usd": 0.4074241866528988, "local_checker_and_goal_tests_passed": 17}, "status": "keep", "description": "Complete imitation comparison validated and independently PAUSED; all worst-seed skill/summit gates fail, capped reservation closed without renewal", "timestamp": 1791118885689, "segment": 0, "confidence": null, "asi": {"hypothesis": "Legal demonstration initialization alone or before PPO yields occasional ledge contact but not robust control under the frozen three-seed comparison", "complete_campaign": true, "primary_metric_worst_seed_reference_full_completion_rate": 0.0, "no_first_skill_or_final_goal_promotion": true, "session": "imitation-20261004-v1", "source_space_revision": "95a8e311664789bcf1be5c609dce148e1f300f93", "dataset_revision": "c40574bb709f64fba893d3b44bc6f302306a51ad", "evidence": "artifacts/imitation_finish_review_20261004T125810739136Z/complete_review.json", "terminal_phase": "imitation_complete", "worker_completion_utc": "2026-10-04T12:57:06.720208+00:00", "independent_paused_epoch": 1791118690.7391362, "all_source_data_settings_dependencies_work_and_full_legal_traces_valid": true, "matched_initial_and_post_clone_reference_traces_all_seeds_exact": true, "central_counts_scratch_bc_hybrid": [[0, 0, 2], [0, 1, 2], [0, 0, 0]], "secondary_counts_scratch_bc_hybrid": [[0, 0, 6], [0, 1, 4], [0, 0, 0]], "retained_medians_scratch_bc_hybrid": [[-0.19732410640824583, 10.924516129063626, 81.82344678487053], [9, 7.511520678820958, 11.505030367150084], [24, 6, 5]], "all_nominal_central_gates_false": true, "last_hybrid_control_reset_ticks": [393216, 5040], "last_hybrid_policy_calls": 3840, "last_hybrid_learning_seconds": 1437.298550372987, "last_hybrid_nominal_pose": [133.29633643727433, 21.558627228283854], "last_hybrid_nominal_retained_gain": 0.5586272282838536, "cloned_held_cases_absent_after_ppo_not_general_causal_diagnosis": true, "distinct_reference_case_rollouts": 189, "bc_final_post_clone_alias_excluded_from_physical_exposure": true, "twenty_four_saved_companions_immutable_metadata_only_not_reloaded_or_portable": true, "cost_estimates_not_provider_bills_or_remaining_credits": true, "no_new_paid_reservation_resume_source_variables_resize_or_queue_change": true, "operator22bd00f8_listed_running_not_cancelled_on_batch_completion": true, "goal_helper_candidate_and_final_false": true, "next_action_hint": "Implement/execute already frozen local four-condition noise-prefix/suffix probe under600seconds/14400control+1920reset ticks/zero training or paid reservation. Current closure gate passes; require saved nominal/full-noise baseline reproduction and exact fast/reference parity, stop on portability/fidelity failure before causal interpretation. No blind scaling or closed-session restart."}}

{"run":39,"commit":"bbb4db8","metric":0.0,"metrics":{"baseline_rollouts":4,"local_controlled_ticks":7200,"local_reset_ticks":960,"training_updates":0,"first_remote_action_maximum_difference":5.960464477539063e-8,"noise5_first_body_coordinate_difference_over_1px_tick":257,"noise5_local_retained_gain":5.523155655865104,"local_python_tests_passed":229,"all_closed_estimated_usd":0.4074241866528988},"status":"keep","description":"Frozen local noise probe stops at saved-policy portability gate; recorded fast/reference fields match but remote first-action inference differs and noisy hold is not reproduced","timestamp":1791120948612,"segment":0,"confidence":null,"asi":{"hypothesis":"Pinned saved model/RMS should reproduce the chosen remote hold locally before early versus continued noise is interpreted","diagnostic_only":true,"primary_metric_carried_forward":true,"no_skill_or_causal_promotion":true,"evidence":"artifacts/imitation_noise_probe_20261004T133305314172Z/verification.json","plan_sha256":"aeb940ac3fb32209de78795cb83ebbabc69166c28ff85c47ba10651e92fe3d7c","status":"baseline_fidelity_or_portability_failed","recorded_local_backend_fields_exact":true,"saved_model_and_normalizer_bytes_verified":true,"saved_rms_exact_to_fresh_eligible_corpus_fit":true,"nominal_physical_body_trace_exact_to_remote_despite_action_mismatch":true,"noise5_local_final_pose":[219.48061130091162,26.523155655865104],"noise5_local_both_holds_false":true,"noise5_remote_final_pose":[334.4829332500256,102.66391274492042],"noise5_remote_both_holds_true":true,"noise5_maximum_body_coordinate_difference":185.96704781450975,"early_late_interventions_not_executed":true,"no_gate_relaxation_or_post_failure_physical_rerun":true,"torch_local_cpu_inference_build":"2.6.0+cu124","torch_remote_build":"2.6.0+cpu","observed_build_difference_not_diagnosed_cause":true,"preparation_failures_before_game_work":["Hub1.32 HTTP factory compatibility","Windows venv intermediate launcher ancestry"],"exact_windows_owned_launcher_exception_linux_training_guard_unchanged":true,"postrun_final_tool_additions_fixture_tested_only":["terminal post-step telemetry capture","source SHA admission binding","durable flushed partial rows and tick counts"],"timestamp_is_independent_pause_verification_epoch":true,"independent_paused_epoch":1791120948.6116133,"all_reservations_closed_no_remote_writes":true,"executed_diagnostic_tool_sha256":"7450d6d0327c15d7f108232b7b29c7e5d5af0c0f6f47ee066f342054f643a2aa","next_action_hint":"Diagnose fixed-input policy/RMS and recorded-action portability before retrying frozen prefix/suffix conditions. Preserve failed evidence and exact baseline gate; no blind BC/PPO scaling, closed-session restart, causal rounding claim or viewer work."}}
{"run":40,"commit":"2fb117f","metric":0.0,"metrics":{"fixed_normalized_inputs":512,"inference_variants":8,"inferred_sample_presentations":4096,"singleton_archived_action_maximum_error":0.0,"batch8_maximum_action_difference":1.341104507446289e-7,"batch512_maximum_action_difference":2.384185791015625e-7,"controlled_ticks":0,"reset_ticks":0,"training_updates":0,"focused_tests_passed":23,"all_closed_estimated_usd":0.4074241866528988},"status":"keep","description":"Bounded offline clone7 inference reproduces archived singleton actions exactly; batch shape changes numerics, cross-host equal-input cause remains unproven","timestamp":1791122563818,"segment":0,"confidence":null,"asi":{"hypothesis":"Fixed archived inputs can distinguish local inference nonrepeatability or batch/thread sensitivity from feedback-state divergence before causal interventions resume","diagnostic_only":true,"primary_metric_carried_forward":true,"no_skill_or_goal_promotion":true,"evidence":"artifacts/imitation_fixed_input_20261004T135949710988Z/verification.json","plan_sha256":"57f4c7fe50db580abd5ae686a28b2249fae07e4fc1ce7b69a8be8605c014399d","script_sha256":"cd437e4cfc677bbddaac3e97b8ccaf7ae58dad4cba320241ee9e0d94c3a07791","normalized_input_float32_sha256":"2de3acf7db8d72f46c356bc0b6b04ba09523b54b51cb0cbee1914b06d6792088","256_nominal_and_256_noise8105_pre_action_inputs":true,"saved_weights_timestep_and_rms_bytes_unchanged":true,"singleton_repeat_threads2_threads4_mkldnn_disabled_deterministic_algorithms_exact":true,"batch512_maximum_pointer_difference_pixels":3.0517578125e-5,"remote_full_observations_absent":true,"remote_action_comparison_not_equal_input_error":true,"no_torch_build_cause_or_held_loss_explanation":true,"source_space_revision":"95a8e311664789bcf1be5c609dce148e1f300f93","actual_session":"imitation-20261004-v1","actual_mode":"imitation_study","deadline_unchanged":1791162523.3790162,"independent_paused_epoch":1791122563.818163,"all_reservations_closed_no_hf_writes_or_model_downloads":true,"timestamp_is_independent_pause_verification_epoch":true,"next_frozen_plan":"artifacts/imitation_fixed_input_20261004T135949710988Z/recorded_action_plan.json","next_plan_launched":false,"next_plan_max_control_reset_ticks":[3600,480],"next_plan_max_wall_seconds":300,"next_action_hint":"Replay original noise8105 applied controls on reference/fast and capture raw/normalized pre-action states plus diagnostic-only actor predictions. Stop on physics mismatch. Do not feed predictions into replay, count it as saved-controller skill, loosen the failed causal-feedback baseline gate, restart the closed session or blindly scale training."}}

