{"run":69,"commit":"b021b1c","metric":0.0,"metrics":{"whole_wrapper_development_rollouts":36,"controlled_ticks":26980,"reset_ticks":4320,"learning_updates":0,"reference_original_final_central_supports":8,"reference_wrapper_final_central_supports":9,"reference_original_final_secondary_supports":9,"reference_wrapper_final_secondary_supports":9,"reference_wrapper_attempts":1,"reference_wrapper_bypasses":8,"minimum_reference_retained_gain":83,"edge_recovery_ticks":723,"bypass_and_original_ticks":751,"strict_new_ninecase_gate_passed":1,"fresh_fixed_wrapper_validation_admitted":1,"teacher_data_admitted":0,"summits":0,"deaths":0,"focused_python_tests_passed":41,"owned_elapsed_seconds":159.04748678207397,"all_closed_estimated_usd":0.4564241866528988},"status":"discard","description":"Unchanged causal wrapper passes full known9case development cohort with9/9finalcentral support versusoriginal8/9; one723tick recovery/eight751tick exactbypasses, freshwrapper validation only/no labels or learnedgoal promotion","timestamp":1791158683839,"segment":0,"confidence":null,"asi":{"hypothesis":"The fixed raw-state-triggered terminal primitive recovers the known edge landing without disturbing all other supported landings across the full development cohort","rollback_reason":"Primaryfullcompletion unchanged; hand-designed wrapper on reuseddevelopmentcases is not freshrobustteacher, learnedpolicy, multipletrainingseed or summit evidence. Retain passed development diagnostic candidate only for freshfixedwrapper validation, no teacher/corpus/labels/paidlearning admission.","controller_version":"causal-left-edge-terminal-wrapper-v1","evidence":"artifacts/terminal_wrapper_cohort_20261005_v1/verification.json","same9developmentcases_reset13001_noise12100_to12105_strongwarmups":true,"old600eightofninefailedgate_and_fixed90failure_preserved_not_reclassified":true,"unchanged_controller_prior_clock_macro_targets_gain_caps_proxy_and_metrics":true,"one_rawstate_checkpoint_no_case_seed_trace_oracle_rearm_or_recorded_prefix_override":true,"ordinary_spawn_no_privileged_reset_or_physics_change":true,"maximum751tick_opportunity_equal_but_not_equal_executed_ticks_or_terminal_times":true,"wrapper_stops_at_fixed_permanent_monitor_success_failure_or751cap":true,"edge_noise12100_original_final_pose":[293.72767718621054,104],"edge_noise12100_wrapper_final_pose":[314.42796145266976,104],"edge_base_plant_push_release_ticks":[600,30,1,92],"edge_settle_independent_hold_bodyquery_ticks":[2,90,90],"eight_other_referencecases_permanentbypass_full751physics_control_and_basemetadata_exactoriginal":true,"eight_bypasses_not_eight_independently_exercised_recoveries":true,"all18full_samehost_backend_pairs_exact":true,"all36old600physical_control_basemetadata_prefixes_exact":true,"all6known_smoke_fullphysics_andwrapperhistories_exact":true,"all36full_raw_milestone_position_velocity_support_action_observe_caseclock_reconstructions_verified":true,"all9wrapper_referencefinal90supportedcentral_windows_originalheldevents_and_no_deaths":true,"structured_cases_and_backendcopies_not_IID_binomial_or_extraindependent_trials":true,"newdevelopment_gate_pass_admits_freshwrapper_validation_only":true,"zero_teacher_corpus_labels_learning_paidreservation_remote_write_deployment_or_publicrelease":true,"frozen300work330owned_source_script_plan_prior_admission_bindings_secretstripped_child_and_ownedcleanup_passed":true,"ledgerbytes_unchanged_seven_closed_estimates":true,"independent_paused_epoch":1791158683.839298,"space_source_revision":"8044439043a1725dc5911577c85096cd04ddc4ae","actual_session":"onstate-20261004-v1","actual_mode":"onstate_study","actual_context":"ed3a53c349d08380401bc2a27d466ea58c378210","closed_historical_deadline_unchanged":1791144140.4793909,"next_action_hint":"Freeze9freshfixedwrapper development-validation cases:reset14001,nominal,left/right(+/-.75,-.125)*3/fourtickwarmups,noise.02/seeds13100..13105,unchanged originalversuswrapper/referencefast,max751ticks/36rollouts/27036control+4320reset/300work/330ownedseconds. Verify unusedexactcase/seedfields before declaration. Require9/9referencefinalcentral support/no deaths/nominalexact/fullfidelity/bypass preservation; do not presume activation by case, sweep targets/gain/proxy/caps/trigger or retry failures. Freshpass only admits separately captured actualpreaction/appliedcontrol data and honestclock-memory learnercontract, never automaticlabels/paidtraining/summit or unchangedBC/PPO scaling."}}
{"run":70,"commit":"877d1de","metric":0.0,"metrics":{"fresh_fixed_wrapper_rollouts":36,"controlled_ticks":26982,"reset_ticks":4320,"learning_updates":0,"reference_original_final_central_supports":7,"reference_wrapper_final_central_supports":8,"reference_original_final_secondary_supports":8,"reference_wrapper_final_secondary_supports":8,"reference_wrapper_attempts":1,"reference_wrapper_bypasses":8,"reference_cases_retaining83":8,"failed_case_retained_gain":11,"new_edge_recovery_ticks":724,"new_edge_settle_ticks":3,"new_edge_hold_ticks":90,"new_edge_hold_body_query_hits":90,"strict_fresh_ninecase_gate_passed":0,"separate_data_learner_contract_admitted":0,"summits":0,"deaths":0,"focused_python_tests_passed":41,"owned_elapsed_seconds":161.20710062980652,"auxiliary_boundary_review_metadata_errors":1,"all_closed_estimated_usd":0.4564241866528988},"status":"discard","description":"Fresh fixedwrapper reaches8/9central versusoriginal7/9, recovering a secondedge but failing strict9gate on earlier low-state acquisition failure; no data/learner/teacher admission","timestamp":1791159934604,"segment":0,"confidence":null,"asi":{"hypothesis":"The unchanged raw-state terminal wrapper generalizes to unused warmup/noise streams without harming central acquisition or requiring a case-aware trigger","rollback_reason":"Noise13105never acquires either ledge hold and is already269.482/Y32 at600checkpoint; correctineligiblebypass cannotrepairearlier base acquisition. Frozen9/9central gate fails despite8successes/secondedge recovery. Retain diagnostic tooling/evidence only; no8case-onlycorpus, labels, learnercontract, retuning or paid scaling.","controller_version":"causal-left-edge-terminal-wrapper-v1","evidence":"artifacts/terminal_wrapper_fresh_20261005_v1/verification.json","boundary_evidence":"artifacts/terminal_wrapper_fresh_20261005_v1/failure_boundary_review.json","fresh_reset_seed":14001,"fresh_noise_seeds":[13100,13101,13102,13103,13104,13105],"fresh_warmups":[[-0.75,-0.125],[0.75,-0.125]],"exactcase_seed_fields_unused_before_declaration_hiddenignored_jsonjsonl_search":true,"samefixedsource_controller_clock_prior_macro_gain_caps_proxy_physics_and_metrics":true,"ordinary_start_actualoutputs_continuednoise_no_recordedprefix_override_or_placement":true,"new_edge_noise_seed":13101,"new_edge_original_pose":[295.1692317558187,104],"new_edge_wrapper_pose":[315.2375174579919,104],"new_edge_base_plant_push_release_ticks":[600,30,1,93],"new_edge_settle_hold_bodyhit_ticks":[3,90,90],"second_exercised_recovery_not_eightrecoveries_or_learnedskill":true,"eightother_full751permanentbypass_control_physics_basemetadata_histories_exact":true,"failed_noise_seed":13105,"failed_at600checkpoint_and_final_pose":[269.48184482655313,32],"failed_checkpoint_rawbodyqueryhit":1.0,"failed_checkpoint_and_final_base_phase":599,"failed_both_held_events_ever_false":true,"failed_final90bodyqueryfraction":1.0,"failed_final90max_speed":0.48170276080674057,"failed_ineligible_checkpoint_correctlybypasses_not_failed_plant_or_phase_stall":true,"boundarylocates_earlieracquisition_not_causalaction_error":true,"all18full_samehost_backend_pairs_exact":true,"all18freshwrapper_first600physical_control_basemetadata_histories_exactoriginal_arm":true,"all4historical_nominal_fullhistories_exact":true,"all36full_rawmilestone_support_proposed_applied_control_caseclock_actionobserve_chronologies_verified":true,"equalmaximum751not_equal_executed_ticks_or_terminaltimes":true,"strictfresh9of9gate_and_separatedatalearnercontractadmission_false":true,"no_posthoc8of9or_secondarysubstitute_and_oldfailedgates_immutable":true,"auxiliaryboundaryinspection_error_preserved":"KeyError phase; actual metadata selected_phase. Inspection corrected only, no frozenreview or physics rerun.","frozen300work330owned_source_script_plan_prior_admission_budget_bindings_secretstripped_child_and_ownedcleanup_passed":true,"no_teacher_corpus_labels_updates_paidreservation_remote_write_deployment_or_publicrelease":true,"ledgerbytes_unchanged_sevenclosed_estimates":true,"independent_paused_epoch":1791159934.6042366,"space_source_revision":"8044439043a1725dc5911577c85096cd04ddc4ae","actual_session":"onstate-20261004-v1","actual_mode":"onstate_study","actual_context":"ed3a53c349d08380401bc2a27d466ea58c378210","closed_historical_deadline_unchanged":1791144140.4793909,"next_action_hint":"Freeze180secondOFFLINE acquisition/contactaudit of existing nominal,failednoise13105,successfulnoise13104 originaltraces/referencefast,6traces/4506rows,0newplay/reset/updates, boundtrace/source/completedreview/script/plan/budgethashes. Inspect priororderedstroke/contacttransition,actualhammerquery/travel/bodymotion/appliedcontrols andoriginalmotor/solver response before deriving distinctlocalauthoritytest. Equalprefix local effects only; unequalstates descriptive/querynotforceorprivilegedbranch. No terminaltriggerwidening/phasejump/gain/target/cap/proxy/thresholdscan/closedcase retry, detectorrelaxation, labels or paidlearning. Any newphysicalhypothesisneeds freshcontract/recovery/fidelity/fullvalidation before separatecaptureddata/clockmemorylearnercontract."}}
{"run":71,"commit":"d66c65c","metric":0.0,"metrics":{"offline_saved_traces":6,"recorded_rows_examined":4506,"new_gameplay_ticks":0,"new_reset_ticks":0,"learning_updates":0,"failed_body_x200_crossing_tick":269,"failed_body_x250_crossing_tick":276,"failed_body_y65_crossing_tick":268,"failed_final_x_invariant_suffix_start_tick":500,"failed_last_hammer_query_hit_tick":482,"failed_last120_body_query_hits":120,"failed_last120_hammer_query_hits":0,"failed_last120_saturated_corrections":120,"failed_vs_nominal_body_separation_over1_tick":30,"failed_vs_nominal_body_separation_over10_tick":289,"selected_local_controlled_tick":300,"derived_target_reach_pixels":90.86486584755787,"new_gameplay_admission":0,"teacher_data_admitted":0,"all_closed_estimated_usd":0.4564241866528988},"status":"discard","description":"Frozen offline acquisition/contact audit locates lower planted hammer at tick300 and late free-hammer saturation; one mechanically derived next-prior release target only, no new recovery or labels","timestamp":1791160887322,"segment":0,"confidence":null,"asi":{"hypothesis":"Saved ordered-stroke/contact evidence and original motor/solver source can motivate a distinct local authority check for failed acquisition without tuning the closed controller or treating unequal-state comparisons as causality","rollback_reason":"No new player/learnedpolicy/primaryfullcompletion improvement. Offline facts and proposed legal world target cannot establish release, body lift, robustteacher or validlabels. Retain audit/proposal for a separately frozen one-step local original-physics response test only.","evidence":"artifacts/acquisition_audit_20261005_v1/verification.json","proposal_evidence":"artifacts/acquisition_audit_20261005_v1/local_authority_proposal.json","original_source_excerpt":"artifacts/acquisition_audit_20261005_v1/original_contact_excerpt.txt","frozen180second_offlineaudit_finished_within_original_deadline":true,"all6trace_project_source_completedreview_script_plan_budget_hashes_verified":true,"all6raw_milestone_proposed_applied_control_clocks_and3backendpairs_exact":true,"failed_noise13105finalpose":[269.48184482655313,32],"failed_never_reaches_bodyX285_orY100":true,"nominal_successful_noise13104_y100tick367_x285tick368":true,"failed_tailsaturated_correction_and_freehammer_not_bodyauthority_or_ledgehold":true,"fixed_snapshot300_failed_bodypre":[270.9898166358471,38.32182288169861],"fixed_snapshot300_failed_hammerpre":[194.99469098448753,-8.487296879291534],"fixed_snapshot300_failed_previous_hammerquery_hit_travel0":true,"fixed_snapshot300_failed_bodymotion":[-1.1951171645040972,-3.279796131344746],"fixed_snapshot300_failed_hammerfixed_nominalhammerfree":true,"nominal_snapshot300_hammerpre":[188.48037515580654,0.6701748371124268],"nominal_previous_hammerqueryfalse_travel":2.8508529663085938,"allstreams_appliedcontrol_state_commonprefix_zero_equalfirstpreonly":true,"later_unequalstate_contact_and_motion_comparisons_descriptive_not_firstcausalerror":true,"original_motor0point4_blocked_bodyminus0point5_excerpt_exact_querynotforceorbranch":true,"one_goal_from_ordered_next_rawprior_row300_no_target_action_clock_scan":true,"proposed_rawprior_hammerworldgoal":[186.93234430253506,3.8143571615219116],"original_renderoffset_all4506savedstates":[0,20],"proposed_pointer_pixels":[-84.05747233331203,-54.5074657201767],"proposed_float32action":[-0.656699001789093,-0.4258395731449127],"derived_pointer_and_reach_legal_independentlyverified":true,"priorgoal_not_futurefailedobservation_or_offstate_teacher_label":true,"no_realrelease_bodylift_or_fullrecovery_demonstrated":true,"later_boundedproposalreview_not_audit_retry_deadline_extension_or_newgameplay":true,"fresh8of9failedgate_and_allhistoricalgates_preserved":true,"no_teacher_corpus_labels_paidreservation_remote_write_or_publicrelease":true,"ledgerbytes_unchanged_sevenclosed_estimates":true,"independent_paused_epoch":1791160887.322387,"space_source_revision":"8044439043a1725dc5911577c85096cd04ddc4ae","actual_session":"onstate-20261004-v1","actual_mode":"onstate_study","actual_context":"ed3a53c349d08380401bc2a27d466ea58c378210","closed_historical_deadline_unchanged":1791144140.4793909,"next_action_hint":"Freeze nominal600historicalreferencefast gate, then baseline versusONEderived hammer-world goal action atcontrolledtick300 after299exactordinary failednoise13105/reset14001prefix/samecontinuednoise.6rollouts/max2400control+720reset/180work/210ownedseconds, source/prior/proposal/budget/plan/deadline binding, equalactualpreinput/fullprefix/baseline/fidelity. Require reducedhammer-worldtargeterror plus actualqueryrelease OR positivehammertravel/nodeaths, not assumed bodylift. Localactuatorresponse only; no further target/push/timingattempts, placement, phasejump/gain/proxy/cap/trigger sweeps, closed9case retry or labels/learning. Newcausalcontroller/recovery/freshvalidation contracts needed before separatecaptureddata/clock-memorylearner admission."}}
{"run":72,"commit":"0166d34","metric":0.0,"metrics":{"local_release_rollouts":6,"controlled_ticks":2400,"reset_ticks":720,"learning_updates":0,"exact_common_prefix_ticks":299,"declared_contrast_tick":300,"common_pre_hammer_target_error":14.708234477375347,"baseline_post_hammer_target_error":14.708234477375347,"candidate_post_hammer_target_error":11.145062380556487,"baseline_hammer_travel":0,"candidate_hammer_travel":4.474497013653487,"incremental_hammer_x":-4.049067405419521,"incremental_hammer_y":1.9042522604852552,"incremental_body_x":3.979039320256561e-13,"incremental_body_y":2.842170943040401e-14,"local_actuator_response_gate_passed":1,"full_recovery_admitted":0,"teacher_data_admitted":0,"summits":0,"deaths":0,"focused_python_tests_passed":41,"owned_elapsed_seconds":30.928560256958008,"all_closed_estimated_usd":0.4564241866528988},"status":"discard","description":"Single derived hammer-world action from identical299tick history releases lower plant and reduces targeterror with effectively unchanged body motion; localgate only/no recovery or learning","timestamp":1791162189195,"segment":0,"confidence":null,"asi":{"hypothesis":"A mechanically derived next-prior hammer-world goal releases the lower blocked hammer at the declared stroke, unlike continued body-error pushing, from identical actual pre-state with unchanged noise","rollback_reason":"Localrelease gate passes but no firstledge recovery/teacher/learnedpolicy/fullcompletion improvement. Candidatecase stops300ticks without hold and bodyincrement is numericalresidual. Retain tested oneaction/localresponse evidence for separately frozen follow-through only, no labels/corpus/paidlearning.","evidence":"artifacts/hammer_release_probe_20261005_v1/verification.json","nominal600referencefast_historical_central_support_gate_exact":true,"all299prefix_proposed_applied_controls_fullphysics_and_finalactual217preinput_prestate_equal":true,"ordinary_start_sourcecontroller_prefixes_actuallyapplied_no_placement_recordedoverride_or_savedstate_load":true,"exactly_one_tick300candidate_override_eachbackend_explicitdiagnostic_not_closedloop_teacher":true,"same_worldgoal":[186.93234430253506,3.8143571615219116],"same_rawpre_body_fixedoriginaloffset0_20_formula_and_legallimits":true,"same_noise13105_reset14001_continued_globalfourtick_clock":true,"candidate_posttargeterror_below_bothcommonpre_andbaselinepost":true,"baseline_queryhit_true_candidate_queryhit_false":true,"candidate_actual_hammer_travel_positive":true,"incremental_body_only_numericalresidual_not_lift":true,"controlled_localrelease_not_causalproof_firstfailure_or_fullrecovery":true,"all6full_rawmilestone_proposed_applied_control_caseclock_histories_verified":true,"all3full_samehost_backend_pairs_exact":true,"all_nominal600_baseline300_prior_sourcehistories_exact":true,"no_target_action_clock_gain_cap_proxy_scan_extraactions_or_cutoff_extension":true,"freshfailed8of9gate_and_otherhistoricalgates_preserved":true,"zero_fullrecovery_teacher_labels_corpus_updates_paidreservation_remote_write_deployment_publicrelease":true,"frozen180work210owned_source_prior_proposal_audit_plan_script_parent_budget_deadline_secretstripped_child_durabletraces_cleanup_passed":true,"ledgerbytes_unchanged_sevenclosed_estimates":true,"independent_paused_epoch":1791162189.1954892,"space_source_revision":"8044439043a1725dc5911577c85096cd04ddc4ae","actual_session":"onstate-20261004-v1","actual_mode":"onstate_study","actual_context":"ed3a53c349d08380401bc2a27d466ea58c378210","closed_historical_deadline_unchanged":1791144140.4793909,"next_action_hint":"Freeze separate follow-through:nominal600historicalreferencefast gate; original vssameONEderived tick300hammer-world pulse after299exactordinary failed13105/reset14001prefix,then unchangedoriginalcontactcontroller/samecontinuednoise throughfixed751.6rollouts/max4204control+720reset/180work/210ownedseconds. Require oldnominal/prefix/base751/candidate300exact/rawmetrics/fullfidelity, candidate originalcentralheld AND final90central/speed2/bodyfraction.8/nodeaths; reportsecondary notsubstitute. No automaticterminalmacro/secondrelease/addedpushes/target_phase_gain_cap_cutoffscan or closed9case retry. Pulseplusfeedback continuation is diagnosticnotdirectsingle-step bodyeffect; only recoverygate forlatercausalcontrollerdesign, not teacherlabels/learning. Causalimplementation/freshvalidation/separatedata_clockmemorylearnercontract remainrequired; no unchangedBC/PPO scaling."}}
