{"run":48,"commit":"47ee182","metric":0.0,"metrics":{"eligible_original_demo_rows":3576,"successful_learner_rows":1800,"exact_learner_input_matches_to_original":1,"learner_to_demo_median_normalized_distance":7.60207667369509,"original_demo_leave_one_out_median_distance":0.26764585162474447,"learner_rows_with_clip_bound_features":39,"merged_exact_input_conflicting_groups":1,"merged_maximum_normalized_action_range":0.038982510566711426,"captured_replay_raw_link_rows_exact":1800,"new_controlled_ticks":0,"new_reset_ticks":0,"training_updates":0,"repository_unittest_safeguards_passed":25,"all_closed_estimated_usd":0.4179241866528988},"status":"keep","description":"Offline selected-success data audit finds new state coverage and shared-input target ambiguity; existing captured raw replay inputs link exactly, next step is matched data-addition learning rather than more diagnostics","timestamp":1791132655448,"segment":0,"confidence":null,"asi":{"hypothesis":"Successful learner-state controls may add useful on-state examples missing from the original demonstrations, but target ambiguity and normalized clipping must be audited before admission","diagnostic_only":true,"primary_metric_carried_forward":true,"no_saved_controller_or_skill_improvement":true,"evidence":"artifacts/learner_coverage_audit_20261004T163822133756Z/verification.json","audit_plan_sha256":"36e67dc2a8fa0c9f19f26c1473523a2960d254a11d5a2a14402e26e0db4dbb0e","audit_script_sha256":"a0d4b4c3e269bf850fe17be5579426b0be67b4364dde044df536d00a718d188f","frozen_saved_rms_exact_to_eligible_corpus":true,"preaction_inputs_and_legal_applied_noise_controls_verified":true,"nearest_distances_descriptive_not_ood_threshold_or_causal_failure_proof":true,"near_state_targets_not_corrective_oracle":true,"all1800learner_inputs_unique":true,"single_shared_input_action_ambiguity_not_impossibility":true,"no_inverse_clipping_or_fabricated_raw_labels":true,"previous_exact_legal_replay_raw_normalized_inputs_and_actions_match_feedback_probe":true,"no_new_physical_replay_needed_for_candidate_raw_data":true,"source_selected_noise8105_now_development_not_independent_validation":true,"live_space_paused_terminal_noise_probe_complete":true,"terminal_artifact_revision":"12c5b0fa35ad89a4001a0ee886b142a7e8b2373e","all_six_paid_batches_closed_unchanged_no_hf_writes":true,"pytest_attempt_unavailable_then_repository_unittest25passed_no_install":true,"user_transparency_updates_lead_with_player_behavior_and_learning_not_machinery":true,"next_action_hint":"Implement safe admitted learner-state data derivation and a fresh matched three-seed actor-only BC comparison, original demonstrations versus original plus actual logged successful-state controls. Keep original frozen RMS/architecture/initializations and equal optimizer/sample budgets; predeclare mixture weights, visible ambiguity handling and fresh reference perturbations before training. No additional PPO or kernel/transport diagnostics; repeating8105is overfit evidence, not independent robust skill. New scientific contract/admission/source/preflight/session/immutable budget are required before paid execution."}}

{"run":49,"commit":"7cbc4f9","metric":0.0,"metrics":{"admitted_original_rows":3576,"admitted_logged_success_rows":1800,"admitted_total_rows":5376,"pipeline_smoke_bc_calls":16,"pipeline_smoke_sample_presentations":1024,"new_controlled_ticks":0,"new_reset_ticks":0,"ppo_optimizer_calls":0,"full_study_training_updates":0,"python_tests_passed":266,"allowlisted_bundle_files":440,"all_closed_estimated_usd":0.4179241866528988},"status":"keep","description":"Implement hash-bound logged learner-state data admission and frozen matched actor-only comparison; real two-arm bounded smokes pass, full on-state training remains separately gated and unlaunched","timestamp":1791133809562,"segment":0,"confidence":null,"asi":{"hypothesis":"On-state successful applied controls can be added without corrupting original normalization or mistaking a selected noisy trajectory for independent reactive expertise","implementation_and_pipeline_smoke_only":true,"primary_metric_carried_forward":true,"no_new_physical_skill_or_full_training_result":true,"evidence":"artifacts/onstate_pipeline_20261004T170617730137Z/verification.json","derived_data_sha256":"c2d0895d56706d3c0797effae5018928229866d95c22bb72c42706876f43c268","raw_captured_replay_inputs_not_inverse_clipping":true,"source_hashes_preaction_indices_and_actual_noise_controls_admitted":true,"original3576row_rms_exact_and_frozen":true,"all_logged_target_ambiguity_retained_visible":true,"fixed_original_augmented_sampler_counts":[[512,0],[384,128]],"matched_seed9_initial_parameters_and_saved_reload_exact":true,"value_logstd_ppo_optimizer_timestep_state_preserved":true,"frozen_new_full_study_seeds":[9,10,11],"frozen_architecture":[256,256],"full_study_matched_updates_batch_presentations":[2000,256,512000],"fresh_noise_validation_seeds":[10100,10101,10102,10103,10104,10105],"selected8105not_independent_validation":true,"first_skill_and_full_summit_gates_unchanged":true,"full_onstate_work_refused_even_with_old_imitation_permit":true,"first_test_fixture_exceeded_fixed8MiB_archive_limit_then_corrected_not_relaxed":true,"readonly_target_tensors_copy_before_conversion":true,"source_space_revision":"7be7d58de881f1b9e4c69c87958e1818d4693d8b","actual_session":"noise-probe-20261004-v1","actual_mode":"noise_control_probe","actual_stage":"PAUSED","independent_paused_epoch":1791133809.5616088,"all_six_reservations_closed_no_hf_writes_launch_or_deployment":true,"proposed2hour_006usd_next_budget_not_reserved":true,"next_action_hint":"Implement source/data/contract-bound isolated Linux trainer/worker admission and strict six-run result checker reusing existing durable claims, immutable deadlines, secret-stripped children, backups and automatic pause. Then new source/context/preflight/session/reservation before the frozen three-seed two-arm learning launch. Current support is smoke-only; no old permit/session reuse, more diagnostics, additional PPO or blind scaling."}}

{"run":50,"commit":"5fc40cf","metric":0.0,"metrics":{"python_tests_passed":289,"allowlisted_bundle_files":448,"end_to_end_smoke_reference_rollouts":4,"smoke_controlled_ticks":512,"smoke_reset_ticks":960,"smoke_bc_optimizer_calls":16,"smoke_sample_presentations":1024,"smoke_held_events":0,"smoke_summits":0,"smoke_deaths":0,"ppo_optimizer_calls":0,"full_study_training_updates":0,"all_closed_estimated_usd":0.4179241866528988},"status":"keep","description":"Validate fresh data-bound Linux on-state runner, six-run checker and private preflight/study routes; both original-renderer CLI smokes stay on ground, paid preflight and full comparison unlaunched","timestamp":1791135286908,"segment":0,"confidence":null,"asi":{"hypothesis":"The frozen data-addition learning comparison can execute under exact original-RMS, fresh-source, matched-seed, no-resume and conservative resource contracts without accepting old permits or diagnostic results as skill","execution_implementation_and_bounded_smoke_only":true,"primary_metric_carried_forward":true,"no_improved_climbing_or_full_training_result":true,"evidence":"artifacts/onstate_execution_20261004T172829900864Z/verification.json","tested_bundle":"artifacts/hf_bundle_20261004T173335214453Z","bundle_uploaded":false,"scientific_seeds_architecture_mixture_budgets_fresh_evaluation_cases_unchanged":true,"data_archive_sha256":"c2d0895d56706d3c0797effae5018928229866d95c22bb72c42706876f43c268","new_onstate_grant_not_old_imitation_permit_required_for_full_work":true,"exact_live_linux_parent_creation_time_source_data_claim_paths_and_budget_bound":true,"source_mixture_bc_prefixes_durable_and_failed_partial_warm_start_not_retryable":true,"training_interface_rejects_physics_steps_and_resets":true,"private_pinned_downloads20s_backups_cleanup_reserve_and_guaranteed_final_pause_tested":true,"six_run_checker_requires_real_work_complete_cohorts_matched_initial_trace_and_fresh_cases":true,"goal_projection_uses_research_goal_metrics_final_always_false":true,"smoke_matched_initial_weights_and_untrained_reference_traces_exact":true,"four_smoke_retained_gains":[0,0,0,0],"smoke128ticks_not_frozen1800tick_skill_measurement":true,"actual_private_space_stage":"PAUSED","source_space_revision":"7be7d58de881f1b9e4c69c87958e1818d4693d8b","actual_session":"noise-probe-20261004-v1","actual_mode":"noise_control_probe","independent_paused_epoch":1791135286.9078948,"all_six_reservations_closed_no_hf_write_launch_or_renewal":true,"next_action_hint":"Verify current pricing/PAUSED ownership and reserve a unique fresh <=2h/<=0.06USD on-state session within the cumulative10USD ceiling. Publish tested source, unchanged admitted corpus and source/data-bound preflight context while PAUSED; intentionally launch only onstate_preflight. Verify durable complete eight-check passed preflight and independent PAUSED before matching study ticket/mode restart inside the original unchanged deadline. No automatic launch from failed/incomplete preflight, old closed-session restart, more kernel diagnostics or additional PPO."}}

{"run":51,"commit":"f38dbe0","metric":0.0,"metrics":{"local_preflight_guard_tests_passed":22,"maximum_reserved_compute_usd":0.06,"closed_plus_reserved_estimated_usd":0.4779241866528988,"validated_completed_remote_preflight_checks":0,"validated_new_reference_outcomes":0},"status":"keep","description":"Fresh private matched on-state preflight published while PAUSED and intentionally launched under one fixed budget; first durable admission RUNNING, no completed checks or learning outcome inferred","timestamp":1791136999765,"segment":0,"confidence":null,"asi":{"hypothesis":"The frozen original-versus-logged-success data comparison needs passed Linux correctness, fidelity, resource and bounded-smoke preflight before full actor-only learning is admitted","launch_and_startup_admission_only":true,"primary_metric_carried_forward":true,"no_physical_skill_preflight_completion_or_full_training_claim":true,"session":"onstate-20261004-v1","mode":"onstate_preflight","source_space_revision":"8044439043a1725dc5911577c85096cd04ddc4ae","context_revision":"0675220a2a01544e20fdee9bfc4e2f01aa168f00","data_revision":"b1d44bd3f157e0a00809116c7b3c1e085401b6a1","startup_artifact_revision":"3416e48bb72d84c475e3f1e1b8f70f41578e95d6","evidence":"artifacts/onstate_deployment_20261004T175845470617Z/startup_verification.json","source_and_unchanged_admitted_data_published_while_independently_paused":true,"remote_startup_source_game_data_fingerprints_exact":true,"owned_private_targets_cpu_upgrade_never_sleep_one_replica_verified":true,"official_price_003usd_hour_reverified_date":"2026-10-04","source_bundle_files":448,"persisted_ticket_preflight_none_not_fabricated_pass_evidence":true,"actual_stage":"RUNNING","actual_phase":"onstate_admitted","error":null,"full_training_not_requested":true,"start_epoch":1791136940.4793909,"immutable_deadline_epoch":1791144140.4793909,"same_reservation_and_deadline_cover_preflight_and_any_later_study":true,"six_historical_batches_closed_and_unchanged":true,"no_running_image_variables_queue_or_deadline_changes_after_launch":true,"no_old_closed_session_resume_budget_renewal_or_goal_promotion":true,"next_action_hint":"Read one later bounded pinned snapshot, validate all eight declared complete preflight checks, exact source/data/RMS/fidelity/resource/smoke work and independently PAUSED. Only then publish a matching passed study ticket and intentionally start onstate_study inside the SAME absolute deadline/reservation. Failure/interruption/deadline requires preserved durable artifacts, owned PAUSED and ledger closure; no automatic full training, partial resume, failed preflight retry or silent cap renewal."}}

{"run":52,"commit":"90396d9","metric":0.0,"metrics":{"validated_remote_preflight_checks":8,"remote_smoke_bc_calls":16,"remote_smoke_sample_presentations":1024,"remote_smoke_controlled_ticks":512,"remote_smoke_reset_ticks":960,"remote_smoke_holds":0,"remote_smoke_summits":0,"remote_smoke_deaths":0,"worst_measured_reference_seconds_per_tick":0.009567270968744879,"linear_108rollout_physics_projection_seconds_not_guarantee":1859.8774763240044,"local_admission_guard_tests_passed":22,"same_maximum_reserved_usd":0.06,"closed_plus_reserved_estimated_usd":0.4779241866528988,"validated_completed_full_study_runs":0},"status":"keep","description":"Validate eight-check Linux preflight and PAUSED, then intentionally launch frozen six-run on-state comparison under original reservation/deadline; first study dispatch RUNNING with no completed learner outcome inferred","timestamp":1791138266166,"segment":0,"confidence":null,"asi":{"hypothesis":"Full matched actor-only learning can test whether actual successful learner-state labels improve first-ledge control over original demonstrations, after Linux preflight admits unchanged physics/data/settings","preflight_validation_and_full_study_launch_only":true,"primary_metric_carried_forward":true,"no_first_skill_summit_or_completed_learning_claim":true,"session":"onstate-20261004-v1","mode":"onstate_study","source_space_revision":"8044439043a1725dc5911577c85096cd04ddc4ae","passed_context_revision":"ed3a53c349d08380401bc2a27d466ea58c378210","preflight_artifact_revision":"53b2f8dec8f361f193a14a299d466caab711ed30","study_startup_artifact_revision":"392854a3fe7ed9214d79fdee38d3ecb8b9b390f7","evidence":"artifacts/onstate_preflight_review_20261004T181812585650Z/complete_review.json","study_startup_evidence":"artifacts/onstate_preflight_review_20261004T181812585650Z/study_startup_verification.json","all_eight_checks_and_source_game_data_rms_physical_contracts_independently_validated":true,"same_host_fast_reference_physics_and_contact_rich_timing_exact":true,"known_terrain_descriptor_disagreement_retained":[[-80,-30]],"placement_fidelity_tests_not_task_progress_or_training_data":true,"remote_smoke_initial_weights_untrained_traces_and_saved_reload_exact":true,"four_remote_smoke_poses":[[0,21],[0,21],[0,21],[0,21]],"effective_cpu8_ram32000000000_measured_no_xl_need":true,"projection_not_guarantee_and_more_than_double_plus300seconds_remained":true,"independent_paused_before_launch_epoch":1791137892.5876534,"passed_context_and_mode_published_while_paused_then_one_intentional_restart":true,"original_start_epoch":1791136940.4793909,"immutable_deadline_epoch":1791144140.4793909,"no_new_source_hardware_scientific_conditions_data_or_reservation_change":true,"actual_stage":"RUNNING","actual_phase":"onstate_dispatch","error":null,"no_durable_execution_claim_yet_in_startup_snapshot":true,"no_completed_training_or_physical_work_inferred_from_dispatch":true,"next_action_hint":"Keep active source/variables/deadline untouched. Inspect one later bounded pinned claim/BC progress and complete six-run manifest/training/evaluation/saved companion evidence using strict checker. Report actual held/retained/death/summit/control/reset/update/source-sample work, not supervised loss or peaks. At terminal/failure/deadline preserve artifacts, verify owned PAUSED and close ORIGINAL reservation. No silent continuation/renewal, skipped controls or final-goal promotion from standard aggregate."}}

{"run":53,"commit":"64c8154","metric":0.0,"metrics":{"validated_completed_onstate_runs":2,"seed9_original_central_holds":2,"seed9_augmented_central_holds":3,"seed9_original_secondary_holds":2,"seed9_augmented_secondary_holds":3,"seed9_original_median_retained_gain":4.369315731763912,"seed9_augmented_median_retained_gain":13,"seed9_final_central_region_endpoints_each_arm":2,"final_postclone_reference_cases":18,"final_full_completions":0,"final_deaths":0,"verified_bc_optimizer_calls":4000,"verified_bc_sample_presentations":1024000,"verified_reference_control_ticks":64800,"verified_reference_reset_ticks":8640,"qualifying_position_contact_windows_checked":5,"local_checker_goal_tests_passed":11,"closed_plus_reserved_estimated_usd":0.4779241866528988},"status":"keep","description":"Partial seed9 on-state comparison validates real ledge events: augmented3/9 versus original2/9, but extra event transient, both nominal failures and only two final ledge endpoints; remaining seeds active","timestamp":1791139260080,"segment":0,"confidence":null,"asi":{"hypothesis":"Added successful learner-state labels may change closed-loop retention under fresh perturbations, but complete multiple-seed controls and endpoints are needed before claiming improvement","partial_campaign_only":true,"primary_metric_carried_forward":true,"no_robust_first_skill_or_summit_promotion":true,"session":"onstate-20261004-v1","source_space_revision":"8044439043a1725dc5911577c85096cd04ddc4ae","dataset_revision":"0f0ae67493534e4bffc3d8a01ef11ace20f0111b","evidence":"artifacts/onstate_partial_review_20261004T183915603589Z/verification.json","source_data_settings_dependencies_work_and_legal_traces_valid":true,"durable_no_resume_claim_valid":true,"matched_seed9_initial_parameters_and_untrained_reference_traces_exact":true,"original_held_cases":["new_hammer_right","new_action_noise_3"],"augmented_held_cases":["new_hammer_right","new_action_noise_2","new_action_noise_5"],"augmented_noise5_event_latched_then_left_region":true,"augmented_noise5_final_pose":[536.5929687592253,60.89575428851996],"both_seed9_nominal_central_holds_false":true,"both_last90tick_final_region_windows_have90body_query_hits":true,"query_hits_not_forces_and_speed_not_independently_reconstructed_from_missing_info_velocities":true,"source_presentation_original_logged_totals":[896000,128000],"training_physics_and_ppo_calls_zero":true,"saved_companion_identities_metadata_only_not_loaded_or_portable_replay":true,"complete_three_seed_cohorts_zero_goal_projection_conservative_zero":true,"active_phase":"original_demonstrations_seed_10","actual_space_stage":"RUNNING","runtime_epoch_checked":1791139109.743019,"actual_utc_check":"2026-10-04T18:38:29.743019+00:00","seconds_before_immutable_deadline_at_check":5030.736371994019,"immutable_deadline_epoch":1791144140.4793909,"date_only_interface_notice_does_not_override_verified_utc_epoch":true,"same_single006usd_reservation_open_no_renewal_pause_or_remote_write":true,"next_action_hint":"Finish unchanged seed10/11 controls and validate all six source/data/work/saved companion/reference contracts before selecting another learning design. One extra one-seed transient held event is not robust improvement; nominal and worst-seed/full-climb gates remain fixed. Keep active source/variables/deadline untouched. Only terminal/failure/real epoch expiry permits owned PAUSED/artifact verification and reservation closure, never date-only premature stop or silent budget extension."}}

