{"run":54,"commit":"57b0a50","metric":0.0,"metrics":{"validated_completed_onstate_runs":5,"seed10_original_central_holds":3,"seed10_augmented_central_holds":1,"seed10_original_secondary_holds":4,"seed10_augmented_secondary_holds":1,"seed10_original_median_retained_gain":18.36765696618768,"seed10_augmented_median_retained_gain":4,"seed10_original_final_central_region_endpoints":3,"seed10_augmented_final_central_region_endpoints":0,"seed11_original_central_holds":2,"seed11_original_secondary_holds":3,"seed11_original_median_retained_gain":11.541176470588226,"final_postclone_reference_cases":45,"final_summits":0,"final_deaths":0,"verified_bc_optimizer_calls":10000,"verified_bc_sample_presentations":2560000,"verified_reference_control_ticks":162000,"verified_reference_reset_ticks":21600,"qualifying_position_contact_windows_checked":24,"final90tick_central_region_contact_windows":9,"local_checker_goal_tests_passed":11,"closed_plus_reserved_estimated_usd":0.4779241866528988},"status":"keep","description":"Five-run physical audit: added-data seed10 reverses seed9 gain and only holds transiently; complete original cohort fails all nominal/robust gates, final augmented seed11 remains active","timestamp":1791140346597,"segment":0,"confidence":null,"asi":{"hypothesis":"A selected successful learner trajectory may add useful states but must improve replicated closed-loop control rather than one noisy latched event","partial_campaign_only":true,"primary_metric_carried_forward":true,"no_robust_skill_data_recipe_winner_or_summit_promotion":true,"session":"onstate-20261004-v1","source_space_revision":"8044439043a1725dc5911577c85096cd04ddc4ae","dataset_revision":"d797a550c6ae7085fe604542690a59959b3eca13","evidence":"artifacts/onstate_later_review_20261004T185906597412Z/verification.json","all_source_data_settings_dependencies_work_and_legal_reference_contracts_valid":true,"original_complete_central_counts":[2,3,2],"original_complete_secondary_counts":[2,4,3],"original_worst_central_rate":0.2222222222222222,"original_worst_full_completion_rate":0.0,"augmented_partial_central_secondary_counts":[3,1],"all_five_nominal_central_holds_false":true,"seed10_augmented_only_noise2_hold_transient":true,"seed10_augmented_transient_final_pose":[520.5354698280188,26.521330648993285],"selected_data_addition_not_consistent_across_observed_seeds":true,"existing_nominal_and_per_seed_skill_gate_failures_cannot_be_rescued_by_last_seed":true,"last_seed_still_required_for_complete_comparison":true,"position_contact_windows_checked_not_independent_raw_speed_or_force_estimates":true,"saved_companions_metadata_only_no_binary_reload_or_portability_claim":true,"active_seed11_initial_parameters_match_completed_original_peer":true,"active_seed11_completed_work_not_inferred":true,"training_physics_and_ppo_calls_zero":true,"actual_space_stage":"RUNNING","actual_active_phase":"original_plus_logged_success_seed_11","runtime_epoch_checked":1791140346.597413,"seconds_remaining_at_check":3793.8819782733917,"immutable_deadline_epoch":1791144140.4793909,"same_open006usd_reservation_no_remote_write_pause_source_change_or_renewal":true,"next_action_hint":"Review one bounded pinned last-arm/terminal snapshot, validate all six complete physical/source/data/work/saved-companion contracts and goal projection, then verify durable artifacts and owned PAUSED before closing original reservation. Do not stop/change the last control, start new data/optimizer experiments mid-run, infer benefit from incomplete cohorts or blindly scale this inconsistent data addition."}}

{"run":55,"commit":"fde395f","metric":0.0,"metrics":{"validated_completed_onstate_runs":6,"final_reference_cases":54,"final_summits":0,"final_deaths":0,"original_worst_seed_central_rate":0.2222222222222222,"augmented_worst_seed_central_rate":0.0,"bc_optimizer_calls":12000,"bc_sample_presentations":3072000,"original_sample_presentations":2688000,"logged_sample_presentations":384000,"reference_control_ticks":194400,"reference_reset_ticks":25920,"qualifying_position_contact_windows_checked":24,"final90tick_central_region_contact_windows":9,"local_checker_goal_tests_passed":11,"closed_study_estimated_usd":0.0385,"all_closed_estimated_usd":0.4564241866528988},"status":"discard","description":"Complete matched data-addition comparison fails robust acquisition: selected-success augmentation worsens worst-seed ledge holds, no nominal holds or summits; all contracts pass and original reservation closed PAUSED","timestamp":1791141827427,"segment":0,"confidence":null,"asi":{"hypothesis":"Adding actual controls from a selected successful learner trajectory improves replicated ordinary-spawn first-ledge control over original demonstrations","rollback_reason":"No full-climb improvement or nominal held success. Original central counts2/3/2 versus augmented3/1/0, worst-held2/9 versus0/9; data recipe not promoted or scaled. Validated runtime/admission tooling and evidence retained, not reverted or called a policy improvement.","complete_campaign":true,"all_six_source_data_settings_dependencies_work_and_legal_reference_contracts_valid":true,"matched_initial_parameters_and_untrained_traces_exact":true,"remote_summary_and_goal_projection_exact":true,"no_first_skill_candidate_or_final_goal_promotion":true,"session":"onstate-20261004-v1","source_space_revision":"8044439043a1725dc5911577c85096cd04ddc4ae","terminal_dataset_revision":"d3fc0808ad5e434b839963529989c6bf4545f739","evidence":"artifacts/onstate_complete_review_20261004T191902458785Z/complete_review.json","original_central_counts":[2,3,2],"original_secondary_counts":[2,4,3],"augmented_central_secondary_counts":[3,1,0],"original_retained_medians":[4.369315731763912,18.36765696618768,11.541176470588226],"augmented_retained_medians":[13,4,10.500128615160765],"original_final_central_region_endpoints":[2,3,2],"augmented_final_central_region_endpoints":[2,0,0],"all_six_nominal_central_holds_false":true,"two_augmented_held_events_transient_not_final_support":true,"raw_velocity_speed_not_independently_reconstructed_query_hits_not_forces":true,"all12saved_companions_pinned_metadata_only_not_portable_policy_replay":true,"ppo_and_training_physics_calls_zero":true,"worker_completed_utc":"2026-10-04T19:01:44.266825+00:00","independent_paused_epoch":1791141541.9557095,"rechecked_paused_epoch":1791141827.4268486,"original_deadline_unchanged":1791144140.4793909,"all_seven_batches_closed_no_new_reservation_or_remote_write":true,"conservative77rounded_minutes_until_independent_pause_includes_paused_gaps":true,"estimates_not_provider_bills_or_remaining_credits":true,"not_general_proof_all_self_imitation_ineffective":true,"next_action_hint":"Prototype a state-responsive legal corrective teacher using observed pose/hammer/contact feedback and known real hammer-plant/trajectory priors, rather than blindly advancing a time index. Freeze bounded observation/control/resource contracts and demonstrate ordinary-spawn nominal/perturbed recovery plus reference/fast fidelity before admitting any actually applied pre-action/action corrective corpus or fresh matched learning experiment. No off-state time-index suffix labels, lucky-noise pooling, unchanged BC/PPO extension, kernel loop or paid scaling. Prototype and contract remain unimplemented; keep the researcher active."}}

{"run":56,"commit":"c815196","metric":0.0,"metrics":{"prototype_physical_rollouts":12,"prototype_controlled_ticks":7200,"prototype_reset_ticks":1440,"learning_updates":0,"timeindexed_reference_central_holds":2,"timeindexed_reference_secondary_holds":3,"state_matched_reference_central_holds":1,"state_matched_reference_secondary_holds":1,"prototype_summits":0,"prototype_deaths":0,"nominal_offline_recorded_inputs_actions_exact_rows":600,"python_tests_passed":295,"all_closed_estimated_usd":0.4564241866528988},"status":"discard","description":"State-matched trajectory-phase prototype reproduces nominal ledge exactly but stalls under warm-up and fresh noise; simpler time-indexed prior performs better, no corrective data or learner training admitted","timestamp":1791143260685,"segment":0,"confidence":null,"asi":{"hypothesis":"A local state-matched phase can adapt a legal successful trajectory to perturbed observable states without blindly advancing elapsed-time controls","rollback_reason":"13feature nearest-phase matcher cycles/stalls after leftwarmup and noise11105, ending near the floor, while nominal baseline/control succeeds. Reject controller as corrective teacher; retain tested prototype and failed diagnostic evidence, never admit its labels as expertise.","controller_version":"state-matched-trajectory-phase-v1","evidence":"artifacts/phase_controller_probe_20261004T194209476868Z/verification.json","frozen_prior_rms_metric_window_actions_and_cases_declared_before_rollouts":true,"legal_raw217feature_inputs_and_applied_float32_controls_only":true,"eight_back_twelve_ahead_local_state_phase_no_unconditional_time_advance":true,"exact_nominal_reference_fast_timeindexed_gate_passed_before_adaptive_or_interventions":true,"all_same_host_backend_phase_action_observation_reward_info_and_physical_fields_exact":true,"nominal_state_matched_final_pose":[322.58588646662605,104],"left_state_matched_final_pose":[-3.3617136447789706,21.9957142332037],"noise_state_matched_final_pose":[35.639939209041685,19],"state_matched_final_phases":[599,28,106],"left_last120_phase_range":[27,29],"noise_last120_phase_range":[106,115],"timeindexed_noise_secondary_only_not_narrow_central":true,"timeindexed_noise_final_pose":[335.29196929479474,103],"central_detector_not_relaxed":true,"backends_fidelity_copies_not_independent_recovery_successes":true,"not_learned_policy_robustness_corrective_oracle_or_summit":true,"failed_preaction_rows_diagnostic_only_no_training_corpus_admission":true,"externally_touched_cost_file_contents_match_committed_ledger_preserved_bytes":true,"all_seven_reservations_closed_no_new_paid_or_remote_write":true,"independent_paused_epoch":1791143260.6853201,"space_source_revision":"8044439043a1725dc5911577c85096cd04ddc4ae","next_action_hint":"One controlled prototype change: add existing pointer/control-memory features to phase distance while keeping prior/frozen RMS/local8back12ahead window/actions/weights/cases fixed. Similar poses may hide unfinished strokes, but cause/fix unproven. Freeze a fresh bounded declaration before execution; no rerun of the old plan, parameter sweep, off-state teacher suffix or data admission until physical recovery/fidelity succeeds. No learner updates or paid scaling."}}

{"run":57,"commit":"871c7ac","metric":0.0,"metrics":{"prototype_physical_rollouts":14,"prototype_controlled_ticks":8400,"prototype_reset_ticks":1680,"learning_updates":0,"kinematic_reference_central_holds":1,"history_reference_central_holds":1,"history_perturbed_central_holds":0,"history_perturbed_secondary_holds":0,"history_left_retained_gain":58.01141628184246,"history_noise_retained_gain":-2,"prototype_summits":0,"prototype_deaths":0,"both_variants_nominal_recorded_action_parity_rows":600,"python_tests_passed":299,"all_closed_estimated_usd":0.4564241866528988},"status":"discard","description":"Pointer/control-history phase matching improves selected warm-up partial climb but still stalls below ledge and fails noisy recovery; reject teacher/data admission","timestamp":1791144426672,"segment":0,"confidence":null,"asi":{"hypothesis":"Adding eight existing pointer/control-history inputs disambiguates unfinished strokes and fixes off-state phase matching while every other prior/RMS/window/action/weight/case setting remains fixed","rollback_reason":"Nominal exact hold preserved, but neither perturbed reference case passes central or secondary hold. Warm-up remains at phase280/Y79.011, noise at phase135/Y19; no reliable recovery. Scientific recipe rejected, opt-in diagnostic tooling retained with default13feature behavior unchanged.","controller_version":"state-matched-control-history-v2","evidence":"artifacts/phase_history_probe_20261004T200234917165Z/verification.json","single_axis_features_added":["pointer_x","pointer_y","last_tx","last_ty","control_memory_x","control_memory_y","last_hammer_distance","last_effort"],"prior_original_rms_windows_weights_actions_cases_and_gates_unchanged":true,"frozen_300second_work_plan_and_owned_parent_script_source_binding":true,"both_variants_all600_actual_recorded_preinput_action_pairs_exact":true,"nominal_timeindexed_reference_fast_central_gate_passed_before_adaptive_interventions":true,"all_seven_full_backend_trace_pairs_exact":true,"all_six_pinned_historical_kinematic_full_traces_exact":true,"all14_full_raw_position_velocity_contact_milestone_traces_exact":true,"history_nominal_final_pose":[322.58588646662605,104],"history_left_final_pose":[280.2485746443694,79.01141628184246],"history_noise_final_pose":[33.93610640057776,19],"history_final_phases":[599,280,135],"history_left_last120_phase_range":[280,280],"history_noise_last120_phase_range":[135,135],"history_left_last90_body_query_contact_fraction":1.0,"history_left_last90_max_speed_per_tick":0.0,"selected_partial_height_improvement_not_robust_recovery_or_learned_policy":true,"not_corrective_teacher_or_new_training_corpus":true,"zero_learning_updates_no_paid_reservation_or_remote_writes":true,"ledger_bytes_unchanged_seven_closed_estimates":true,"independent_paused_epoch":1791144426.67216,"space_source_revision":"8044439043a1725dc5911577c85096cd04ddc4ae","actual_session":"onstate-20261004-v1","actual_mode":"onstate_study","closed_historical_deadline_unchanged":1791144140.4793909,"next_action_hint":"Stop nearest-feature/window tuning. Inspect original pointer-to-hammer servo and stalled strokes, derive legal stroke-progress feedback with observable completion gates and bounded state-error action correction, then freeze rules/actions/work/cases before original-physics comparison with timed playback. Require actual perturbation recovery and reference-fast parity before labels/new learning contract. No forced arbitrary phase jumps, unrelated-state teacher suffix, unchanged BC/PPO scaling or paid resume."}}
{"run":58,"commit":"86b626d","metric":0.0,"metrics":{"prototype_physical_rollouts":12,"prototype_controlled_ticks":7200,"prototype_reset_ticks":1440,"learning_updates":0,"timed_reference_central_holds":2,"timed_reference_secondary_holds":3,"stroke_reference_central_holds":1,"stroke_reference_secondary_holds":1,"stroke_perturbed_central_holds":0,"stroke_left_retained_gain":-0.22994883632210517,"stroke_noise_retained_gain":8,"stroke_left_post_warmup_corrected_ticks":564,"stroke_noise_corrected_ticks":572,"prototype_summits":0,"prototype_deaths":0,"nominal_offline_action_and_phase_parity_rows":600,"python_tests_passed":307,"all_closed_estimated_usd":0.4564241866528988},"status":"discard","description":"Ordered observable stroke completion plus bounded world-target pointer correction preserves exact nominal hold but stalls under warm-up and noise; timed playback wins, no teacher/data admission","timestamp":1791145725507,"segment":0,"confidence":null,"asi":{"hypothesis":"Ordered body/hammer world-position completion gates and bounded body-error pointer correction can finish perturbed strokes without nearest-state phase selection or blindly advancing time","rollback_reason":"Both perturbed reference cases fail central and secondary holds, ending near the floor at phase58 and phase173. Correction is exercised but does not provide recovery. Reject scientific teacher recipe; retain tested diagnostic tooling and failed evidence. Progress gating and correction changed together, so no single-factor causal attribution.","controller_version":"observable-stroke-world-feedback-v1","evidence":"artifacts/stroke_feedback_probe_20261004T202114143143Z/verification.json","servo_audit":"artifacts/stroke_feedback_probe_20261004T202114143143Z/servo_audit.json","original_motor_gain_slew_motor_caps_and_contact_solver_unchanged":true,"source_prior_and_raw217preinputs_bound_no_privileged_reset":true,"ordered_one_row_max_forward_observable_completion_no_nearest_search_backtracking_or_unconditional_clock":true,"world_body_error_pointer_gain":1.0,"correction_norm_cap_pixels":16,"legal_pointer_axis_limit_pixels":128,"moving_stroke_perpendicular_tube_pixels":26,"stationary_position_tolerance_pixels":1,"stationary_speed_limit_per_tick":2,"all600actual_offline_nominal_actions_phases_exact":true,"nominal_actual600tick_control_and_physics_trace_exact":true,"nominal_feedback_correction_zero":true,"all_six_full_same_host_backend_trace_pairs_exact":true,"all_six_pinned_historical_timed_baselines_exact":true,"all12_full_raw_milestone_and_causal_applied_control_traces_verified":true,"stroke_left_final_pose":[59.44763574511387,20.770051163677895],"stroke_noise_final_pose":[169.4784909380732,29],"stroke_final_phases":[599,58,173],"stroke_left_last120_phase_range":[58,58],"stroke_noise_last120_phase_range":[173,173],"stroke_left_final_segment_progress":-15.675298010482754,"stroke_noise_final_segment_progress":0.9396368475191701,"stroke_noise_final_perpendicular_distance_pixels":27.392892157057076,"unchanged_central_detector_not_relaxed_for_timed_noise_X335_292":true,"not_validated_teacher_new_training_corpus_learned_policy_or_summit":true,"bounded300second_owned_work_plan_passed_no_retry_or_parameter_sweep":true,"zero_learning_no_paid_reservation_or_remote_write":true,"ledger_bytes_unchanged_seven_closed_estimates":true,"independent_paused_epoch":1791145725.5072744,"space_source_revision":"8044439043a1725dc5911577c85096cd04ddc4ae","actual_session":"onstate-20261004-v1","actual_mode":"onstate_study","closed_historical_deadline_unchanged":1791144140.4793909,"next_action_hint":"One ablation only: retain exact prior/gain1 body-error correction/norm16/axis128 bounds, replace ordered completion gating with explicit physical playback clock and compare pure timed recording on same development cases. Declare timed feedback honestly, not observed-state phase acquisition. Freeze fresh source/rules/cases/deadline before physics; require actual recovery and fidelity before broader teacher validation or labels/new learning. No tube/gain/cap sweep, arbitrary phase jump, off-state teacher suffix or learner scaling."}}
