{"run":77,"commit":"86a371f","metric":0.0,"metrics":{"cursor_feedback_smoke_rollouts":6,"controlled_ticks":2508,"reset_ticks":720,"learning_updates":0,"candidate_goal_steps":26,"candidate_raw_goal_error":0.8704798399048606,"candidate_physical_goal_error":0.87048193528491,"default_goal_steps":30,"default_physical_goal_error":3.304582347741488,"local_completion_gate_passed":1,"candidate_retained_gain":11,"default_retained_gain":11,"candidate_ledge_holds":0,"summits":0,"deaths":0,"phase_tests_passed":14,"focused_python_tests_passed":55,"full_python_tests_passed":344,"owned_elapsed_seconds":30.22231650352478,"all_closed_estimated_usd":0.4564241866528988},"status":"discard","description":"Opt-in OWN-issued-command cursor feedback completes fixedhammergoal within unchanged1pixel/30step bounds, default preserved; bodylow/noholds, causalphase design only/no labels or learnedgoal promotion","timestamp":1791168305476,"segment":0,"confidence":null,"asi":{"hypothesis":"Strictly past observed actual cursor and OWN-issued-command memory can finish the same hammer-world goal while preserving all default behavior under the identical fixed local noise contract","rollback_reason":"Localtargetcompletion passes26steps/error.870482, but body staysY32/gain11/noholds and primaryfullcompletion unchanged. One knownstate smoke is not causalwholecontroller/bodyrecovery/robustteacher/model or learning. Retain tested optinmode and exactdefault compatibility for separately admitted causalphase design only.","phase_version":"observed-cursor-feedback-hammer-target-v1","evidence":"artifacts/cursor_feedback_smoke_20261005_v1/verification.json","source":"research/hammer_target.py","default_old_contract_all30saved_actions_and_observe_summaries_exact_before_physics":true,"bootstrap_once_previousactuallyissuedowncommand_and_actualrawpost_nextpreexact":true,"each_post_estimate_rawpointer13_14times128_minus_OWNissuedcommandtimes128_notdesired":true,"bootstrap_returnedcommands_rawinputs_copied_and_validated_no_missing_duplicate_wrongshape_history":true,"strictpending_action_actualpostobserve_prepostlink_no_rearm_caprenewal":true,"same_fixedgoal_offset_noise_tolerance1_cap30_legalaxesreach_nofilters_gain_or_seedoracle":true,"illegal_cursorcompensation_fails_not_clipped_or_restarted":true,"basephase298_calls299_frozen_throughgoalstage_no_laterplayback":true,"candidate_raw_and_physicalerror_below1_actualmotion_alive_declaredcompletiongate_passed":true,"candidate_controlled_ticks":325,"default_controlled_ticks":329,"candidate_final_pose":[268.8449971064618,32],"default_final_pose":[268.88279102749425,32],"body_not_referencealigned_not_ledgeacquisition":true,"all6full_rawmilestone_controls_caseclock_actionobserve_commandmemory_histories_verified":true,"all3full_samehost_backend_pairs_exact":true,"all4nominal_default_fullhistoricaltraces_unchanged":true,"bothcandidate_first300physicalhistories_exact_currentcursorcontrast":true,"equal299prefix_actualpreinputs_and_history":true,"variableearlystop_equalmax329_not_equalterminaltimes":true,"default30timeout_closedpulse751_fresh8of9_andallfailedgates_immutable":true,"only_causalphase_DESIGN_admitted_no_teacher_corpus_labels_bodyrecovery_or_learning":true,"344fulltests_expected_faultinjection_flushwarnings_not_livefailure":true,"source_newmode_prior_cursoradmission_plan_scripts_parent_budget_deadline_secretstripped_child_durabletrace_cleanup_bindings_passed":true,"no_updates_paidreservation_remote_write_deployment_publicrelease_or_substantive_localtraining":true,"ledgerbytes_unchanged_sevenclosed_estimates":true,"independent_paused_epoch":1791168305.4767606,"space_source_revision":"8044439043a1725dc5911577c85096cd04ddc4ae","actual_session":"onstate-20261004-v1","actual_mode":"onstate_study","actual_context":"ed3a53c349d08380401bc2a27d466ea58c378210","closed_historical_deadline_unchanged":1791144140.4793909,"next_action_hint":"Implement causalone-attempt sourceclockwrapper/raw217_owncommandhistory_privatephase: onecheckpoint after299observedtransitions/beforedecision300, rawhammerquery1_lasttravel<3_hammerworldY<fixedrow300goalY-1_legalreach26..102_axes128; no case_seed_traceoracle. Ineligiblepermanentbypassexactoriginal. Eligiblefixedgoal/optinphase/tolerance1/max30/bootstraplastactualcommand; firstactualgoalstep consumeONEordinarybaseproposal/source299(overridden_ignored),thenfreeze_basecalls300_source299throughstage; resumeorderedbase300onlyafteractualcompletion, no arbitraryphasejump/rearm/terminalmacro, failureterminal. Globalaction_postobserve_prepostlink/max751; baseproposal/sourceclockmetadata differenceexplicit_notlabels, existingactualgoal325historyexact. Tests/parity thenfreezeactualsource_rule_plan_deadline nominal/failed13105 originalphysics ref-fast smoke4rollouts/max3004control+480reset/180work210owned. Nominal751bypassexact/prefix299_goalphysicalexact/rawbackendfidelity; require originalcentralheld+final90central_speed2_bodyfraction.8_alive beforebroaderwrappervalidation. Secondarynot substitute/localtipnotacquisition; no scans/closedretry/9gate rewrite/labels/learning. Latercomposition_freshwholevalidation_captureddata_clockmemorylearnercontract separate."}}
{"run":78,"commit":"98bcdd3","metric":0.0,"metrics":{"causal_source_goal_smoke_rollouts":4,"controlled_ticks":3004,"reset_ticks":480,"learning_updates":0,"candidate_goal_steps":26,"candidate_final_retained_gain":11,"candidate_central_holds":0,"candidate_secondary_holds":0,"candidate_final90central_support":0,"recovery_broader_gate_passed":0,"nominal_retained_gain":83,"first_resumed_controlled_tick":326,"first_resumed_source_phase":300,"handoff_body_reference_error":19.157607227825547,"handoff_hammer_reference_error":0.87048193528491,"summits":0,"deaths":0,"new_wrapper_tests_passed":7,"focused_python_tests_passed":62,"full_python_tests_passed":351,"owned_elapsed_seconds":32.70372176170349,"all_closed_estimated_usd":0.4564241866528988},"status":"discard","description":"Causal source-clock/observed-goal wrapper preserves nominal and exact goal physics/handoff but still fails body acquisition/gain11; tipaligned/bodypose19pixels off, no broader/teacher/learning admission","timestamp":1791169432987,"segment":0,"confidence":null,"asi":{"hypothesis":"A one-attempt raw lower-planted-hammer checkpoint, observedgoal completion and frozen orderedsourceclock can restore the failed acquisition while preserving nominal sourcecontrols","rollback_reason":"Knownfailedcase completes tipgoal and resumes correctly butfinalbodyY32/gain11/no centralORsecondaryhold/finalsupport. Strictrecovery/broadergate false. Tipalignment does notalign pot/referencecontactpose. Retain tested diagnosticwrapper/evidence only, no teachers/labels/learning or forcedphase/gain fix.","controller_version":"causal-source-clock-one-hammer-goal-v1","source":"research/source_goal_controller.py","evidence":"artifacts/source_goal_smoke_20261005_v1/verification.json","joint_evidence":"artifacts/source_goal_smoke_20261005_v1/joint_review.json","single_checkpoint_after299actualobservations_beforedecision300_rawlowerplantedquery_travel_legalgeometry_only":true,"no_case_seed_trace_oracle_privileged_reset_or_recordedprefix_override":true,"firstactualgoalstep_consumesONEsource299proposal_explicitlyoverridden_ignored_notlabel":true,"basecalls300_source299freeze_during26goalsteps_thenorderedsource300_resume":true,"controlledclock_not_blindly_sourceclock_no_arbitrary_phasejump_or_rearm":true,"nominal751_permanentbypass_fullraw_controls_physics_basemetadata_exactoriginal":true,"nominal_final_pose":[322.58588646662605,104],"candidate_stage_counts":[299,26,426],"candidate_final_pose":[268.87970682330393,32],"all299prefix_goal325physicalstates_controls_rewards_infos_exact_priorfeedbacksmoke":true,"sourceclock_basemetadata_difference_intentional_notphysics_drift_orlabels":true,"all4full_rawmilestone_control_caseclock_actionobserve_sourceclock_histories_verified":true,"all2full_samehost_backend_pairs_exact":true,"candidate_bothheld_events_and_final90supports_false":true,"candidate_targetphase_success_unchanged1pixel30cap_doesnotimply_bodyalignment":true,"first_resumed_source_body_reference":[279.3813105672598,48.00000041723251],"first_resumed_actual_body":[268.8449971064618,32],"first_resumed_actual_hammer":[186.822920907366,2.950780112123862],"first_resumed_bodyquerytrue_hammerqueryfalse":true,"first_resumed_pointer_correction":[8.79969090247997,13.362838022696048],"joint_mismatch_descriptive_not_fullcausalerror_force_or_largergain_phasejump_solution":true,"supplemental_joint_savedreview_zero_newphysics":true,"351fulltests_expected_faultinjection_flushwarnings_not_livefailure":true,"global751_action_postobserve_prepostlink_reset_legalrawquery_travel_timeoutguards_tested":true,"source_newwrapper_prior_localadmission_plan_scripts_parent_budget_deadline_ownedsecretstripped_child_durabletrace_cleanup_bound":true,"allclosed_goal30_pulse751_fresh8of9_andhistoricalgates_immutable":true,"no_teacher_corpus_labels_updates_paidreservation_remote_write_deployment_publicrelease_or_substantive_localtraining":true,"ledgerbytes_unchanged_sevenclosed_estimates":true,"independent_paused_epoch":1791169432.987507,"space_source_revision":"8044439043a1725dc5911577c85096cd04ddc4ae","actual_session":"onstate-20261004-v1","actual_mode":"onstate_study","actual_context":"ed3a53c349d08380401bc2a27d466ea58c378210","closed_historical_deadline_unchanged":1791144140.4793909,"next_action_hint":"Freeze180secondOFFLINE joint-bodyactuation/terrainaudit ofthis4saved751traces/3004rows,0newplay_reset_updates, bindsource_project_traces_completedreview_script_plan_budget. Compare requiredsourcebody_hammer_contactpose atfirsthandoff withactuallowterrainbody/freetip, originalblockedminus0point5bodyresponse/actualhammerauthority/collider_approxterrain/earliercontactstroke before deriving distinctlegalplant_bodyalignment primitive. Equalprefix vsunequalstates explicit/querynotforces_solverbranch/alpha notrenderer authority. No bodygain_target_phase_cap_tolerance scans/wrapperretry_terminalmacroaddition_forcedsourcejump_closedplanretry_metricrelaxation/labels_paidlearning. Newpoint/plant law needsseparatefreshlocal authority thenrecovery_wholefreshvalidation_data-clockmemory gates."}}
{"run":79,"commit":"29ed8b1","metric":0.0,"metrics":{"offline_joint_audit_saved_traces":4,"offline_joint_audit_rows":3004,"new_controlled_ticks":0,"new_reset_ticks":0,"learning_updates":0,"handoff_body_reference_error":19.15760722782555,"handoff_hammer_reference_error":0.87048193528491,"goal_hammer_post_queries":0,"goal_body_post_queries":25,"goal_body_delta_x":-2.1448162562509197,"goal_body_delta_y":-6.3218213427204475,"failed_tail_body_queries":120,"failed_tail_hammer_queries":0,"failed_tail_norm16_corrections":120,"selected_nominal_controlled_tick":367,"selected_recorded_anchor_x":291.9135969909686,"selected_recorded_anchor_y":69.79522708229332,"selected_point_reach":44.279108966120646,"selected_approx_footprint_hits":0,"legal_point_test_design_admitted":1,"physical_plant_observed_at_failed_state":0,"body_authority_or_recovery_admitted":0,"teacher_data_admission":0,"new_summits":0,"new_deaths":0,"focused_python_tests_passed":62,"full_python_tests_passed":351,"js_collision_tests_passed":1,"offline_audit_and_review_elapsed_seconds":122.02931809425354,"terrain_queries_including_independent_review":26247,"all_closed_estimated_usd":0.4564241866528988},"status":"discard","description":"Offline joint-body authority audit preserves failed recovery, verifies one legal recorded-point approach hypothesis but zero approximate overlap and no new plant/body authority; point-test design only","timestamp":1791170879662,"segment":0,"confidence":null,"asi":{"hypothesis":"Saved joint-pose/contact history and original collider/blocked-body mechanics can justify one distinct legal plant/alignment hypothesis after successful tip alignment failed acquisition","rollback_reason":"Offline audit adds no full-climb or recovery improvement. Free tip cannot certify body authority; selected recordedquery point has zero alpha footprint. Retain evidence only, no plant/teacher/corpus/learning admission or metric relaxation.","evidence":"artifacts/joint_authority_audit_20261005_v1/verification.json","audit":"artifacts/joint_authority_audit_20261005_v1/audit.json","original180second_deadline_not_extended":true,"original_index_assertion_error_and_separate_hashbound_schema_correction_preserved":true,"raw_index20_last_effort_index22_hammerquery_index21_bodyquery":true,"norm_inspection_float_reduction_error_corrected_1e_minus12_not_physical_tolerance_change":true,"correction_script_syntax_error_preserved_and_test_namespace_isolated_before_fullpass":true,"all4_raw_query_chronology_position_arithmetic_and_all2_backend_pairs_exact":true,"nominal_failed_common_applied_prefix":0,"later_nominal_failed_and_goal_body_separation_descriptive_not_causal_comparison":true,"goal_body_delta":[-2.1448162562509197,-6.3218213427204475],"joint_handoff":{"controlled_tick":326,"source_phase":300,"source_body":[279.3813105672598,48.00000041723251],"source_hammer":[186.93234430253506,3.8143571615219116],"actual_body":[268.8449971064618,32.0],"actual_hammer":[186.822920907366,2.950780112123862],"body_error_vector":[10.536313460797999,16.000000417232513],"body_error_norm":19.15760722782555,"hammer_error_norm":0.87048193528491,"body_query":true,"hammer_query":false,"hammer_travel":0.6386523610163909,"reference_hammer_query":false,"reference_body_query":true,"source_query_bits_not_actual_solver_branch":true},"original_gravity_before_motor_conditional_minus0point5_body_times0point4_motor_sign_verified":true,"query_not_force_normal_or_solver_branch_alpha_not_renderer_overlap":true,"one_predeclared_first_nominal_bodyYge100_hammerquery_selector_no_fallback_scan":true,"selected_nominal_body":[283.22828016404134,103.44768449800283],"selected_point":[291.9135969909686,69.79522708229332],"selected_query_not_a_held_region_or_teacher_label":true,"equilibrium_pointer":[23.068599884506796,17.795227082293323],"equilibrium_action":[0.18022343516349792,0.13902521133422852],"one_offline_blocked_only_norm16_pointer_delta":[-8.799690554669676,-13.362838251735944],"conditional_body_request_delta_not_applied_or_measured":[1.7599381109339352,2.672567650347189],"zero_approximate_footprint_not_certified_plant_at_either_recorded_or_failed_pose":true,"all_failed30target751pulse_and_sourcewrapper_fresh8of9_gates_immutable":true,"no_new_gameplay_reset_updates_paidreservation_remote_write_deployment_publicrelease_or_localtraining":true,"ledger_bytes_unchanged_seven_closed":true,"independent_paused_epoch":1791170879.6622336,"space_source_revision":"8044439043a1725dc5911577c85096cd04ddc4ae","actual_session":"onstate-20261004-v1","actual_mode":"onstate_study","actual_context":"ed3a53c349d08380401bc2a27d466ea58c378210","closed_historical_deadline_unchanged":1791144140.4793909,"next_action_hint":"Freshfreeze point/contact probe ONLY, nominal600 referencefast baseline then ordinaryfailed SourceGoalController325 prefix exact. ONEselectedpoint unchangedcursorfeedback/raw217/OWN bootstrap/tolerance1/max30/earlystop, sourcefrozen/no resume/rearm/push/jump/extra contact ticks.4rollouts/max1910control480reset/180work210ownedseconds. Require rawANDphysical completion1 ANDactualhammerquerytrue/travel<3/alive/rawbackendsourceparity atcompletion before separate equalhistory onepush bodyauthority contrast. Freecompletion/timeout fails without nudge/newpoint/capextension/gatechange. No recovery/data/learning admission."}}
{"run":80,"commit":"c83d3e1","metric":0.0,"metrics":{"point_contact_probe_rollouts":4,"controlled_ticks":1910,"reset_ticks":480,"learning_updates":0,"candidate_prefix_ticks":325,"candidate_point_steps":30,"candidate_raw_point_error":2.071693210345316,"candidate_physical_point_error":2.0717021841510035,"candidate_point_hammer_queries":21,"candidate_point_body_queries":30,"candidate_final_hammer_query":0,"candidate_final_hammer_travel":1.9668215911572697,"candidate_point_body_delta_x":-0.3387348217490853,"candidate_point_body_delta_y":0,"candidate_retained_gain":11,"candidate_central_holds":0,"candidate_secondary_holds":0,"point_contact_gate_passed":0,"body_authority_design_admitted":0,"nominal_retained_gain":83,"summits":0,"deaths":0,"full_python_tests_passed":351,"js_collision_tests_passed":1,"owned_elapsed_seconds":26.714771032333374,"all_closed_estimated_usd":0.4564241866528988},"status":"discard","description":"Single recorded-point cursor-feedback approach times out30/error2.071702 despite21hammerqueries, finalqueryfalse/bodygain11/noholds; nominal/source/backend parity exact, no bodyauthority or learning","timestamp":1791171767910,"segment":0,"confidence":null,"asi":{"hypothesis":"One stationary nominal-query point is reachable after the failed ordinary325 prefix and may complete with observed query/low travel, warranting only a later separate equal-history body-authority contrast.","rollback_reason":"Point rawANDphysical1pixel completion fails at30; finalqueryfalse despite21earlierqueries. No netlift/bodygain11/noholds. Strictpointcontact and separatebodyauthoritydesign gates false; preserve failure without push, retarget, nudge, cap/tolerance relaxation or labels.","evidence":"artifacts/point_contact_probe_20261005_v1/verification.json","one_point_goal":[291.9135969909686,69.79522708229332],"candidate_final_pose":[268.5062622847127,32],"candidate_final_hammer":[289.8604513885791,69.51856289016712],"candidate_body_delta":[-0.3387348217490853,0],"nominal_final_pose":[322.58588646662605,104],"ordinary325prefix_299base26goal_exact_no_savedactionoverride_or_placement":true,"sourcegoal_executed325_basecalls300_source299_frozen_no_source300_resume":true,"raw217_ownissuedcommand_bootstrap_postestimate_no_future_noise_seed_or_trace_oracle":true,"all4_rawmilestone_control_caseclock_actionobserve_memory_sourceclock_histories_verified":true,"all2_full_backend_pairs_and_nominal600_failed325_source_histories_exact":true,"nominal_bothheld_events_final90central_support_gain83":true,"point30_timeout_not_infrastructure_error_queryhits_not_posthoc_gatepass":true,"query_not_force_normal_solver_branch_or_bodyauthority":true,"no_push_rearm_extra_contactseeking_ticks_goal_gain_noise_tolerance_cap_scan":true,"all_closed_target30_pulse751_sourcewrapper_fresh8of9_gates_immutable":true,"351fulltests_flush_messages_expected_faultinjection_no_runtime_failure":true,"offline_saved325prefix_bootstrap_firstlegalpointcommand_preflight_no_newphysics":true,"source_controller_admission_offlinepreflight_plan_scripts_parent_budget_deadline_ownedsecretstripped_child_durabletrace_cleanup_bound":true,"no_teacher_corpus_labels_training_paidreservation_remote_write_deployment_publicrelease_or_substantive_localtraining":true,"ledger_bytes_unchanged_seven_closed":true,"independent_paused_epoch":1791171767.910565,"space_source_revision":"8044439043a1725dc5911577c85096cd04ddc4ae","actual_session":"onstate-20261004-v1","actual_mode":"onstate_study","actual_context":"ed3a53c349d08380401bc2a27d466ea58c378210","closed_historical_deadline_unchanged":1791144140.4793909,"next_action_hint":"Freeze180secondOFFLINE contacttransition/servo audit of4savedtraces1910rows/0newplay resetupdates, bindsource_project_traces_completedreview_scripts_plan_budget. Firstpointpostquery/firstlaterqueryfree transition/lastpointstep snapshots: prepost tiptravel_bodyresponse_motorrequest_OWNcursorresidual_goalerror andoriginal querycollisionordering/conditionalblockedbodytransfer/bodyfloorconstraints. Nominal367pose vslowbodypoint unequalstate descriptive, querynotforces/branch. Decidemechanicalsupport for DIFFERENT causalobservecontact_pressure design before anynewphysicalcontract. No posthocquerycompletion/point1pixel30gatechange/nudge retarget_extension_scans_probe_wrapperretry_sourcejump_push_labels_learning. Laterpredeclaredcontactphase/equalhistoryactualbodyauthority/recovery_wholefreshdata remainseparate; failedpointgateimmutable."}}
