{"run":59,"commit":"520b2e0","metric":0.0,"metrics":{"prototype_physical_rollouts":12,"prototype_controlled_ticks":7200,"prototype_reset_ticks":1440,"learning_updates":0,"timed_reference_central_holds":2,"timed_reference_secondary_holds":3,"clock_feedback_reference_central_holds":2,"clock_feedback_reference_secondary_holds":2,"clock_feedback_left_retained_gain":83,"clock_feedback_noise_retained_gain":61.02747588145793,"clock_feedback_left_corrected_ticks":579,"clock_feedback_noise_corrected_ticks":573,"prototype_summits":0,"prototype_deaths":0,"both_modes_nominal_offline_action_phase_parity_rows":600,"original_default_logged_action_metadata_parity_rows":3600,"python_tests_passed":311,"all_closed_estimated_usd":0.4564241866528988},"status":"discard","description":"Explicit playback clock restores selected warm-up hold but unchanged body-error correction destroys noisy playback support; no teacher/data or learner admission","timestamp":1791146514699,"segment":0,"confidence":null,"asi":{"hypothesis":"Replacing observable stroke-completion gating with explicit physical playback clock, keeping gain1 body-error pointer correction and caps fixed, prevents stalls and enables perturbation recovery","rollback_reason":"Warm-up central hold restored versus stroke-gated controller, but noisy feedback fails both detectors and retains61.027 instead of pure-playback82/secondary hold. All phases reach599, so this fixed correction remains insufficient without gate stalling. Reject teacher recipe; retain opt-in diagnostic mode and failed evidence. No general feedback impossibility or held-out learned skill claim.","controller_version":"explicit-clock-world-feedback-v1","evidence":"artifacts/timed_feedback_probe_20261004T203929123127Z/verification.json","only_phase_schedule_replaced_correction_prior_bounds_and_cases_unchanged":true,"clock_explicit_one_decision_per_physical_tick_not_observed_state_phase":true,"original_stroke_default_contract_and3600logged_actions_metadata_unchanged":true,"both_modes_actual600offline_nominal_actions_phases_exact":true,"nominal_actual600tick_actions_observations_rewards_physics_exact":true,"all_six_full_same_host_backend_pairs_exact":true,"all_six_pinned_historical_timed_baselines_exact":true,"all12_full_raw_milestone_causal_control_and_perturbation_clock_traces_verified":true,"gain":1.0,"correction_norm_cap_pixels":16,"pointer_axis_limit_pixels":128,"clock_feedback_left_final_pose":[319.94165189850395,104],"clock_feedback_noise_final_pose":[208.58540064665638,82.02747588145793],"clock_feedback_final_phases":[599,599,599],"clock_feedback_post_intervention_correction_exercised":true,"nominal_correction_zero":true,"baseline_noise_secondary_only_centralX335gate_not_relaxed":true,"reused_development_cases_not_fresh_heldout_trials":true,"no_teacher_training_corpus_or_saved_policy_promotion":true,"bounded300second_owned_frozen_source_script_plan_prior_work_passed":true,"zero_learning_no_paid_reservation_or_remote_write":true,"ledger_bytes_unchanged_seven_closed_estimates":true,"independent_paused_epoch":1791146514.6997206,"space_source_revision":"8044439043a1725dc5911577c85096cd04ddc4ae","actual_session":"onstate-20261004-v1","actual_mode":"onstate_study","closed_historical_deadline_unchanged":1791144140.4793909,"next_action_hint":"Audit first harmful corrective segment using captured noisy playback/feedback and original planted-hammer-to-body transfer before proposing contact-aware correction. Query contact is not force/complete response. Use existing traces first; no gain/cap/tube/nearest-metric sweep or same-plan retry. New mechanically justified feedback needs fresh frozen bounds/cases and actual recovery/fidelity before teacher validation, labels or paid learning. No unchanged BC/PPO scaling or unrelated-state teacher suffix."}}
{"run":60,"commit":"a83b55f","metric":0.0,"metrics":{"offline_examined_recorded_rows":7200,"new_gameplay_ticks":0,"new_reset_ticks":0,"learning_updates":0,"noise_common_applied_control_state_prefix_ticks":27,"noise_first_applied_control_difference_tick":28,"noise_first_body_separation_over1pixel_tick":30,"noise_first_hammer_query_hit_difference_tick":285,"noise_same_state_body_delta_x":0.09799999999999964,"noise_same_state_body_delta_y":0.11400000000000077,"noise_body_response_dot_intended_correction":-0.11292123190833106,"warmup_common_applied_control_state_prefix_ticks":13,"warmup_first_proposed_control_difference_tick":2,"warmup_first_applied_control_difference_tick":14,"all_closed_estimated_usd":0.4564241866528988},"status":"discard","description":"Offline captured-trace/contact-source audit finds first equal-prefix noisy correction moves body opposite intended direction with fixed hammer; local sign hypothesis only, no new recovery or learning","timestamp":1791147764199,"segment":0,"confidence":null,"asi":{"hypothesis":"The first exact-common-prefix noisy action contrast and original planted-hammer branch can mechanically explain a local correction-sign reversal without inferring later unequal-state causality","rollback_reason":"Primary completion metric unchanged; diagnostic not player/learned-policy improvement. Evidence supports one local body-response reversal, not general failure cause, force estimation, a correct contact-aware controller or teacher labels.","evidence":"artifacts/contact_response_audit_20261004T205819078549Z/verification.json","audit_evidence":"artifacts/contact_response_audit_20261004T205819078549Z/audit.json","source_response":"artifacts/contact_response_audit_20261004T205819078549Z/original_response.txt","immutable180second_offline_audit_completed_within_deadline":true,"later_bounded_verification_not_audit_retry_or_deadline_extension":true,"all12captured_trace_project_source_review_script_plan_and_budget_hashes_valid":true,"noise_first_equal_raw_preinput_action_contrast":true,"noise_first_correction_pixels":[-0.49000101807905594,-0.5693081766366959],"noise_first_actual_pointer_delta_pixels":[-0.48999999999999844,-0.5700000000000074],"noise_first_hammer_response_delta_pixels":[0.0,0.0],"noise_first_previous_hammer_query_hit":true,"noise_first_previous_hammer_travel_pixels":0.0,"original_blocked_body_request_multiplier":-0.5,"original_motor_pointer_gain":0.4,"first_local_response_consistent_with_negative0_2_pointer_to_body_gain":true,"warmup_first_equal_preinput_changes_hammer_not_body":true,"warmup_first_previous_hammer_query_hit":false,"warmup_first_previous_hammer_travel_pixels":37.20263671875,"ignored_forced_warmup_proposals_not_applied_corrections_or_labels":true,"later_trace_separations_have_unequal_preinputs_descriptive_only":true,"query_hits_not_forces_normals_guaranteed_plant_or_true_internal_solver_branch":true,"no_new_gameplay_controller_teacher_data_or_training_admission":true,"no_new_paid_reservation_or_remote_write":true,"ledger_bytes_unchanged_seven_closed_estimates":true,"independent_paused_epoch":1791147764.199187,"space_source_revision":"8044439043a1725dc5911577c85096cd04ddc4ae","actual_session":"onstate-20261004-v1","actual_mode":"onstate_study","closed_historical_deadline_unchanged":1791144140.4793909,"next_action_hint":"Keep explicitclock/prior/gain1/norm16/axis128; propose sign reversal only when causal raw pre-input has previous hammer queryhit AND last_hammer_distance*64<3, original wall-test threshold. Fallible proxy, not privileged true branch. Freeze ordinary-start legal recorded-prefix one-step reference/fast sign check with pinned baseline before testing. Only intended local body response/fidelity can admit separate fresh fixed-case recovery study; never direct teacher labels/learning from one point. No sign/threshold/gain sweep or unchanged BC/PPO scaling."}}
{"run":61,"commit":"175a714","metric":0.0,"metrics":{"local_diagnostic_rollouts":14,"controlled_ticks":1452,"reset_ticks":1680,"learning_updates":0,"new_controller_full_recovery_cases":0,"nominal_timeindexed_reference_central_holds":1,"local_sign_gate_passed":1,"noise_old_body_response_dot_error":-0.11292123190833106,"noise_new_body_response_dot_error":0.11280737027300612,"prototype_summits":0,"prototype_deaths":0,"all_modes_nominal_offline_action_phase_parity_rows":600,"old_modes_logged_action_metadata_parity_rows":7200,"python_tests_passed":315,"all_closed_estimated_usd":0.4564241866528988},"status":"discard","description":"Same legal-prefix contact-sign correction produces intended one-step body response on reference/fast; local gate passes, full recovery and teacher/learning remain untested","timestamp":1791149106381,"segment":0,"confidence":null,"asi":{"hypothesis":"Reverse fixed body-error pointer correction only for causal previous hammer-query hit and previous travel<3pixels to correct the mechanically observed planted-response sign","rollback_reason":"Primary completion unchanged, no full new-controller recovery cases or trained policy. Retain passed local diagnostic candidate only for a separately frozen full recovery comparison; no teacher/data/summit promotion.","controller_version":"explicit-clock-contact-sign-feedback-v1","evidence":"artifacts/contact_sign_probe_20261004T212005018592Z/verification.json","only_contact_proxy_correction_sign_changes_clock_prior_gain_and_caps_fixed":true,"previous_raw_hammer_query_flag_binary_and_travel_nonnegative_guards":true,"contact_proxy_previous_query_hit_equals1_and_travel_pixels_below3":true,"proxy_not_force_or_true_internal_solver_branch":true,"gain":1.0,"correction_norm_cap_pixels":16,"pointer_axis_limit_pixels":128,"all_three_modes600actual_nominal_actions_phases_exact":true,"all7200old_mode_saved_actions_metadata_unchanged":true,"nominal_timeindexed_original600tick_central_hold_gate_exact":true,"ordinary_spawn_legal_prefixes_no_privileged_state_placement":true,"prefix_candidate_proposals_explicitly_overridden_not_claimed_closed_loop_or_labels":true,"all_three_local_arms_equal_final_raw_preinput":true,"all_seven_full_same_host_backend_pairs_exact":true,"all_nominal_and_prefix_and_old_final_step_source_baselines_exact":true,"all14full_raw_milestone_proposed_applied_control_and_clock_traces_verified":true,"noise_local_tick":28,"noise_new_contact_proxy_active":true,"noise_old_body_response_delta":[0.09799999999999964,0.11400000000000077],"noise_new_body_response_delta":[-0.09799999999999986,-0.11380000000000479],"noise_new_hammer_response_delta":[0.0,0.0],"warmup_local_tick":14,"warmup_contact_proxy_inactive_old_new_action_and_response_exact":true,"declared_local_sign_gate_passed":true,"local_direction_improvement_not_closed_loop_recovery_or_teacher_validity":true,"bounded180second_owned_source_script_plan_prior_work_passed_no_sweep_or_retry":true,"zero_learning_teacher_data_admission_or_paid_reservation_or_remote_write":true,"ledger_bytes_unchanged_seven_closed_estimates":true,"independent_paused_epoch":1791149106.3813038,"space_source_revision":"8044439043a1725dc5911577c85096cd04ddc4ae","actual_session":"onstate-20261004-v1","actual_mode":"onstate_study","closed_historical_deadline_unchanged":1791144140.4793909,"next_action_hint":"Admit only fresh frozen full600tick comparison: pure playback, unchanged timed feedback, contact-sign timed feedback; same nominal/reset12001/leftwarmup/noise11105 development cases and reference/fast. Maximum18rollouts/10800control+2160reset,300work/330owned seconds. Keep proxy3/gain1/norm16/axis128/prior/clocks fixed, require nominal exact replay, preserved old baselines and actual perturbed holds/fidelity. Tiny-case pass only permits broader predeclared teacher validation, never automatic labels/learning or saved-policy/summit claims. No rule/gain/threshold/cap sweep or unchanged learner scaling."}}
{"run":62,"commit":"7f2b2ae","metric":0.0,"metrics":{"full_diagnostic_rollouts":18,"controlled_ticks":10800,"reset_ticks":2160,"learning_updates":0,"pure_reference_central_holds":2,"pure_reference_secondary_holds":3,"old_feedback_reference_central_holds":2,"old_feedback_reference_secondary_holds":2,"contact_feedback_reference_central_holds":3,"contact_feedback_reference_secondary_holds":3,"contact_feedback_final_supported_central_windows":3,"contact_feedback_min_retained_gain":83,"contact_feedback_warm_reversed_ticks":142,"contact_feedback_noise_reversed_ticks":139,"prototype_summits":0,"prototype_deaths":0,"focused_python_tests_passed":26,"owned_study_elapsed_seconds":73.84779453277588,"all_closed_estimated_usd":0.4564241866528988},"status":"discard","description":"Unchanged contact-sign timed controller achieves final supported central holds in all3development cases; admits broader fresh feedback validation only, not primary goal/teacher/learned-policy promotion","timestamp":1791150349827,"segment":0,"confidence":null,"asi":{"hypothesis":"Mechanically corrected contact-dependent pointer sign translates its matched-state local response improvement into full closed-loop ledge acquisition under the fixed development disturbances","rollback_reason":"Primary fullcompletion unchanged and controller is hand-designed/time-guided with only3reused cases, not a learned policy or robust corrective teacher. Status marks no primary-goal promotion; retain passed fixed-rule diagnostic candidate for broader fresh validation, no labels or paid learning.","controller_version":"explicit-clock-contact-sign-feedback-v1","evidence":"artifacts/contact_recovery_probe_20261004T213808503161Z/verification.json","unchanged_prior_clock_proxy_threshold3_gain1_norm16_axis128":true,"local_sign_admission_pinned_and_valid":true,"all_candidate_controls_actually_applied_after_fixed_warmup_no_prefix_overrides":true,"ordinary_spawn_no_privileged_reset_or_physics_change":true,"nominal_full_candidate_trace_exact_zero_correction":true,"all_nine_full_same_host_backend_pairs_exact":true,"all12pinned_old_playback_world_feedback_full_traces_exact":true,"all18full_raw_milestone_action_and_perturbation_clock_traces_verified":true,"all_three_reference_final90windows_inside_original_central_region":true,"all_three_final90body_query_contact_fractions":1.0,"final90max_speeds_per_tick":[0.0,0.0,0.4452377184228027],"contact_feedback_final_poses":[[322.58588646662605,104],[322.5858382122292,104],[330.22455101587525,104]],"noise_final90_y_range":[103.5547622815772,104],"post_intervention_corrected_ticks":[579,573],"post_intervention_nonzero_reversed_ticks":[142,139],"provisional_threecase_central_and_broader_validation_gates_passed":true,"original_central_and_secondary_detectors_unchanged":true,"supported_end_windows_not_only_latched_holds":true,"reused_development_cases_not_independent_heldout_seed_replication":true,"hand_designed_timeguided_controller_not_new_learned_policy":true,"zero_teacher_data_admission_learning_or_paid_reservation_or_remote_write":true,"bounded300second_owned_source_script_plan_prior_execution_passed_no_retuning_or_retry":true,"ledger_bytes_unchanged_seven_closed_estimates":true,"independent_paused_epoch":1791150349.8276567,"space_source_revision":"8044439043a1725dc5911577c85096cd04ddc4ae","actual_session":"onstate-20261004-v1","actual_mode":"onstate_study","closed_historical_deadline_unchanged":1791144140.4793909,"next_action_hint":"Admit only broader fresh fixed-rule validation vs pure playback: proposal reset13001,nominal,left/right(+/-.875,.125)*3warmups/4ticks,noise.02/seeds12100..12105,ninecases/600ticks/reference-fast,max36rollouts/21600control+4320reset,300work/330owned seconds. Verify freshness and freeze actual source/cases/deadline before gameplay. Require9/9reference central final support/no deaths/nominal parity/exact backend fidelity before considering corrective corpus. No collection/retuning during validation; passing still needs a separate captured-preaction/applied-control data and learner contract honestly handling explicit clock/memory, not assumed ordinary feed-forward cloning, unchanged learner scaling, final held-out or summit promotion."}}
{"run":63,"commit":"a73f531","metric":0.0,"metrics":{"fresh_validation_rollouts":36,"controlled_ticks":21600,"reset_ticks":4320,"learning_updates":0,"pure_reference_central_holds":5,"pure_reference_secondary_holds":6,"contact_reference_central_holds":8,"contact_reference_final_central_supports":8,"contact_reference_secondary_holds":9,"contact_min_retained_gain":83,"pure_min_retained_gain":63.69729464076468,"strict_ninecase_data_consideration_gate_passed":0,"summits":0,"deaths":0,"focused_python_tests_passed":26,"owned_elapsed_seconds":152.9936866760254,"all_closed_estimated_usd":0.4564241866528988},"status":"discard","description":"Fixed contact-sign controller improves fresh9case central support5/9to8/9 and secondary6/9to9/9; one stable edge landing fails frozen strict9/9gate, no teacher/data or learning admission","timestamp":1791151516085,"segment":0,"confidence":null,"asi":{"hypothesis":"The unchanged mechanically justified contact-sign timed feedback generalizes from3development cases to9fresh nominal/stronger warm-up/noise cases with final supported central ledge holds","rollback_reason":"Noise12100holds secondary ledge edge atX293.728/Y104but never centralX305..335. Frozen9/9central-final-support gate fails despite8central/9secondary and gain83allcases. No hindsight gate relaxation or teacher/data/learned-policy promotion; retain diagnostic evidence and tested rule only.","controller_version":"explicit-clock-contact-sign-feedback-v1","evidence":"artifacts/contact_validation_probe_20261004T215921117225Z/verification.json","edge_support_evidence":"artifacts/contact_validation_probe_20261004T215921117225Z/edge_support_review.json","fresh_reset_seed":13001,"fresh_noise_seeds":[12100,12101,12102,12103,12104,12105],"fresh_warmups":[[-0.875,0.125],[0.875,0.125]],"fresh_case_fields_verified_unused_before_frozen_declaration":true,"same_rule_clock_prior_gain1_norm16_axis128_proxy3_no_retuning":true,"all_full_candidate_actions_applied_after_forced_warmup_no_prefix_overrides":true,"ordinary_spawn_unchanged_physics_and_metrics":true,"all18full_same_host_backend_pairs_exact":true,"all_four_historical_nominal_full_traces_exact_new_reset":true,"all36full_raw_milestone_causal_control_and_caseclock_traces_verified":true,"nominal_candidate_trace_exact_zero_correction":true,"strict_all9central_final_support_no_death_consideration_gate_false":true,"no_teacher_or_training_corpus_admission":true,"failed_case":"fresh_noise_0","failed_noise_seed":12100,"failed_final_pose":[293.72767718621054,104],"failed_retained_gain":83,"failed_last90_x_range":[293.72767718621054,293.72767718621054],"failed_last90_y_range":[103.53861749529213,104],"failed_last90_body_query_contact_fraction":1.0,"failed_last90_max_speed_per_tick":0.46138250470787057,"failed_last90_secondary_final_support":true,"failed_last_correction_pixels":[15.999999999999998,0.0],"failed_last_contact_sign_proxy_inactive":true,"support_edge_not_climbing_impossibility_or_posthoc_central_success":true,"controller_gain_saturation_not_evidence_larger_gain_or_force_inference":true,"improvement_on_declared_subset_not_learned_policy_training_seed_replication_or_final_heldout":true,"bounded300second_owned_source_script_plan_prior_execution_passed":true,"zero_learning_paid_reservation_remote_write_or_public_release":true,"ledger_bytes_unchanged_seven_closed_estimates":true,"independent_paused_epoch":1791151516.0854468,"space_source_revision":"8044439043a1725dc5911577c85096cd04ddc4ae","actual_session":"onstate-20261004-v1","actual_mode":"onstate_study","closed_historical_deadline_unchanged":1791144140.4793909,"next_action_hint":"Inspect terminal actuator authority from captured edge-state hammer pose/query/travel and original collision/terrain response before deriving a distinct legal plant-and-recenter terminal primitive. Existing16pixel correction saturated/bodyXfixed/proxyinactive does not reveal forces or prove highergain. Fresh mechanical local plan before any new physics. Preserve all9cases and failed strictgate; no closed-plan retry, successful-only labels, gain/cap/sign/threshold sweep, detector relaxation or unchanged BC/PPO scaling."}}
