{"run": 16, "commit": "362327f", "metric": 0.0, "metrics": {"completed_timing_runs": 2, "repeat_1_seed_3_secondary_holds": 1, "repeat_4_seed_3_secondary_holds": 0, "repeat_4_seed_3_median_retained_gain": 27.767745097618473, "reference_full_completions": 0, "evaluation_deaths": 0, "actual_policy_optimizer_calls_each_arm": 3840, "repeat_4_actual_controlled_ticks": 393167, "repeat_4_reset_ticks": 6960}, "status": "keep", "description": "Partial matched-seed timing evidence: isolated fine-control hold versus coarse-control retained movement; no replicated timing effect", "timestamp": 1791093521003, "segment": 0, "confidence": null, "asi": {"hypothesis": "Finer control timing improves retained platform support under predeclared physical-time/optimizer-call settings", "partial_campaign": true, "complete_three_seed_cohorts": 0, "no_timing_arm_robustness_or_scaling_conclusion": true, "primary_metric_carried_forward_until_complete_cohorts": true, "session": "timing-20261004-v1", "training_seed": 3, "dataset_revision": "b0865f09d77e33efe5cc3d7b660a9cb40b539517", "evidence": "artifacts/timing_seed3_pair_20261004T055834361889Z/review.json", "actual_controlled_ticks_differ_by": 49, "repeat_1_learning_seconds": 1453.5993137149999, "repeat_4_learning_seconds": 690.3672198560016, "equal_calls_not_equal_compute_or_gradient_information": true, "outside_detector_candidate": {"case": "repeat_4_hammer_right", "final_pose": [281.47135360147234, 100.50353144647352], "last_four_seconds_body_hit_ticks": 120, "not_calibrated_support": true}, "binary_reload_or_cross_host_portability_not_verified": true, "next_action_hint": "Finish seeds 4/5 under unchanged source/queue/deadline; preserve outside-detector candidate only for separate post-hoc calibration/replay, never widen the active metric"}}
{"run": 17, "commit": "362327f", "metric": 0.0, "metrics": {"recorded_controlled_ticks_replayed": 1800, "max_reference_fast_per_tick_error": 0.0, "max_remote_recorded_body_position_error": 0, "final_four_seconds_body_query_hits": 120, "final_four_seconds_max_speed_per_tick": 0.0}, "status": "keep", "description": "Post-hoc recorded-action diagnostic validates stationary left-lip contact outside both frozen detectors; no metric or skill promotion", "timestamp": 1791094940072, "segment": 0, "confidence": null, "asi": {"hypothesis": "The seed-3 four-tick outside-detector pose is reproducible original-game contact physics, not fabricated telemetry", "post_hoc_selected_case": true, "not_policy_inference_or_training": true, "ordinary_start_no_placement": true, "frozen_detector_results_unchanged_false": true, "no_contact_force_or_cross_host_policy_robustness_claim": true, "primary_metric_carried_forward_until_complete_cohorts": true, "evidence": "artifacts/outside_detector_replay_20261004T061945777984Z/report.json", "final_pose": [281.47135360147234, 100.50353144647352], "retained_gain": 79.50353144647352, "visual_observation": "Original renderer shows pot at raised block left lip and hammer planted on lower terrain", "latest_remote_snapshot": "e2ea6bd59d28c11f1046637e367cb38dfaeebea3", "remote_seed_4_transition": 393200, "no_new_complete_reference_result_in_snapshot": true, "active_source_settings_budget_unchanged": true, "next_action_hint": "Keep current detector/gates frozen, finish seed-4/5 outcomes and consider any future region calibration separately and predeclared"}}
{"run": 18, "commit": "362327f", "metric": 0.0, "metrics": {"completed_timing_runs": 4, "seed_4_repeat_1_central_holds": 0, "seed_4_repeat_1_secondary_holds": 0, "seed_4_repeat_4_central_holds": 0, "seed_4_repeat_4_secondary_holds": 0, "seed_4_repeat_1_median_retained_gain": 23.566904897491355, "seed_4_repeat_4_median_retained_gain": -30, "validated_reference_final_cases": 36, "reference_full_completions": 0, "evaluation_deaths": 0, "actual_policy_optimizer_calls_each_arm": 3840, "seed_4_repeat_1_controlled_ticks": 393216, "seed_4_repeat_4_controlled_ticks": 393196, "seed_4_repeat_1_reset_ticks": 4320, "seed_4_repeat_4_reset_ticks": 5640}, "status": "keep", "description": "Partial timing evidence: validated seed-4 pair lacks declared holds, fine-control endpoint gains improve but timing preference reverses seed 3", "timestamp": 1791095937038, "segment": 0, "confidence": null, "asi": {"hypothesis": "Finer reactive timing improves retained platform support under the predeclared physical-time/optimizer-call comparison", "partial_campaign": true, "complete_three_seed_cohorts": 0, "no_robustness_promotion_or_timing_effect_conclusion": true, "primary_metric_carried_forward_until_complete_cohorts": true, "session": "timing-20261004-v1", "training_seed": 4, "dataset_revision": "d939596698dc137221c4a9fa8faba5f510a06b22", "evidence": "artifacts/timing_seed4_pair_20261004T063847993651Z/review.json", "active_phase": "ppo_absolute_repeat_1_seed_5", "actual_source_variables_deadline_runtime_verified_unchanged": true, "actual_controlled_ticks_differ_by": 20, "seed_4_repeat_4_terminal_short_decisions": 12, "seed_4_repeat_1_learning_seconds": 1399.5079529100003, "seed_4_repeat_4_learning_seconds": 676.2217177240018, "untrained_median_retained_gain_each_arm": 0, "binary_companions_present_not_reloaded_or_portable": true, "outside_detector_pose_observations": [{"case": "repeat_1_hammer_left", "final_pose": [282.4237836017675, 101.50261397332953], "final_body_query_hit_ticks": 120}, {"case": "repeat_4_action_noise_4", "final_pose": [1015.5713655471785, 176.70673828125], "final_body_query_hit_ticks": 120}], "pose_observations_not_calibrated_support_or_forces": true, "next_action_hint": "Finish unchanged seed-5 arms and full-cohort contract analysis, verify automatic PAUSED and durable artifacts before selecting a separate gated skill-acquisition follow-up; no active metric, source, budget or deadline changes"}}
{"run": 19, "commit": "994c73e", "metric": 0.0, "metrics": {"expert_diagnostic_cases": 11, "expert_standard_stream_cases": 9, "expert_central_holds": 8, "expert_secondary_holds": 8, "controlled_ticks_all_backends": 13200, "maximum_reference_fast_per_tick_error": 0.0, "float32_max_target_quantization_pixels": 0.000003809895730455537, "raw_float32_body_y_max_difference": 0.000269999999957804, "expert_noise_4_retained_gain": 62.82641873287467, "learned_full_completions": 0}, "status": "keep", "description": "Open-loop expert prerequisite: float32 preserves nominal landing and 8/9 short perturbations hold; noise-4 misses and intermediate precision drift is recorded", "timestamp": 1791097230906, "segment": 0, "confidence": null, "asi": {"hypothesis": "The known legal one-tick trajectory is a useful demonstration source under float32 controls and physical-time warm-up/noise perturbations", "diagnostic_only": true, "not_learning_or_policy_inference": true, "not_metric_comparable_to_learning_runs": true, "primary_metric_carried_forward_from_validated_runs": true, "ordinary_start_no_placement": true, "selected_historical_expert_existing_noise_streams_not_held_out": true, "controlled_ticks_per_case": 600, "evidence": "artifacts/expert_robustness_probe_20261004T070002812275Z/report.json", "validation_evidence": "artifacts/expert_robustness_probe_20261004T070002812275Z/validation.json", "source_expert_nominal_final_pose": [322.58588646662605, 104], "failed_case": "action_noise_4", "failed_case_final_pose": [246.91233163573318, 83.82641873287467], "failed_case_final_four_seconds_body_hits": 0, "initial_operator_validation_failure": "A mistaken raw/float32 whole-trajectory identity check failed at tick index 40 with body-Y difference 0.0002; endpoints/hold outcomes agree but changed inputs have small intermediate differences. This is not reference/fast error.", "active_dataset_revision": "02c1e44b5b7088ed8e6d477e7919fc692a9f2e4a", "active_seed_5_transition": 360400, "training_episode_hold_not_frozen_reference_result": true, "active_remote_source_settings_budget_unchanged": true, "next_action_hint": "Finish seed-5 outcomes and verify terminal PAUSED; conditionally collect observation/action demonstrations and check target conflicts before predeclaring imitation plus reactive recovery/RL, not open-loop robustness or blind scaling"}}
{"run": 20, "commit": "41a5f74", "metric": 0.0, "metrics": {"python_tests_passed": 187, "demo_rows": 5400, "eligible_demo_rows": 3576, "expert_training_cases_central_holds": 6, "bc_optimizer_calls_per_smoke": 8, "bc_rl_transitions": 0, "saved_clone_reference_fast_max_error": 0.0, "bc_smoke_retained_gain": 0.0}, "status": "keep", "description": "Validation-only legal demonstration and PPO actor warm-start pipeline implemented; no full cloning or recovery training yet", "timestamp": 1791100224197, "segment": 0, "confidence": null, "asi": {"hypothesis": "Successful legal pre-action observation/target data can initialize a compatible PPO actor without altering value/log-std/optimizer state or the physical contract", "validation_only": true, "not_competence_or_full_training": true, "not_metric_comparable_to_learning_runs": true, "primary_metric_carried_forward": true, "evidence": "artifacts/cloning_pipeline_verification_20261004T073750651481Z/verification.json", "corpus": "artifacts/demonstrations_20261004T072714652488Z", "proposal": "artifacts/imitation_study_20261004T074252246079Z/plan.json", "nominal_collection_reference_fast_observation_action_info_exact": true, "model_normalizer_seeded_reload_exact": true, "initial_failure": "Direct tuple/list metadata equality failed after observation/action checks passed; canonical descriptors fixed and new data collected", "label_correction": "Exclude forced left/right warm-up targets at identical spawn, retain all physical rows and failed expert cases", "remaining_eligible_exact_state_action_conflict_range": 0.028063863515853882, "bc_supervised_mse_before": 0.2556682229042053, "bc_supervised_mse_after": 0.14510615170001984, "full_remote_cloning_cli_still_requires_separate_admission": true, "viewer_failures": "Detached process Git dependency and ChromeDriver initialization failed; native command cleanup prevents persistence. Browser-owned Factory pane replay observed advancing without error; no user saved browser session accessed.", "active_source_settings_reservation_deadline_unchanged": true, "next_action_hint": "Close/validate timing study and verify PAUSED, then integrate full remote-only BC/PPO runner/checker/admission and fresh capped preflight. Do not substitute more viewer work or desktop training for the substantive ML comparison."}}
{"run": 21, "commit": "362327f", "metric": 0.0, "metrics": {"validated_completed_timing_runs": 5, "repeat_1_seed_5_central_holds": 2, "repeat_1_seed_5_secondary_holds": 5, "median_retained_gain": 82, "reference_full_completions": 0, "evaluation_deaths": 0, "controlled_physics_ticks": 393216, "reset_settling_ticks": 4440, "actual_policy_optimizer_calls": 3840}, "status": "keep", "description": "Partial timing evidence: fine seed 5 learns a nominal ledge hold, but full game and all-seed retention remain unsolved", "timestamp": 1791100224198, "segment": 0, "confidence": null, "asi": {"hypothesis": "One-tick PPO control improves first-platform retention under the frozen timing study", "partial_campaign": true, "dataset_revision": "0c07c5cbce7ae847715b815c044e668df363eff5", "evidence": "artifacts/visible_learned_run_20261004T072937674870Z/run_review.json", "nominal_final_pose": [320.52872790897095, 104], "fine_training_seed_central_counts": [0, 0, 2], "fine_training_seed_secondary_counts": [1, 0, 5], "learning_wall_seconds": 1450.2253960790003, "no_worst_seed_improvement_or_promotion": true, "binary_metadata_verified_not_reloaded": true, "visible_recorded_action_replay_not_local_policy_inference": true, "next_action_hint": "Validate final coarse seed 5 and automatic PAUSED, close actual cost estimate, then choose the separately admitted demonstration-assisted skill acquisition comparison; do not mistake this ledge stall for full climbing."}}
{"run": 22, "commit": "362327f", "metric": 0.0, "metrics": {"completed_timing_runs": 6, "reference_final_cases": 54, "reference_full_completions": 0, "evaluation_deaths": 0, "fine_worst_seed_central_rate": 0.0, "coarse_worst_seed_central_rate": 0.0, "fine_controlled_ticks": 1179648, "coarse_controlled_ticks": 1179553, "fine_reset_ticks": 13200, "coarse_reset_ticks": 18120, "policy_optimizer_calls_each_arm": 11520, "timing_closed_estimate_usd": 0.10014916613499324, "cumulative_closed_estimate_usd": 0.29269618565241495}, "status": "discard", "description": "Complete timing comparison fails worst-seed robust retention and full-game goal; all six contracts valid and automatic pause verified", "timestamp": 1791100724305, "segment": 0, "confidence": null, "asi": {"hypothesis": "Finer one-tick feedback improves robust first-platform retention under matched nominal physical exposure and optimizer-call settings", "rollback_reason": "Both complete arms have worst-seed central/secondary/completion rate zero; fine gains are seed-specific and no final case reaches the summit", "session": "timing-20261004-v1", "dataset_revision": "05c589ad26da16a3cfe6885c2948990f45a6e9c5", "evidence": "artifacts/timing_complete_review_20261004T075825867253Z/complete_review.json", "fine_central_counts": [0, 0, 2], "fine_secondary_counts": [1, 0, 5], "coarse_central_and_secondary_counts": [0, 0, 0], "fine_median_retained_each_seed": [0, 23.566904897491355, 82], "coarse_median_retained_each_seed": [27.767745097618473, -30, 4], "all_untrained_medians_zero": true, "fine_learning_wall_seconds": 4303.3326627040005, "coarse_learning_wall_seconds": 2131.5416383990014, "equal_calls_not_equal_compute_information_or_actual_exposure": true, "twelve_final_binary_objects_present_not_reloaded": true, "independently_verified_paused_epoch": 1791100724.3051379, "no_source_settings_deadline_change_or_new_reservation": true, "actual_provider_bill_unknown": true, "next_action_hint": "Implement/test full remote BC and PPO integration/checker/admission for the prepared fresh seeds 6/7/8 comparison, then reserve/preflight a distinct capped private session. No viewer work, blind scale, closed-session restart or silent budget renewal."}}
{"run": 23, "commit": "6f3833f", "metric": 0.0, "metrics": {"python_tests_passed": 196, "validated_pipeline_arms": 3, "rl_controlled_ticks_each_ppo_arm": 256, "reset_ticks_each_ppo_arm": 120, "ppo_optimizer_calls_each_ppo_arm": 4, "bc_optimizer_calls_each_clone_arm": 8, "eligible_demo_rows": 3576, "full_remote_runs_launched": 0}, "status": "keep", "description": "Validation-only integrated scratch/BC/BC+PPO stages with common frozen normalization and separate work accounting; full remote dispatch remains refused", "timestamp": 1791102357935, "segment": 0, "confidence": null, "asi": {"hypothesis": "The proposed demonstration-assisted comparison can preserve a common observed-state scale while staging BC and PPO and measuring their work separately", "validation_only": true, "not_competence_or_full_training": true, "not_metric_comparable_to_learning_runs": true, "primary_metric_carried_forward": true, "evidence": "artifacts/imitation_three_arm_smokes_20261004T082101406129Z/verification.json", "untrained_nine_case_reference_traces_equal": true, "all_saved_frozen_normalizer_statistics_equal": true, "bc_only_and_pre_ppo_clone_weights_bitwise_equal": true, "saved_gamma_gae_match": true, "all_short_finals_holds_completions_deaths_zero": true, "full_model_budget_and_remote_cli_drift_refused_before_work": true, "space_rechecked_paused_source_settings_unchanged": true, "ledger_unchanged_no_new_reservation": true, "next_action_hint": "Implement the strict imitation campaign checker and Linux parent-bound worker admission, connect these tested stages to full-budget dispatch, then reserve/preflight a fresh capped session. No more detached viewer work or disconnected smoke scaffolding."}}
{"run": 24, "commit": "075fe92", "metric": 0.0, "metrics": {"python_tests_passed": 205, "prepared_imitation_runs": 9, "launched_full_runs": 0, "eligible_demo_rows": 3576}, "status": "keep", "description": "Validation-only frozen imitation campaign/checker; real short reference stages pass and full-study smoke acceptance is refused", "timestamp": 1791103425232, "segment": 0, "confidence": null, "asi": {"hypothesis": "The proposed nine-run demonstration-assisted comparison can be validated without pooling smoke artifacts, changing physical evaluation or conflating BC/PPO work", "validation_only": true, "not_competence_or_full_training": true, "not_metric_comparable_to_learning_runs": true, "primary_metric_carried_forward": true, "evidence": "artifacts/imitation_campaign_20261004T084341116202Z/checker_verification.json", "full_stage_source_data_normalization_admission_and_work_drift_refused": true, "matched_seed_untrained_and_cloned_behavior_checks": true, "missing_companions_incomplete": true, "synthetic_fixtures_not_real_policy_evidence": true, "initial_validation_failures": ["Paired drift fixture changed trace but not pre-reset final duplicate; earlier consistency refusal was correct, fixture fixed", "Real preparation compared tuple warm-ups with JSON lists; canonical contract descriptors and regression test fixed this"], "binary_reload_and_portability_not_claimed": true, "actual_space_rechecked_paused_no_remote_writes": true, "cost_ledger_unchanged_no_reservation": true, "next_action_hint": "Implement Linux sequential imitation executor/parent grants and pinned data/context/preflight worker integration; enable full trainer/clone budgets only under tested admission and then reserve/preflight a distinct capped private session."}}
{"run": 25, "commit": "69597d0", "metric": 0.0, "metrics": {"python_tests_passed": 219, "validated_pipeline_arms": 3, "snapshot_payload_files": 422}, "status": "keep", "description": "Validation-only remote imitation executor/permits/full-budget trainer/private worker wiring; exact old smoke weights/RMS/traces preserved", "timestamp": 1791105056135, "segment": 0, "confidence": null, "asi": {"hypothesis": "The declared demonstration-assisted comparison can execute under fresh Linux parent/data/source/budget grants without changing the validated physical pipeline", "validation_only": true, "not_competence_or_full_learning": true, "not_metric_comparable_to_learning_runs": true, "primary_metric_carried_forward": true, "evidence": "artifacts/imitation_admission_smokes_20261004T090039798467Z/verification.json", "snapshot": "artifacts/hf_bundle_20261004T090634364226Z", "shared_cost_source_preflight_guards_preserved": true, "direct_parent_path_dataset_claim_bound_permits": true, "sequential_nine_run_and_no_resume_guards": true, "full_bc_and_ppo_budgets_need_validated_permit": true, "credentials_stripped_and_cleanup_pause_bounded": true, "private_pinned_context_data_byte_limits": true, "initial_validation_failure": "Focused package invocation of existing tests.test_timing_worker fails its bare test_timing_execution import; required repository discovery passes all tests without production changes", "smoke_policy_normalizer_reference_traces_bitwise_or_exact_equal": true, "next_action_hint": "Review the fresh deployed preflight's nine durable checks and independent PAUSED before admitting full training; do not change the running image or relax failed admission."}}
{"run": 26, "commit": "95a8e31", "metric": 0.0, "metrics": {"maximum_new_compute_reservation_usd": 0.48, "closed_plus_reserved_estimate_usd": 0.7726961856524149, "full_imitation_runs_launched": 0}, "status": "keep", "description": "Operational validation: fresh private imitation preflight started, immutable source/corpus/context/deadline admission durable; full study not started", "timestamp": 1791105160053, "segment": 0, "confidence": null, "asi": {"hypothesis": "Legal demonstration initialization followed by PPO improves reactive first-ledge retention versus a matched frozen-normalization scratch baseline", "preflight_launch_only": true, "no_effectiveness_result_yet": true, "primary_metric_carried_forward": true, "session": "imitation-20261004-v1", "source_space_revision": "95a8e311664789bcf1be5c609dce148e1f300f93", "operator_context_revision": "9b3f4f0d6f1128e301e9603edecabecf12de8567", "corpus_dataset_revision": "c09410fbf4fd7b36bfb6976f3659b7ec28b2e38c", "initial_dataset_revision": "08234198856fa67a72702e89a827a6e3a3d98678", "evidence": "artifacts/imitation_deployment_20261004T090843379016Z/initial_status_verification.json", "start_epoch": 1791104923.3790162, "deadline_epoch": 1791162523.3790162, "source_game_data_context_runtime_budget_match": true, "nine_passed_preflight_checks_not_yet_claimed": true, "fresh_private_source_and_parameters_set_while_verified_paused": true, "no_cpu_xl_or_old_session_resume": true, "next_action_hint": "Read one later pinned durable preflight snapshot, require all nine checks and verified PAUSED, publish exact passed ticket and switch only context/mode for intentional study start under this same source/corpus/reservation/deadline."}}
