{"run":64,"commit":"7b2885b","metric":0.0,"metrics":{"offline_examined_rows":3600,"offline_terrain_grid_points":16905,"new_gameplay_ticks":0,"new_reset_ticks":0,"learning_updates":0,"edge_final120_body_query_hits":120,"edge_final120_hammer_query_hits":0,"edge_final120_saturated_corrections":120,"player_collider_bottom_below_position_at_direction90":37.059111061767474,"proposed_plant_reach":44.40720662234904,"proposed_approx_footprint_opaque_samples":18,"proposed_approx_footprint_samples":81,"inspection_failures":1,"all_closed_estimated_usd":0.4564241866528988},"status":"discard","description":"Offline edge terminal audit finds free hammer far right and no body authority; original collider/terrain geometry motivates fixed right-side plant then leftward push, not tested recentering","timestamp":1791152688229,"segment":0,"confidence":null,"asi":{"hypothesis":"Captured terminal motion/query evidence and original collider geometry can mechanically motivate a separate legal plant/recenter action rather than increasing saturated body-error correction gain","rollback_reason":"No new physical response, recovery, teacher or primary-goal improvement. Approximate alpha cannot certify renderer contact. Initial left-side plant suggestion unsupported and discarded; retain bounded audit/right-side proposal for a fresh local test only.","evidence":"artifacts/terminal_authority_audit_20261004T221822853423Z/verification.json","audit_evidence":"artifacts/terminal_authority_audit_20261004T221822853423Z/audit.json","original180second_deadline_and_input_source_script_plan_budget_hashes_valid":true,"later_bounded_geometry_verification_not_audit_retry_or_deadline_extension":true,"six_captured_edge_nominal_central_noise_reference_fast_traces_exact":true,"edge_final120_body_x_constant":293.72767718621054,"edge_final120_hammer_x_range":[383.35769485780355,390.8542443447614],"edge_final120_hammer_query_hits_zero_not_force_or_true_solver_branch":true,"all_three_terminal_cases_body_hits120_hammer_hits0":true,"edge_current_body_render_offset":[0,20],"edge_current_equilibrium_hammer_target":[386.60467718621055,80.00999999999999],"original_player_svg_size":[16.75,49.61678],"original_player_rotation_center":[10.434472250000027,12.557668938232524],"original_hammer_bitmap_resolution2_size":[16,16],"approximate_surface_right_world_point":[319.72767718621054,65],"initial_left_plant_pointer_discarded":[-26,-40],"initial_left_sampled_band_no_alpha_surface":true,"proposed_fixed_right_plant_pointer_pixels":[26,-56],"proposed_fixed_leftward_push_pointer_pixels":[0,-56],"proposed_plant_world_target":[319.72767718621054,68],"approximate_hitbox_footprint_not_renderer_contact_authority":true,"original_blocked_response_can_transfer_left_hammer_request_to_right_body_motion":true,"no_plant_or_push_physically_applied_yet":true,"no_controller_teacher_labels_learning_or_gate_admission":true,"failed_pillow_svg_inspection":"PIL.UnidentifiedImageError; originalSVGread/XMLgeometryresolved, no converter installation or asset edit","existing8central9secondary_results_and_failed9of9gate_preserved":true,"no_new_paid_reservation_remote_write_or_public_release":true,"ledger_bytes_unchanged_seven_closed_estimates":true,"independent_paused_epoch":1791152688.22913,"space_source_revision":"8044439043a1725dc5911577c85096cd04ddc4ae","actual_session":"onstate-20261004-v1","actual_mode":"onstate_study","closed_historical_deadline_unchanged":1791144140.4793909,"next_action_hint":"Freeze new ordinary-spawn legal600tick edgeprefix followed by unchanged terminal continuation vs fixed(26,-56)plant for<=30ticks; third same-plant-history branch applies one(0,-56)leftwardpush. Require sourceprefix/equalpreinput/actual renderer-query-travel and positive incremental bodyXresponse/referencefast parity. No placement, pointer scan, cutoff/gain/cap/sign/threshold tuning or failedvalidationretry. Only local real planting/authority can admit separate full terminalrecenter stage, never labels/teacher/learning from alpha or one-step motion."}}
{"run":65,"commit":"93523fc","metric":0.0,"metrics":{"local_terminal_rollouts":8,"controlled_ticks":4986,"reset_ticks":960,"learning_updates":0,"common_plant_ticks":30,"plant_hammer_query_hit_ticks":13,"final_common_plant_hammer_travel":0,"one_push_incremental_body_x":5.199999999999818,"one_push_incremental_body_y":0.1838464870883456,"one_push_hammer_delta_norm":0,"local_plant_authority_gate_passed":1,"new_central_held_events":0,"plant_push_best_central_hold_seconds":0.16666666666666666,"plant_push_final_retained_gain":83.56511840979513,"summits":0,"deaths":0,"focused_python_tests_passed":26,"all_closed_estimated_usd":0.4564241866528988},"status":"discard","description":"Fixed right-side plant produces real hammer contact and matched leftward push adds5.2pixels rightward body motion into central region; still moving/no3second hold, only release/settling test admitted","timestamp":1791153896674,"segment":0,"confidence":null,"asi":{"hypothesis":"Mechanically chosen right plant then leftward hammer push creates real body-control authority from the legally reached stable edge landing","rollback_reason":"Local authority gate passes but pushed bodyvelocity exceeds centralhold speed limit and bestqualifiedwindowonly.166667seconds. No settled recentering, teacher or primarycompletion improvement. Retain evidence/primitive proposal only for separately frozen release-and-settle diagnostic.","evidence":"artifacts/terminal_plant_probe_20261004T223832761543Z/verification.json","source_geometry_admission_hash_bound":true,"nominal600tick_reference_fast_historical_central_hold_gate_passed":true,"all600tick_edge_preinputs_controls_rewards_info_physical_prefixes_exact":true,"ordinary_start_actual_legal_controls_no_placement_or_physics_change":true,"continued_noise_seed12100_std02_four_tick_clock_after600":true,"fixed_plant_pointer_pixels":[26,-56],"fixed_push_pointer_pixels":[0,-56],"thirty_common_plant_steps_then_one_declared_hold_or_push_contrast_no_cutoff_extension":true,"plant_only_push_full_history_and_final_preinputs_equal":true,"all_four_full_same_host_backend_pairs_exact":true,"all8full_raw_milestone_proposed_applied_control_and_noise_traces_verified":true,"plant_real_renderer_query_hits13of30_not_force_estimation":true,"last_common_hammer_travel_zero":true,"one_push_incremental_body_delta":[5.199999999999818,0.1838464870883456],"one_push_incremental_hammer_delta":[0.0,0.0],"local_plant_authority_gate_passed":true,"local_support_body_or_hammer_contact_not_original_body_milestone":true,"unchanged_terminal_final_pose":[293.72767718621054,104],"plant_only_final_pose":[304.74139488939073,104.38127192270679],"plant_push_final_pose":[309.94139488939055,104.56511840979513],"plant_push_final_body_velocity":[3.7451272859345863,1.0505513547904854],"inside_central_coordinates_not_stable_held_acquisition":true,"prior8of9central9of9secondary_and_failedstrict9of9gate_preserved":true,"bounded180second_owned_source_script_plan_prior_execution_passed_no_tuning_or_retry":true,"zero_teacher_labels_learning_paid_reservation_or_remote_write":true,"ledger_bytes_unchanged_seven_closed_estimates":true,"independent_paused_epoch":1791153896.6747024,"space_source_revision":"8044439043a1725dc5911577c85096cd04ddc4ae","actual_session":"onstate-20261004-v1","actual_mode":"onstate_study","closed_historical_deadline_unchanged":1791144140.4793909,"next_action_hint":"Freeze equal721tick knownedge diagnostic: unchanged continuation,30fixedplant+1planthold+90original contact-controller release,30fixedplant+1push+90release; same continued noise/sourceprefix/referencefast plus nominal600baseline,8rollouts/max5526control+960reset/180work/210ownedseconds. Keep pointers/timing/gain/caps/proxy/controller fixed, require final90central position/speed/bodycontact/fidelity before a full conditional terminalcontroller design. No extra pushes/target or cutoff scan/old9casegate rewrite/labels/teacher or learnedsummit promotion."}}
{"run":66,"commit":"54f4d6d","metric":0.0,"metrics":{"release_rollouts":8,"controlled_ticks":5526,"reset_ticks":960,"learning_updates":0,"new_central_held_events":0,"plant_push_final_retained_gain":83,"plant_push_final_consecutive_qualified_ticks":89,"plant_push_best_central_hold_seconds":2.966666666666667,"plant_push_final90_nonqualified_rows":1,"plant_push_first_release_speed":2.1827566550268225,"plant_push_final90_body_query_fraction":0.9888888888888889,"final_supported_recenter_gate_passed":0,"summits":0,"deaths":0,"focused_python_tests_passed":26,"all_closed_estimated_usd":0.4564241866528988},"status":"discard","description":"Fixed plant/push/release settles body centrally atX314 but one initial fast release tick leaves89/90qualified support ticks; declared hold gate fails without extension, no controller/data/learning admission","timestamp":1791154976046,"segment":0,"confidence":null,"asi":{"hypothesis":"Resuming unchanged contact-sign control after the fixed plant and one push permits safe centrally supported release and settling within the declared90tick window","rollback_reason":"Firstrelease tick632speed2.18276exceeds2limit; final89qualifiedticks/2.96667seconds, not required3s. Gatefalse despite central finalpose/zero velocity. Preserve closed fixed90failure, no extra tick or speed/gate relaxation; full conditionalterminaldesign and teacher/data admission remainblocked.","evidence":"artifacts/terminal_release_probe_20261004T225830472380Z/verification.json","settling_boundary_evidence":"artifacts/terminal_release_probe_20261004T225830472380Z/settling_boundary_review.json","same600ordinaryprefix30plant_onecontrast90originalcontroller_release":true,"targets_noise12100_controller_gain_caps_signproxy_unchanged":true,"all_four_full_same_host_backend_pairs_exact":true,"all_eight_prior_nominal_or631tick_full_traces_exact":true,"all8full_raw_milestone_proposed_applied_control_and_continued_noise_traces_verified":true,"prior_matched_onepush_body_delta_reproduced":[5.199999999999818,0.1838464870883456],"prior_local_authority_gate_reproduced":true,"unchanged_terminal_final_pose":[293.72767718621054,104],"plant_only_release_final_pose":[303.2293503851427,104],"plant_push_release_final_pose":[314.42796145266976,104],"plant_push_release_final_velocity":[0.0,0.0],"only_final90_nonqualified_tick":632,"nonqualified_tick_pose":[312.00121489665474,103.8429216549298],"nonqualified_tick_body_query_hit":false,"final89_region_speed_ticks_qualify":true,"final90_hold_gate_not_relaxed_or_retrospectively_passed":true,"later_release_outcomes_feedback_stage_comparison_not_equal_state_single_action":true,"no_more_gameplay_for_boundary_review":true,"bounded180second_owned_source_script_plan_prior_work_passed":true,"no_new_conditionalcontroller_teacher_labels_learning_paid_reservation_or_remote_write":true,"original8central9secondary_and_failed9of9gate_preserved":true,"ledger_bytes_unchanged_seven_closed_estimates":true,"independent_paused_epoch":1791154976.046585,"space_source_revision":"8044439043a1725dc5911577c85096cd04ddc4ae","actual_session":"onstate-20261004-v1","actual_mode":"onstate_study","closed_historical_deadline_unchanged":1791144140.4793909,"next_action_hint":"Propose distinct state-observed settling and qualified-hold phases, not one-tick retry: same600prefix/30plant/onepush/originalcontroller/noise; settle<=30ticks under originalcentralregion/speed<=2/bodyquery evidence, then90qualifiedholdticks with originalbodyfraction>=.8, explicit timeout/loss-of-qualification failure and no budget renewal. Freeze complete phase rule/source/workmax/deadline before newphysics. Local pass only permits later conditionalterminaldesign, never label/teacher/old9casegate or learnedgoal promotion. No target/gain/cap/threshold/timing sweep or closed90plan extension."}}
{"run":67,"commit":"2899bad","metric":0.0,"metrics":{"observed_settle_hold_rollouts":8,"controlled_ticks":5290,"reset_ticks":960,"learning_updates":0,"pushed_settling_ticks":2,"pushed_independent_hold_ticks":90,"pushed_hold_body_query_hits":90,"pushed_controlled_ticks":723,"unchanged_and_plant_only_controlled_ticks":661,"new_reference_central_held_events":1,"observed_settle_hold_gate_passed":1,"summits":0,"deaths":0,"python_tests_passed":323,"all_closed_estimated_usd":0.4564241866528988},"status":"discard","description":"Separately frozen observed settling then independent90tick hold passes knownedge recentering with original milestone; admits causal conditionalterminal design only, no labels/learnedgoal promotion","timestamp":1791156280565,"segment":0,"confidence":null,"asi":{"hypothesis":"A causal bounded settling phase followed by a distinct original90qualified-tick support window can measure the unchanged plant/push primitive's central hold without counting its transient impulse","rollback_reason":"Primary fullcompletion unchanged; local hand-designed knownedge success is not whole-wrapper robustness, corrective teacher, trained policy or summit. Retain passed monitor/primitive evidence for one causal conditionalwrapper implementation; no data/paidlearning promotion.","monitor_version":"observed-settle-then-central-hold-v1","evidence":"artifacts/settle_aware_probe_20261004T232031597236Z/verification.json","settling_cap_ticks":30,"separate_hold_ticks":90,"settling_trigger_requires_original_central_region_speed2_bodyquery_alive":true,"trigger_sample_excluded_from_hold_count":true,"full90consecutive_region_speed_alive_and_original_bodyfraction_point8":true,"no_rearming_reset_or_cap_renewal_after_timeout_or_loss":true,"same600ordinaryprefix30plant_onepush_originalcontroller_noise12100_no_targets_gain_caps_metric_edits":true,"new751maximum_controlled_tick180second_protocol_declared_before_play":true,"old_fixed90failure_and_failedninecase_gate_preserved":true,"pushed_settled_physics_tick":753,"pushed_hold_start_physics_tick":754,"pushed_final_pose":[314.42796145266976,104],"pushed_final_velocity":[0.0,0.0],"pushed_retained_gain":83,"pushed_monitor_hold_ticks90_bodyquery_hits90":true,"original_milestone_central3second_held_true":true,"unchanged_and_plant_only_settling_timeout30_no_retries":true,"all_four_full_same_host_backend_pairs_exact":true,"all_old_available_source_prefix_actions_observations_rewards_physical_states_exact_monitor_metadata_only_added":true,"all8full_raw_milestone_proposed_applied_control_noise_and_monitor_state_machine_traces_verified":true,"qualified_hold_samples_distinct_from_trigger_independently_verified":true,"new_conditionalterminal_design_admitted_but_not_implemented_here":true,"no_teacher_or_corpus_or_learnedpolicy_admission":true,"zero_learning_paid_reservation_remote_write_or_public_release":true,"ledger_bytes_unchanged_seven_closed_estimates":true,"independent_paused_epoch":1791156280.5652258,"space_source_revision":"8044439043a1725dc5911577c85096cd04ddc4ae","actual_session":"onstate-20261004-v1","actual_mode":"onstate_study","closed_historical_deadline_unchanged":1791144140.4793909,"next_action_hint":"Implement one causal resettable terminalwrapper around unchanged contact-signcontroller; trigger once after600decisions only rawslow/body-supported leftedge285<=X<305,Y100..112,speed<=2, no case/seed/trace-index oracle. Alreadycentral exactoriginal; same30plant26,-56/onepush0,-56/originalrelease/30settle/90independenthold, no rearm/caprenewal/limitschange. Align monitor to actually applied one-tick transitions, raw217plus privatephaseclock. Freeze wrapper/source and bounded originalphysicssmoke beforeplay; separately wholewrapper cohort required before teacher/data/learner contract. Handle clock/memory honestly; no oldgate rewrite or paid unchangedlearner scaling."}}
{"run":68,"commit":"596da5d","metric":0.0,"metrics":{"wrapper_smoke_rollouts":6,"controlled_ticks":4450,"reset_ticks":720,"learning_updates":0,"reference_final_central_supports":3,"reference_wrapper_attempts":1,"known_edge_wrapper_ticks":723,"central_bypass_ticks":751,"edge_plant_ticks":30,"edge_push_ticks":1,"edge_release_ticks":92,"edge_settling_ticks":2,"edge_independent_hold_ticks":90,"summits":0,"deaths":0,"full_python_tests_passed":330,"final_boundary_focused_tests_passed":15,"all_closed_estimated_usd":0.4564241866528988},"status":"discard","description":"Causal raw-input one-attempt terminal wrapper reproduces known edge recovery and exactcentral bypass in3case physics smoke; only whole-wrapper cohort admitted, no teacher/learner goal promotion","timestamp":1791157675436,"segment":0,"confidence":null,"asi":{"hypothesis":"A resettable state-predicate wrapper can activate the validated terminal primitive without case/seed/trace oracles and preserve alreadycentral control exactly","rollback_reason":"Implementation smoke passes but primaryfullcompletion unchanged; threeknown cases do not establish wholewrapper robustness, freshteacher competence or learnedpolicy. Retain validated wrapper/tests for separately frozen cohort, no labels or paidlearning admission.","controller_version":"causal-left-edge-terminal-wrapper-v1","evidence":"artifacts/terminal_wrapper_smoke_20261004T234047944352Z/verification.json","raw217float32_pre_and_post_only_plus_private_clock_phase":true,"exactly_one_action_then_actual_one_tick_observe_nextpre_equalslastpost":true,"one_arming_checkpoint_after600observed_transitions_beforedecision601":true,"raw_supported_slow_leftedge_predicate_no_case_seed_trace_index":true,"encoded_float32_central305_boundary_bypasses_not_roundoff_triggered":true,"missed_checkpoint_and_completed_failed_attempt_never_rearm":true,"maximum_decisions":751,"fixed_plant_pointer":[26,-56],"fixed_push_pointer":[0,-56],"baseclock_advances_during_actual_primitive_overrides":true,"monitor_firstrelease_post_not_pushpost_sample":true,"monitor_tick_is_controlled_relative_not_absolute_reset_tick":true,"all6full_raw_milestone_action_observe_noise_and_monitor_traces_verified":true,"all_three_full_same_host_backend_pairs_exact":true,"all_cases600oldcontroller_prefixes_exact":true,"known_edge_all723actualphysics_controls_observations_rewards_equal_prior_validated_primitive":true,"known_edge_final_pose":[314.42796145266976,104],"both_alreadycentral_cases_permanent_bypass_actualcontrols_exactbase":true,"nominal_final_pose":[322.58588646662605,104],"central_noise12101_final_pose":[325.31119590110063,104],"all_three_final90central_body_supported_windows":true,"actualwrapper_outputs_applied_with_originalnoise_no_recorded_prefix_override":true,"reset_raw_bodyflag_prepost_budget_no_rearm_guards_unit_tested":true,"implementation_wholecohort_admission_only":true,"old_fixed90failure_and_old600ninecase_failedgate_preserved":true,"zero_teacher_corpus_learning_paid_reservation_remote_write_or_public_release":true,"bounded180second_owned_source_script_plan_prior_execution_passed":true,"ledger_bytes_unchanged_seven_closed_estimates":true,"independent_paused_epoch":1791157675.4369287,"space_source_revision":"8044439043a1725dc5911577c85096cd04ddc4ae","actual_session":"onstate-20261004-v1","actual_mode":"onstate_study","closed_historical_deadline_unchanged":1791144140.4793909,"next_action_hint":"Freeze unchanged wholewrapper vs originalcontactcontroller on same9developmentcases reset13001/warmups/noise12100..12105, atmost751ticks/arm/referencefast,36rollouts/max27036control+4320reset/300work/330ownedseconds. Preserve600prefix/bypassexact, require9/9referencefinalcentralbody support/no deaths/fullfidelity. Newcontroller/horizon does not rewrite failedold600gate and is not freshheldout; passing still requires freshwrapper validation before separate captureddata and clock/memory-aware learnercontract. No labels/paidunchangedlearner scaling."}}
