{"run":73,"commit":"9060fed","metric":0.0,"metrics":{"single_pulse_followthrough_rollouts":6,"controlled_ticks":4204,"reset_ticks":720,"learning_updates":0,"baseline_retained_gain":11,"single_pulse_retained_gain":11,"baseline_reference_central_holds":0,"single_pulse_reference_central_holds":0,"single_pulse_reference_secondary_holds":0,"single_pulse_final90central_support":0,"single_pulse_final90secondary_support":0,"recovery_design_gate_passed":0,"local_release_gate_reproduced":1,"handoff_fixedgoal_error_tick301":9.504053863427393,"handoff_fixedgoal_error_tick302":14.7982418955448,"handoff_fixedgoal_error_tick305":27.59808651161133,"first_postpulse_hammer_query_hit_tick":352,"summits":0,"deaths":0,"focused_python_tests_passed":41,"owned_elapsed_seconds":36.495457887649536,"all_closed_estimated_usd":0.4564241866528988},"status":"discard","description":"Single release plus unchanged feedback fails both ledge holds/gain11through751; released tip remains free but incomplete fixedgoal diverges as timed strokes advance, separate observedtargetcompletion hypothesis only","timestamp":1791163335814,"segment":0,"confidence":null,"asi":{"hypothesis":"The locally validated single release at300 lets unchanged contactfeedback/noise complete acquisition and retain central support by the newly declared fixed751horizon","rollback_reason":"Both baseline and single-pulse branch finish lowY32/gain11/no holds; final90central/secondary false and recovery/designgate fails. Preserve closed single-pulse failure, no secondpulse/terminalmacro or cutoff extension. Local release remains validated but cannot imply body acquisition, teacher or learning.","evidence":"artifacts/hammer_followthrough_probe_20261005_v1/verification.json","handoff_evidence":"artifacts/hammer_followthrough_probe_20261005_v1/handoff_review.json","baseline_final_pose":[269.48184482655313,32],"single_pulse_final_pose":[269.47924084864445,32],"same_one_tick300rawpriorworldgoal_override_otheractions_originalfeedback_and_continuousnoise":true,"ordinary_start_reset14001_noise13105_no_placement_or_recordedprefix_override":true,"all299prefix_actualcontrols_fullphysics_and_contrastpreinput_equal":true,"nominal600_and_fullbaseline751_historical_exact":true,"all6priorlocal_nominal_or300tick_histories_exact":true,"all6raw_milestone_proposed_applied_caseclock_chronologies_verified":true,"all3full_samehost_backend_pairs_exact":true,"exactly_one_candidate_override_each_backend":true,"local_release_actualeffect_exact_error14point708to11point145_queryfalse_travel4point474":true,"incremental_body_at300_numericalresidual_not_lift":true,"handoff_300to305tip_queryfree_firstlaterqueryhit352_not_immediate_replant":true,"timedbasephase300to304_moves_away_from_incomplete_fixedgoal":true,"later_unequal_branch_states_feedbackstage_outcome_not_directsingle_step_bodyeffect_or_fullfailure_causality":true,"supplementalhandoffinspection_no_newgameplay_or_tolerance_timing_search":true,"candidate_causaldesign_teacher_corpus_labels_or_learning_not_admitted":true,"originalfresh8of9failedstrictgate_allotherhistoricalgates_immutable":true,"no_second_release_automaticterminalmacro_extra_target_gain_cap_proxy_or_cutoff_scan":true,"frozen180work210owned_source_prior_localadmission_plan_script_parent_budget_deadline_secretstripped_child_durabletrace_cleanup_passed":true,"ledgerbytes_unchanged_sevenclosed_estimates":true,"no_paidreservation_remote_write_deployment_publicrelease_or_substantive_localtraining":true,"independent_paused_epoch":1791163335.8149176,"space_source_revision":"8044439043a1725dc5911577c85096cd04ddc4ae","actual_session":"onstate-20261004-v1","actual_mode":"onstate_study","actual_context":"ed3a53c349d08380401bc2a27d466ea58c378210","closed_historical_deadline_unchanged":1791144140.4793909,"next_action_hint":"Freeze distinct observed HAMMER-TARGET completion phase, not pulse-length scan/recoveryretry: sameone fixedrawpriorrow300worldgoal/offset0,20/pointerformula/ordinary299prefix/continuousnoise. Recompute fromactualrawbody until actualpostrawhammer-worlderror<=1(existingstationarytolerance),max30steps/1s/oneattempt/no rearm-caprenewal. Require realtipmotion/legalaxes128/reach26..102/alignedaction-observe/alive/fidelity; queryrelease notcompletion and no bodyalignment/acquisition implied. No laterprior/resumedfeedback in this local stage. Nominal600gate plusbaseline299+30original vs candidate299+atmost30goalsteps/referencefast,6rollouts/max2516control+720reset/180work/210ownedseconds,variableearlystopexplicit/equalmax329notterminaltimes,oldprefix/300response/base329exact. Pass onlylatercausalphaseDESIGN, not fullrecovery/labels/learning; separate bodypath/composition/freshvalidation/data-clockmemorycontract remain. No goal/tolerance/gain/duration scans, secondmacro/phasejump or failed751planextension."}}
{"run":74,"commit":"86b1b1e","metric":0.0,"metrics":{"observed_hammer_target_rollouts":6,"controlled_ticks":2516,"reset_ticks":720,"learning_updates":0,"candidate_goal_steps":30,"candidate_raw_goal_error":3.3045901849734425,"candidate_physical_goal_error":3.304582347741488,"target_completion_gate_passed":0,"actual_hammer_motion_during_stage":1,"candidate_retained_gain":11,"baseline_retained_gain":11,"candidate_central_holds":0,"candidate_secondary_holds":0,"summits":0,"deaths":0,"new_phase_tests_passed":8,"focused_python_tests_passed":49,"full_python_tests_passed":338,"owned_elapsed_seconds":30.22029948234558,"all_closed_estimated_usd":0.4564241866528988},"status":"discard","description":"Causal one-goal observed hammer phase is implemented/tested but times out30steps at3.30pixelerror; unchanged1pixel gate fails, no recovery/design/labels/learning admission","timestamp":1791164643951,"segment":0,"confidence":null,"asi":{"hypothesis":"Repeated causal body-relative pointer updates toward the same fixed world hammer goal can finish observed target geometry within a separately declared30step completion stage, unlike singlepulse handoff","rollback_reason":"Actualtipmotion occurs but no raw/physical1pixel target completion; candidatehits30step timeout. Body stayslowY32/gain11/noholds. Preserve failedcap/tolerance and diagnosticmodule/tests only, no3.4pixelreclassification/extra ticks/recovery/controllerdesign/teacherlabels or paidlearning.","phase_version":"observed-fixed-hammer-world-target-v1","evidence":"artifacts/hammer_target_probe_20261005_v1/verification.json","new_phase_source":"research/hammer_target.py","fixed_raw217_action_actualpostobserve_nextpre_equals_lastpost_only":true,"same_fixedrawpriorrow300goal_offset0_20_pointerformula_noise13105_reset14001":true,"legal_axes128_reach26_to102_no_clipping_caprenewal_or_rearm":true,"queryrelease_notcompletion_bodyalignment_notdemonstrated":true,"existing_stationarytolerance1_unchanged_maximum30steps_oneattempt":true,"baseline299plus30_original_candidate299plusatmost30goalsteps_equalmax329_notterminaltimes":true,"basephase_stays298_calls299_during_targetstage_no_laterprior_or_resumedfeedback":true,"candidate_phase_target_timeout30_and_completiondesigngate_false":true,"candidate_final_pose":[268.88279102749425,32],"baseline_final_pose":[268.888478670426,32],"nominal600central_secondary_gain83historicalexact":true,"all6rawmilestone_controls_caseclock_actionobserve_histories_verified":true,"all3full_samehost_backend_pairs_exact":true,"all299prefix_initialactualpreinputs_and_prestate_equal":true,"oldnominal600_baseline329_candidate300_physicalhistories_exact":true,"338fulltests_expected_faultinjection_flushwarnings_not_livefailure":true,"no_target_gain_tolerance_duration_scan_placement_recordedprefixoverride_secondgoal_or_terminalmacro":true,"allclosed_singlepulse751_fresh8of9_andhistoricalgates_preserved":true,"source_newphase_prior_completedfollowthrough_plan_scripts_parent_budget_deadline_secretstripped_ownedchild_durabletrace_cleanup_bindings_passed":true,"no_teacher_labels_corpus_bodyrecovery_updates_paidreservation_remote_write_deployment_publicrelease":true,"ledgerbytes_unchanged_sevenclosed_estimates":true,"independent_paused_epoch":1791164643.951258,"space_source_revision":"8044439043a1725dc5911577c85096cd04ddc4ae","actual_session":"onstate-20261004-v1","actual_mode":"onstate_study","actual_context":"ed3a53c349d08380401bc2a27d466ea58c378210","closed_historical_deadline_unchanged":1791144140.4793909,"next_action_hint":"Freeze180secondOFFLINE tracking-authority/disturbanceaudit ofexisting6traces/2516rows,0newplay/reset/updates, bindsource/traces/completedreview/script/plan/budget. Inspect30goalstep actualrawpointer13/14 versuscommandedaction/posthammerworlderror andoriginalmotor/slew/reach/body/renderoffset. Determine whetherresidualtracksappliedcursornoise orcontact/servo/geometrylag descriptively; querynotforce. Anydisturbanceestimate onlypastactualpointer+owncommandhistory, neverevaluatorseed/currentfuture noise/unobservedstate. Onlymechanicallysupportedcausalfeedbackproposalafteraudit, freshphysicalcontractbeforeplay. No tolerance/30cap/noisesuppression/goal/gain/phasescan orclosedtargetretry/labels/paidlearning. Completion/bodyalignment/recovery/fullvalidation/data-clockmemorylearnercontract remainseparate."}}
{"run":75,"commit":"f636277","metric":0.0,"metrics":{"offline_saved_traces":6,"recorded_rows_examined":2516,"new_gameplay_ticks":0,"new_reset_ticks":0,"learning_updates":0,"target_post_hammer_query_hit_steps":0,"computed_motor_request_norm_max":7.411529733615897,"computed_motor_slew_change_norm_max":15.934812361341812,"target_reach_min":86.4884072885306,"target_reach_max":90.86486223518651,"raw_pointer_telemetry_error_max":3.784179682497779e-06,"cursor_residual_norm_mean":4.583581040794463,"causal_lag_prediction_error_norm_mean":1.4881566559082458,"causal_lag_prediction_error_norm_max":9.968752764098072,"lag_prediction_error_under_point002_steps":22,"bothquery_free_steps":29,"simple_free_motor_delta_residual_norm_max":4.7075776708059305,"physical_goal_error_min":2.140450749416827,"physical_goal_error_final":3.304582347741488,"selected_proposal_controlled_tick":300,"teacher_data_admitted":0,"all_closed_estimated_usd":0.4564241866528988},"status":"discard","description":"Frozen offline pointer/servo audit shows imperfect causal laggedcursor residual prediction and non-linear movement ordering; one unit past-error command proposal only/no new physical recovery","timestamp":1791165658095,"segment":0,"confidence":null,"asi":{"hypothesis":"Raw observed cursor-minus-own-command residual and original motor ordering can mechanically support a causal disturbance-feedback test without using current/future evaluator noise or tuning failed target gates","rollback_reason":"No new player/learnedpolicy/primarycompletion improvement. Lag estimator stale at changes and simplequery-free0.4 model disagrees with actualmotion; command arithmetic does not establish physicalcorrection, completion or bodyrecovery. Retain verified offlineproposal for separatelocal equal-state cursor-response test only, no labels or paidlearning.","evidence":"artifacts/tracking_audit_20261005_v1/verification.json","proposal_evidence":"artifacts/tracking_audit_20261005_v1/causal_cursor_feedback_proposal.json","source_proposal_verification":"artifacts/tracking_audit_20261005_v1/proposal_verification.json","original180second_offlineaudit_finished_within_immutabledeadline":true,"all6trace_source_project_completedreview_script_plan_budget_hashes_verified":true,"all3fullbackendpairs_and30stage_arithmetic_independentlyverified":true,"all_renderoffsets_original0_20":true,"computed_motor_and_slew_requests_not_showing_original50_40cap_pressure":true,"goal_reach_within_original26_102":true,"queryfree_does_not_guarantee_linearservo_or_reveal_forces_branch":true,"original_Gravity_before_motor_order_verified":true,"strict_lag_estimate_currentpre_rawpointer13_14_minus_previous_actualowncommand_only":true,"no_currentpost_appliednoise_seed_evaluator_or_future_noise_in_predictor":true,"lag_estimate_prediction_stale_at_changes_not_complete_noise_or_failure_explanation":true,"all30counterfactual_commands_legal_on_recordedinputs_only":true,"one_first_targetaction300_not_selected_noiseblock_or_errorminimum":true,"past_estimate_pixels":[0.92791748046875,0.6582107543945312],"uncompensated_pointer_pixels":[-84.0574722290039,-54.50746536254883],"proposed_compensated_pointer_pixels":[-84.98538970947266,-55.16567611694336],"proposed_float32_action":[-0.6639483571052551,-0.43098184466362],"unit_past_error_subtraction_no_filter_gain_goal_clock_scan":true,"proposal_raw_pointer_previouscommand_math_independentlyverified":true,"counterfactual_no_simulated_or_executed_physicaltrajectory":true,"failed1pixel30cap_allhistoricalgates_preserved_no_tolerance_noise_suppression_or_retry":true,"laterbounded_source_proposal_verification_not_audit_retry_or_deadlineextension":true,"no_teacher_labels_corpus_updates_paidreservation_remote_write_deployment_publicrelease":true,"ledgerbytes_unchanged_sevenclosed_estimates":true,"independent_paused_epoch":1791165658.0955834,"space_source_revision":"8044439043a1725dc5911577c85096cd04ddc4ae","actual_session":"onstate-20261004-v1","actual_mode":"onstate_study","actual_context":"ed3a53c349d08380401bc2a27d466ea58c378210","closed_historical_deadline_unchanged":1791144140.4793909,"next_action_hint":"Freeze ONE-step actualcursor response test:nominal600historicalref-fast gate then exact299ordinaryprefix/reset14001/noise13105, uncompensatedsameworldgoal vsoneunit laggedrawpointerminus-owncommand subtraction at300,continuednoise.6rollouts/max2400control+720reset/180work/210ownedseconds, equalactualprestate/fullprefix/oldbaselines/fullfidelity/legalaction/alive. Require strictlyloweractualcursor error relativeCOMMONdesiredgoalpointer, report actualhammer-targeterror/query/travel/bodyresponse evenifworse. Pass onlylatercausalfeedbackimplementation/smoke, not release/completion/recovery/teacherlabels/learning. No noisechange/currentfuture noiseoracle_seed_filter_gain_goal_cap_tolerance_scan or failed30planretry. Any later30stepfeedback study needsnewhonestmemory_commandobservecontract/unchanged1pixel30cap, then recovery/wholevalidation/data-clockmemorylearning separately."}}
{"run":76,"commit":"2939c94","metric":0.0,"metrics":{"causal_cursor_response_rollouts":6,"controlled_ticks":2400,"reset_ticks":720,"learning_updates":0,"uncompensated_actual_cursor_error":1.1374453981212016,"compensated_actual_cursor_error":0.000703795010340456,"uncompensated_hammer_target_error":11.145062380556487,"compensated_hammer_target_error":11.265576587978526,"uncompensated_hammer_travel":4.474497013653487,"compensated_hammer_travel":4.715062720373625,"incremental_hammer_x":-0.3711999999999023,"incremental_hammer_y":-0.26319999999999766,"incremental_body_x":0,"incremental_body_y":0,"cursor_response_gate_passed":1,"target_completion_admitted":0,"teacher_data_admitted":0,"summits":0,"deaths":0,"focused_python_tests_passed":49,"owned_elapsed_seconds":31.341925382614136,"all_closed_estimated_usd":0.4564241866528988},"status":"discard","description":"Equal-state causal past-pointer subtraction improves cursor alignment but slightly worsens hammer targeterror/no bodylift; only feedbackimplementation/smoke admitted, no completion/recovery/learning","timestamp":1791166955955,"segment":0,"confidence":null,"asi":{"hypothesis":"Unit subtraction of one-step-lag raw observed cursor-minus-own-command residual improves actualcursor alignment from the declared firsttarget action without changing noise or using futureoracle","rollback_reason":"Cursor gate passes but realhammer error slightlyworsens andbodydelta0. No primarycompletion, targetcompletion, bodyrecovery, teacher or learnedpolicy improvement. Retain causal localresponse evidence only for separately admitted feedbackimplementation/smoke, no labels or paidlearning.","evidence":"artifacts/cursor_response_probe_20261005_v1/verification.json","all299actualcontrol_fullphysics_histories_and_contrast217preinput_prestate_equal":true,"ordinaryprefix_reset14001_noise13105_continued_noise_unchanged_no_placement_recordedoverride":true,"samefixedrawpriorrow300worldgoal_originaloffset_and_unitgain":true,"actualcursorerror_toCOMMONrawgoal_desiredpointer_strictlyreduced":true,"realhammer_targeterror_worsens_not_hidden_or_promoted":true,"bothposthammerqueryflags_false_notforce_branch_or_completion":true,"bodymotionexactlyunchanged_not_lift":true,"causalestimate_rawprepointer13_14_minus_previousactuallyissuedowncommand_only":true,"past_estimate_pixels":[0.92791748046875,0.6582107543945312],"no_currentpost_appliednoise_seed_case_or_future_noise_input":true,"candidate_firsttargetstep300_not_selected_stableblock_errorminimum":true,"all6full_rawmilestone_proposed_applied_caseclock_histories_verified":true,"all3full_samehost_backend_pairs_exact":true,"nominal600_uncompensated300_sourcehistories_exact":true,"candidateaction_legal_no_goal_gain_filter_clock_cap_tolerance_scan":true,"causalfeedbackimplementation_smoke_onlyadmitted_not_completion_recovery_labels_or_training":true,"closed1pixel30step_failure_allhistoricalgates_unchanged":true,"frozen180work210owned_source_prior_proposal_audit_plan_script_parent_budget_deadline_secretstripped_child_durabletraces_cleanup_passed":true,"no_updates_paidreservation_remote_write_deployment_publicrelease_or_substantive_localtraining":true,"ledgerbytes_unchanged_sevenclosed_estimates":true,"independent_paused_epoch":1791166955.9553962,"space_source_revision":"8044439043a1725dc5911577c85096cd04ddc4ae","actual_session":"onstate-20261004-v1","actual_mode":"onstate_study","actual_context":"ed3a53c349d08380401bc2a27d466ea58c378210","closed_historical_deadline_unchanged":1791144140.4793909,"next_action_hint":"Implement opt-inunitpastcursorfeedback inboundedHammerTargetPhase/defaultoldbehavior exact. Raw217prepost/fixedgoal/OWNactuallyissuedcommand history only; bootstraponce fromlastactualprefixcommand+itsobservedpost. Observeeachstep estimatespostrawpointer*128-OWNcommand*128(notuncompdesired); nextaction subtractsestimate. Strictbootstrap/actionobserve/prepost guards/legalbounds/samegoal_offset1pixel30cap/no rearm orfilters_gain_goal_noise_clockscans. Tests/defaultparity thenfreeze freshsource/rules/plan/180work210owned before boundednominal600/defaultvsfeedbackphase ordinary299prefix_reset14001_noise13105_ref-fast smoke,max6rollouts/2516control+720reset,variableearlystop. Defaultoldhistories exact,candidatefirst300actualphysics reproducescursorcontrast. Require rawANDphysicaltiperror<=1/realmotion/alive/fidelity for localcompletion, notcursor-onlypass; preservefailure. Evencompletion admitscausalphase DESIGN only, bodyrecovery/composition/freshwholevalidation/data_clockmemorylearnercontract separate. No labels/paidlearning or retry oldclosed30plan."}}
